id,text,polarization,political,racial/ethnic,religious,gender/sexual,other,stereotype,vilification,dehumanization,extreme_language,lack_of_empathy,invalidation
arb_41376c7f0c65a1b68730af96d2492df0,"""اليازا"": حادث جديد في المكان نفسه حيث قضى الفنان جورج الراسي... من يعتبر؟",0,0,0,0,0,0,0,0,0,0,0,0
arb_4141cead9e04964460baa63018cf10da,دونالد ترامب: سأقضي تماماً على الدولة العميقة.,0,0,0,0,0,0,0,0,0,0,0,0
arb_4149a45b56cbe2a6a77666f1a083a276,المانيا ضد امريكا انتوا مع مين,0,0,0,0,0,0,0,0,0,0,0,0
arb_415bfeeef6d7e15a0bfbf9b9ddba6f4d," النسوية فكر مثل غيرها من الافكار الغربية 
ضد الدين 
جوهرها وأصولها (كfر ) وخروج من الملة",1,1,0,1,1,0,1,1,1,0,1,0
arb_415f7e76e6d9d3e5fc9997c5eb59c132,النفط يرتفع من أدنى مستوى في أسابيع,0,0,0,0,0,0,0,0,0,0,0,0
arb_41630d544bedf7c16336dd41b14a298f,عندما نقول إن الإرهاب إرهاب سياسي وصناعتة شمالية بإمتياز ، لإن الجنوب لم يعرف الإرهاب إلا بعهد الوحدة المشؤمة مع الجمهورية العربية اليمنية.,1,1,1,0,0,0,1,1,0,1,0,0
arb_4174190933b4fffde043d147798ff27c,على الارض ومع المسلمين في الصلاة  لكن ليس مع المظاهرات ولا الربيع العربي  ولا شاي ربيع,0,0,0,0,0,0,0,0,0,0,0,0
arb_41a00b12cad8c23ae58fec2edb7a3de5,كبر احلام اني لو عندي وجهج ما اطلع يا ثوله ولله اكرهج,0,0,0,0,0,0,0,0,0,0,0,0
arb_41b9d9843237ad1003f5709ea461595f,      ربنا يحفظك لاهلك ولمصر ولنا كلنا ,0,0,0,0,0,0,0,0,0,0,0,0
arb_41bb96a5c86206e57b753322af2c58fd,6 أساليب احتيالية عبر «الهندسة الاجتماعية»,0,0,0,0,0,0,0,0,0,0,0,0
arb_41d4de534bbe666d8d33b440d24a16bd,جرائم #روسيا في #أوكرانيا فظيعة وموسكو ارتكبت خلال ساعات فقط جرائم قد ترتقي إلى مستوى جرائم حرب.. نظام عالمي قذر ومتوحش..,1,1,0,0,0,0,1,1,0,1,0,0
arb_41d6718c5d6ed9e12973e7d9f8a858cf, هم لم يقوموا بانقلاب هم حاصروا البرلمان ولكن الجيش الروسي وعصابات المافيا و الميليشات الرأسمالية المستجدة آبادوهم,1,1,0,0,0,0,1,0,0,1,0,1
arb_420ef982c6b1f1a53ef5b8f27a5e0d72,"كل الفلاحين والصعايدة هتلاقيهم موافقين علي حوار الختان ده ..
لازم العقوبات تكون رادعة ف الاماكن دي لاي حد يختن بناته .",1,1,1,0,1,1,1,0,0,0,0,0
arb_423e0d28250beb0a32bd5492dd9ae4a3,كل الحكومات العراقية عوضت الدول والشعوب المتضررة جراء الحروب على العراق الا الشعب العراقي وهو المتضرر الرئيسي تفرض عليه الضرائب تذهب لرفاهية الفاسدين,1,1,1,0,0,0,1,1,0,1,0,0
arb_423e61fa1291bb5b02892cb5e76c4da2, الله يعطيهم صحة وينصرهم ويخرجون منها سلامات، مغرب دولة إسلامية لا لتصرفات المثلية خصوصا في الشارع العام.,0,0,0,0,0,0,0,0,0,0,0,0
arb_4241c81a711cd596f11c8fbd3de5ad31,هههههههههههههههههههههههه وبيجيك تووانسة يقلك يجب نقل الحج وتدويله روحو نظفو بلدكم كلاب تونس,1,0,1,0,0,0,1,1,1,1,1,0
arb_4244700d032f9878e67d95857c767df7,هو هذا مقام مستعمره سعودية تحت اقذر جزمة,1,1,1,0,0,0,1,1,1,1,0,0
arb_4245fb2ffcfa324b798f7154bec0421b,عمليات تصيّد على «التواصل الاجتماعي» لسرقة المعلومات الشخصية,0,0,0,0,0,0,0,0,0,0,0,0
arb_424f8a0a99e1236611ab7510e874dfa4," هما الانتخابات مزوره؟
الامريكيين انتخبوا ترامب بالاجماع بس انت عارف الدولة العميقة والشلة وذيك العائلة اليهودية وكذا",0,0,0,0,0,0,0,0,0,0,0,0
arb_425c90cde04079a5b5a406479ab65f90,صراحة اتفق جداا انا اذكر بطولات الخليج كان فيها ندية كبيرة و المنتخبات تحضر حالها جيدا للبطولة انا لست من الخليج و لكن كنت اتابعها بإهتمام اكثر من كأس اسيا,0,0,0,0,0,0,0,0,0,0,0,0
arb_4263848975997f109e76ebe1cf10cbba,"  ابو الشرف الي يدافع عن المثلية ""المخانيث"" ،،، جاي يعطينا دروس

أستمتعو بحريتكم وقذارتكم بعيد عنا",1,0,0,0,1,0,1,1,1,1,0,0
arb_4273baa52d751e995de5d9f8a44cb9fb,"هو هذا بطولة رسميا لانه اول مره اسمع بيها
يا بطولاتك يا خليج",1,0,1,0,0,1,1,0,0,1,0,0
arb_42810574c6367ee6c35981a8c61faaef,كيف تضع الإحصائيات محمد صلاح بين عظماء الدوري الإنجليزي الممتاز؟,0,0,0,0,0,0,0,0,0,0,0,0
arb_428bf32e06448daea41b864888f02d3b,الا اذا اراد الحوثيون تهلكتهم فحزب اللات وايران واتباعها سيجثثون من الارض العربية مثلهم مثل اليهود وواجب وحق وشرع ونحن شعوب,1,1,1,0,0,0,1,1,0,1,0,1
arb_42ecf619cf451c802344df55953960dd,مخاوف من انتشار فيروس متحور من شلل الأطفال في غزة,0,0,0,0,0,0,0,0,0,0,0,0
arb_42fee8e5def773fec1de78fb8b586856,"الاكتئاب والقلق لا تعالجها الأدوية النفسية وإنما تهدئها.
هذه الاضطرابات حتى تشفى تحتاج لمعالجة جذورها، والتي أهمها معالجة المسببات (أي الصدمات النفسية والمواقف المؤثرة عموما)، والتي تتم في الجلسات النفسية المتخصصة.",0,0,0,0,0,0,0,0,0,0,0,0
arb_43118ae4368ecaa014464a965e17f372,العما ولا ما بتفرقوا عن البقرة بتعد  عن الأنوثة ملايين  ما بعرف كيف عاملين مطربة,1,0,0,0,1,1,1,1,1,0,1,0
arb_4337f3033ca567ccbf173fc672a19286,"احنا العيال نحترم البنت الي تلبس عبايه وشكلها شكل محترم اذا انتي بس حجاب وحاطه مكياج فا لاتستغربي يجيك واحد مايحترمك من بدايه احترمي نفسك الكل يحترمك
انا ما اقصد شي انصح بس",1,0,0,0,1,0,1,1,0,0,1,0
arb_433e1fdb8cc7f46239b8b95d318f1ee3,شباب الأهلي يبتعد بصدارة الدوري برقم قياسي,0,0,0,0,0,0,0,0,0,0,0,0
arb_434af4c921b0090432b24e1b84f54320," ارفع رأسك يا أخي فقد مضي عهد الاستبداد
لا للاقطاع فقد ولي عصر البية والباشا وكذاك العمدة",0,0,0,0,0,0,0,0,0,0,0,0
arb_435cb91a2e2358a586bf9a7821313204,يا جماعه الراقصات دول ملهومشي اصل بنات شوارع. والاعلام بيصور للعرب ان مصر عباره عن العاهرات دول نسبه السنه 60في الميه من سكان مصر.,1,0,1,0,1,1,1,1,1,1,1,1
arb_437cd7566ddf537f5d3a4d7e3466549a,سعر الذهبأسعار الذهب تستقر قرب أعلى مستوى على الإطلاق,0,0,0,0,0,0,0,0,0,0,0,0
arb_4382df4365afbcb4acbbff59ee8b6c61,عباس النوري: الرئيس السوري أحمد الشرع مُعيّن لا منتخب والواقع مليء بإشارات مزعجة وتجاوزات حاضرة ومقلقة... أخشى من اندلاع حرب أهلية,1,1,0,0,0,0,0,1,0,0,1,0
arb_43891b8101942a1e2ce0be8cf9874fca,كانت الفلبينيه تصور لايف تيك توك انها في المطبخ وفتحت الباب وهربت تركض وتصرخ وتقول عايز يقتلني واتصلنا على اخوي كان عند التلفزيون 😂 بلغناه باللايف وصورناه ومن بكرة قطع لها تذكرة وغادرت الكويت والحمدلله خربت بيتها بنفسها ,0,0,0,0,0,0,0,0,0,0,0,0
arb_4389fbac8ea61affcbbe7fa92a48f110, هذا المهرج يراوغ الرأي العالمي  بالاتفاق مع الناتو  لاستجلاب استعطاف الشعوب …هو يتلقى دعم من الناتو بلا حدود .,1,1,0,0,0,0,1,1,1,1,1,0
arb_43a8bc4362adcbbfe7a8a168648fff2e, #مساجدنا_على_الطرق  جمعية أهلية تسعى إلى العناية المستدامة بمساجدنا على الطرق تجهيزاً وصيانة وفق شراكات متميزة وفعالة,0,0,0,0,0,0,0,0,0,0,0,0
arb_43aa7e8df00c11d0d4a6220c6c8fcd3b,اللي يتكلم ويرفع صوته علي البنت ابونظارات جزمتها فوق راسك ياابن الحرام,1,0,0,0,1,1,0,1,1,1,0,0
arb_43bd4219df604bf1f1387094c9b895c1,تغطية عرب جي تي لل Formula E على حلبة جدة بدعوة من شركة زيكر,0,0,0,0,0,0,0,0,0,0,0,0
arb_43f0ac2a4110dff0edd7c7c3dc6b8684,"بعدك بتدور ع الجنسية الاماراتية
ع الفاضي ريح حالك ما رح يعطوك اياها

تظلقش تسحج",1,0,1,0,0,0,1,1,0,0,1,0
arb_4449f177054a87ab5d62e93611470638,"كأس الخليج تصرفها في البورصة تعطيك حصة تدريبية قبل مباراة في دوري الأبطال

",1,0,1,0,0,1,1,0,0,0,0,0
arb_44722a21e4e72e4f3f7a3ddd3e76559c,الله ياخده ابن الحيوان القذر,0,0,0,0,0,0,0,0,0,0,0,0
arb_447da854fc9800c3084a26c042206129,أشد مراتب الاستبداد التي يُتعوذ بها من الشيطان هي حكومة الفرد المطلق الوارث للعرش القائد للجيش الحائز على سلطة دينية,1,1,1,1,0,0,1,0,0,1,0,0
arb_4484994b66f6bc4570d7afe2b52846fd,"واحد يتابع توم وجيري اعادة ولا يتابع هيج بطوله تعبانه

",0,0,0,0,0,0,0,0,0,0,0,0
arb_4492251aba3bfbac86e551762d7c4fe5,اللبنانبه تقول حنا طلعنا كاظم والكويتيه تقول حنا طلعنا كاظم هو فيه ايه ياكدعان انتو بتاخذو حشيش,0,0,0,0,0,0,0,0,0,0,0,0
arb_44ae9054be95a27a462c0d2dc714a611,العنف الأسري يوجد عند المسيحيين وليس عند المسلمين لانه لايوجد عندهم طلاق لذلك في بلدان المسيحية واليهودية يوجد هكذا قانون أو بما يسمى العنف الأسري,1,0,1,1,0,0,1,1,0,1,1,0
arb_44b56411f5ade955f95ff1a45cf58a90,ياجماعه بكره لوخلصت فلوسهامش هتقول انامالكه سبحان المعزوالي ديمايتمنظربلمال زال زال زال زال زال وال,0,0,0,0,0,0,0,0,0,0,0,0
arb_44c4efc63b13214def04b35e7611e512,كأس الخليج افضل من دوري ابطال اوربا أصلا .. لو بس تعوفون اللواگة و التملّق,1,0,1,0,0,0,1,1,0,0,0,0
arb_44d5cabd761b7dc141ca5269558d6f19,الحق ليس عليها الحق على الناس اللي دايرنلها الشأن ومسمنيها فنانة !!,1,0,0,0,0,1,0,1,0,0,0,0
arb_44ec3f0285997833f97c69def8662e49,وقال الشرع لفلول النظام، «كنا حريصين على حياتكم في معركة التحرير، ليس غريبا ما فعلتموه»، مضيفاً «اقترفتم ذنبا عظيما لا يغتفر، بادروا بتسليم سلاحكم وأنفسكم قبل فوات الأوان». ,1,1,0,0,0,0,1,1,0,0,0,0
arb_44ee66d314a05ab9e2c99254e4028f19,   يعني انتو علشان تهربو من الضرائب غيرتو اسم الشركه   وبتكسبو بالمليارات ومش هممكم حد مهي ماشيه ك…  ,0,0,0,0,0,0,0,0,0,0,0,0
arb_4518f2a5fd44f457ed6d40570eaed688," وفي الأخير هو حقوق المرأة مايعرفها أساسا فكيف بيعرف النسوية؟
صدق من قال بأن أعداد الرجال بديت تقل.😑",1,0,0,0,1,0,1,1,0,0,0,0
arb_452161342d0fed352f7296c09ab906e0,8 فوائد من الوصول الشامل إلى البيانات في المؤسسات المالية,0,0,0,0,0,0,0,0,0,0,0,0
arb_452894031aa49527b305cfc0982f7052,"ايوة يعني هو مصري ولا فلسطيني
ولا ده كان قصد إسرائيل لما قالت مصر هتدير القطاع.
كانت تقصد المصري هيدير القطاع بس هي لدغة في ال ت",0,0,0,0,0,0,0,0,0,0,0,0
arb_45356b81e7bade56897f331554abd53f,"المعركة الأهم في سوريا الآن هي معركة ""الوعي "" الجامع المانع الغير إقصائي.
#تحديات_سوريا",0,0,0,0,0,0,0,0,0,0,0,0
arb_453c04b7d1f6895041f492033a38d3bf,عباراتك  حركاتك غرورك حلوة  انت رئيستهم كلهم  انت دلوعة هذا الزمان بلا منافس,0,0,0,0,0,0,0,0,0,0,0,0
arb_453d5964048ad178a070e509b298b8f2,انا مع جميع حقوق المرأة إلا انها تكون دكتوره في الجامعه,1,0,0,0,1,0,1,1,0,1,0,1
arb_454497fd46f9ed1fdada2503db2d32f7,"هو أنا ليه كل اللي اعرفهم yoga instructors و معرفش ولا yoga student
لو الكل بلطجية، امال مين بينضرب",1,0,0,0,0,1,1,1,0,1,0,0
arb_454cf85049105ef35a1b62090591fa43,رسالة بندق إلي عضو إدارة الزمالك  ,0,0,0,0,0,0,0,0,0,0,0,0
arb_454d96ed70300430ae2ef3af3b001d84,المشكلة  قاعده تتفلسف بالإنجليزي ااففففف😤😤😧😵 و المكياج شي ثاني 😨,0,0,0,0,0,0,0,0,0,0,0,0
arb_455969b8becd4d8aca651e38f15027c1,اخواننا السوريين اعدسوا على رأس فلول النظام والعلوية والنصيرية ولاتدعوهم يتمادوا,1,1,1,1,0,0,0,1,1,1,1,1
arb_455d4fa040cdb3dc09f7ba05fceab39c,"عبدة طقاقة 
الخرا كل ما حركتة فاحت ريحتة 
وأحلام خرا. .. يعني اعطيتوها أكبر من حجمها كويحه",1,0,0,0,0,1,0,1,0,1,0,0
arb_4571782f31a98bd12df6bb6356c6d441,"""روساتوم"" ترفع عمر مفاعلات الضبعة النووية الافتراضي إلى 100 عام",0,0,0,0,0,0,0,0,0,0,0,0
arb_458301072df150f03398f940499f043b,"""أجرت 22 عملية ترميم بعد أن أطلق عليها زوجها رصاصة في وجهها""",0,0,0,0,0,0,0,0,0,0,0,0
arb_459deb05e13a95f3d4a62e00f25fd26e,#أثير| إيداع المكرمة السامية للمسجلين سابقًا تحت مظلة الضمان الاجتماعي,0,0,0,0,0,0,0,0,0,0,0,0
arb_45c63ac54c4fb8b58a64de5c5b1522cb,اصتاذ بدل استاذ ومططفرجش بدل ماتتفرجش اصمعني  بدل اسمعني هههههههههه ليش هيك بتحكي هاي,0,0,0,0,0,0,0,0,0,0,0,0
arb_45c70ad2d57fbbb0b325bcff6a0b5350,"كل لحظة هو تعيس فيها أنا بكون سعيد
منظر بيب مذلول من مدريد من ملذات الحياة",1,0,0,0,0,1,0,1,0,1,1,0
arb_45c86ca21ac1a04877dfcb291ac57077,"الأمير محمد بن سلمان يتوج مالك ""فور إيفر يونغ"" بكأس السعودية",0,0,0,0,0,0,0,0,0,0,0,0
arb_45d1cf060a0e77ccc3296d1d89315880,"نادي الاتحاد السعودي نادي الهلال السعوديッ نادي العين لكرة القدم
عموما انا عايز دكر عربي يوريني نفسه عشان هركبكم والف بيكم الدول العربية كلها😪👑🦅",1,0,1,0,1,1,1,1,0,1,0,0
arb_45d2a725f013f95353065434a110324a,ليش ماتعلقو على الإتفاق التاريخي بين الحكومه السوريه بقيادة البطل السيد الرئيس احمد الشرع وقوات سوريا الديمقراطية ياقناة الفتن والعهر,1,1,0,0,1,1,1,1,0,1,1,0
arb_45ddf4f4b640ec7c27781a82ab9ff380,التحرش بالنساء هي ظاهرة قام بالتحريض عليها الشيوخ السلفية والاخوان في الارياف والمناطق العشوائية والشعبية وبعض من العمال الذين عادوا من الخليج في السبعينات وهدفوا لفرض الحجاب علي النساء كجزء من الثقافة الوهابية.. الاسلام  الصحيح من وجهة نظرهم.,1,0,1,1,1,1,1,0,0,1,1,0
arb_460567c06d8cd139a038bc5bff1278de, الثالوث المدمر لليشرية تجمع بجبهته.. التطرف،والشيطان،والنفاق. ثلاث عدسات يخرب بيته كيف طبعهم بهالجبهه. يمكن تركيب 😂😂😂,1,1,0,1,0,1,1,1,0,0,1,0
arb_4664606bc0d6627c1c87c4e2fd949054,زبدة الموضوع هون ( إذا لم تُحْدِث الأحداث الحالية ثورة حقيقة في تفكير شبابنا وسلوكهم وتمسكهم بدينهم فما الذي يمكن أن يوقظهم؟! ),0,0,0,0,0,0,0,0,0,0,0,0
arb_4665e4db969fdd3d70faa20497276d48, هآرتس: حماس تستعيد قوتها بسرعة وعمليات الجيش الإسرائيلي في غزة تتعثّر,0,0,0,0,0,0,0,0,0,0,0,0
arb_469e6f664e871bcb702913663136e469,عندما تضرب الشيعي بالقندرة على راسه وراس الخلفوه يبدأ الطعن في عرض رسول الله صلى الله عليه وسلم مع ان عرضه مطعون فيه,1,0,0,1,0,0,1,1,1,1,1,0
arb_46b06ecf1078a9569a09c3fa75a6ed8c,إسرائيل توسع حرب التدمير وتكثف حملات الاعتقال في الضفة,0,0,0,0,0,0,0,0,0,0,0,0
arb_46c4cfc1168d1b6c40c68fd4e44c18b8,الواد إبني مايكل أنجلو قالي ياباا يافأر يالي متبنيني و حطيت علينا بتاع أخضر ملزق خلانا شبه البني أدمين ،عايزك تديني من منبع حكمتك تصب عليا من صلب وقارك وتتواضع وتنزل من مكانتك ,0,0,0,0,0,0,0,0,0,0,0,0
arb_46ce7ff453a21d49734a8a9e3f960461,"موت ف الامهات القويه بتعجبنى الام البتكون زى الكلبة ما بترضى ف اولادها
وصف الكلبة الام الشرسه ما قصدى بيهو تقليل حاشا لله بس بتعجبنى شراستها ف اولادها",1,0,0,0,1,1,1,1,1,1,0,0
arb_46d35e9502fd2cfc4ea0edd8e4581632,عضو في الجهاز الطبي لبتروجيت بيسلم علي اكرامي و غالي اثناء علاج اللاعب  ,0,0,0,0,0,0,0,0,0,0,0,0
arb_46d48aa98e766b25e5e13e9e63596337,36.6 مليار دولار أرباح آبل في 3 أشهر.. نمو بـ 7%,0,0,0,0,0,0,0,0,0,0,0,0
arb_470d7c58cf34285aa24893a643bb15aa, من جدك تسأل؟ الجميع يتفق على انه إنسان غثيث كريه محد يحبه حتى أمه مو مره متأكدين من حبها له ومافي حل لحالته هذي غير القمع القمع القمع,1,1,0,0,0,1,1,1,0,1,1,1
arb_471640ad2dead139c6cf66b6b0454885,"هيئة حماية البيانات في دولة أوروبية تستجوب ""ديب سيك""",0,0,0,0,0,0,0,0,0,0,0,0
arb_471c3392fafb85f43a1430122cc28ddb,بداية الشوط التانى تغييرين لبورنموث ستانليس و كينج بدلا من باج و موراى و تغيير لساوثامبتون يوشيدا بدلا من فونتى...  ,0,0,0,0,0,0,0,0,0,0,0,0
arb_4723cbbc66e8661e1b2a76ee081d3539,">كشف الدكتور أسامة طلعت رئيس قطاع الآثار الإسلامية والقبطية واليهودية، حقيقة ما تم تداوله على مواقع التواصل الاجتماعي بخصوص أعمال هدم بمنطقة ""جبانة المماليك"" بما فيها من مقابر تاريخية وآثار إسلامية تعود لنحو 5 قرون، لإنشاء ""محور الفردوس""، موضحًا أن ما تم تداوله عار تماما عن الصحة وأن محور الفردوس بعيد عن الآثار الإسلامية المسجلة بقرافة المماليك.",0,0,0,0,0,0,0,0,0,0,0,0
arb_4724319ad1ed8ae94eebd664543bdc8f,تاريخ كأس العرب للاندية الأبطال الذي استعصت على أنديتنا الأردنية,0,0,0,0,0,0,0,0,0,0,0,0
arb_473177da28fde1280e3759c3f8fddeaf,أحقر إنسانة شفتها في حياتي بصراحه لا دين ولا أدب ولا أخلاق ولا شكل أستغفر الله العظيم بس,1,0,0,0,1,1,1,1,1,1,1,0
arb_473bea3b382172a3697d6cf69e9b0bd7,انا لما كنت صغير بتذكر كانت بطولة قوية وحلوة واستناها بفارغ الصبر بس بالوقت الحالي ماعادت بطولة مهمة وكل المنتخبات عم تشارك بالمنتخب التاني,0,0,0,0,0,0,0,0,0,0,0,0
arb_474d2a219590f448eeaa6ba530ebf1a7,أكثر من 250 ألف شخص يوقعون عريضة لتجريد إيلون ماسك من جنسيته الكندية,0,0,0,0,0,0,0,0,0,0,0,0
arb_4753825b2fdc88ee86d9ffe7713624c5,التنقيب غير الشرعي وأحلام الثراء .. هل يبدد كنوز سوريا الأثرية المدفونة؟,0,0,0,0,0,0,0,0,0,0,0,0
arb_4759077a57043c4296fcc2b5c336c188,26.5 مليار دولار أرباح ألفابت الفصلية.. نمو بـ 28%,0,0,0,0,0,0,0,0,0,0,0,0
arb_478a5756dcbe82e263b1fe79eec6b361, حقد الطبال لا مثيل له لن ينسى الرمز الراحل عندما مسح به الارض ماذا تتوقع من واحد طبال,0,0,0,0,0,0,0,0,0,0,0,0
arb_47ab326ea22aa9fecd7ef617034a4fc5,"    كيف يعني ختان البنات ؟؟؟ 
هل هو يتم فالسعوديه ولا مذكور فالسنه ولا وش العلم 🤣😅",0,0,0,0,0,0,0,0,0,0,0,0
arb_47b7fe1d1a5b3ea6e5f1683aea3e07f5,ضاحي خلفان يتسلم كتاباً عن تنظيم عقود الشراكة,0,0,0,0,0,0,0,0,0,0,0,0
arb_47bdfafdc973563f2323d52f2ac21385,يادى الغتاته ،،ماجمع إلا ووفق،،أتلم تنتن على تنتون واحد نتن والتانى أنتن,1,1,0,0,0,0,0,1,0,1,0,0
arb_47cae65d1e3951eb69ac80d54edf7241,الى مزبلة التاريخ إن شاء الله وموعدك يوم الجنائز,1,1,0,0,0,0,0,1,0,0,0,1
arb_47d22b3679048f0d99b504c925fce057,"ميزتان دقيقتان في اللاعبين المبدعين تفضلت بذكرهما في منشورك الكريم ..
حد فهمي فان اعطاؤهما الفرصة سيجعل المنافسة الايجابية محتدمة على مراكز اللعب في المنتخب الوطني ، وهو امر مطلوب ، لا مكان محجوز الا مع الجودة العالية ..",0,0,0,0,0,0,0,0,0,0,0,0
arb_47d6b82f5391565c7cdb8e4d91ae961a,قلة الوعي و الوعظ هي ما وصل بالمجتمع لهذا الدنو ,1,1,0,1,0,0,0,1,0,1,0,0
arb_47e5d5aa87a96ba2d704f1ef1fbc6e8b,هامور التواصل الاجتماعي إذا شاف صورة او فيديو بالذكاء الاصطناعي,0,0,0,0,0,0,0,0,0,0,0,0
arb_47ef3e1b8823944086b636fcd5e717f3,هل تستحق برامج اللياقة البدنية المنتشرة على تيك توك عناء المحاولة؟,0,0,0,0,0,0,0,0,0,0,0,0
arb_48030e4f406817b5959a82cfa6d2b3e1,"""هرباً من التحرش "" إمرأة ترمي نفسها من ""كيا"" في شارع مطار المثنى ببغداد ..",0,0,0,0,0,0,0,0,0,0,0,0
arb_480bef1c7e07fef53d7bde2e90b3889a,الحرب في أوكرانيا: قوة روسية جديدة من المرتزقة,1,1,0,0,0,0,0,0,0,1,0,0
arb_480f5cd88216d1481f5fedfc89b1751a,أشارت ريما العماري، المتخصصة في الإرشاد النفسي، إلى أن اضطرابات الطعام تتجاوز المشكلات الغذائية لتكشف عن اضطرابات نفسية عميقة. هذه الاضطرابات تنتج عن صعوبة التعامل مع المشاعر، حيث يتحول الطعام إلى وسيلة للهروب من الضغوط العاطفية. العماري شددت على ضرورة التوعية والتعامل مع هذه الحالة كمسألة نفسية تتطلب علاجًا متخصصًا، وليس مجرد تغيير للعادات الغذائية.,0,0,0,0,0,0,0,0,0,0,0,0
arb_4811101df8cd36bc2f1803d063bae49f,"أربع منتخبات إفريقيا وصلت الي دور ربع نهائي كأس العالم 
ويبقى الأسود المغرب
وحدهم من وصلو لنصف النهائي ",0,0,0,0,0,0,0,0,0,0,0,0
arb_4841da1f18accc0344ba029c5318d91e,نزاع قضائي بين صديقين بسبب سيارة فارهة قيمتها 5 ملايين درهم,0,0,0,0,0,0,0,0,0,0,0,0
arb_4853829224f7d95c7799b9f1d5747c86,بمناسبة الحر النهاردة  ، هل تتوقعوا ان العالم يبدأ يفوق و يحل مشكلة الاحتباس الحراري قبل فوات الأوان و لا هنفوق بعد خراب مالطة؟,0,0,0,0,0,0,0,0,0,0,0,0
arb_4871559a58ea20466ef4fb2cf27d72c3,بإمكانهم أن يضحكوا على الاطفال بهذه المخططات .. لكن يستحيل ان يمر الأمر على رجال المفاوضات دون ضمانات حقيقية بوقف الجرائم و إدخال المساعدات,0,0,0,0,0,0,0,0,0,0,0,0
arb_488a1e30ae70168bffbbf78d20c3c05b,ظاهرة في القنيطرة دعما للجيش السوري في حربه ضد فلول النظام المخلوع,0,0,0,0,0,0,0,0,0,0,0,0
arb_489efb7418c1322d93b69068f565c864,"متى كانت الخدم تتكلم عن الملوك ؟؟؟
حبيبي هذا القيصر علم في رأسه نارُ 
والي ميعجبه الصحراء واسعه",1,0,1,0,0,1,1,1,0,1,1,0
arb_48ae50f85e13b9bbfdbbc0aa8886309f,من العالم.. فيديو صادم لانتحار شاب مصري وانهيار جسر في كوريا,0,0,0,0,0,0,0,0,0,0,0,0
