id,text,polarization,political,racial/ethnic,religious,gender/sexual,other,stereotype,vilification,dehumanization,extreme_language,lack_of_empathy,invalidation
arb_7a83debb018b7b8463ccd32782e8f7f0,"لعن الله مصر التي قال الله فيها سأوريكم دار الفاسقين  بلد الأكفر (قديما الأزهر الشريف)
 مصر + الجيش  = عجل بني اسرائيل.",1,1,1,1,0,0,1,1,1,1,1,1
arb_7a9039c2115b8408aa2bb5d95b93e048,٥ دقايق والتعادل السلبي وجانب دفاعي من بتروجيت ومحاولات من الاهلي,0,0,0,0,0,0,0,0,0,0,0,0
arb_7ac6725108aa20fd8c84a0f4500b8391,هاد روسيا عم تدعمهم من تحت الطاولة !! هم ما معهم شي هزىربوا عالجبل و ما معهم شي !! قوات روسيا حاولت اكثر من مرة الدخول على طرطوس وليفرضوا سيطرتهم و يجتمعوا مع فلول النظام  و يحاربوكم !! الروس غدارين و قذرين و لازم يطلعوا من سوريا بسرعة,1,1,1,0,0,0,0,1,1,1,0,0
arb_7acb3124eca810f0d40161507f25370f,     عايشة الدور مع نفسك كلامي واضح كل حرف و رقم في القرآن لحكمة لكن هوس التكفير ذابحكم,1,0,0,1,0,0,1,0,0,1,0,0
arb_7acf4f0d7f67d634f3b848cf1a4669fb,"كانت لها أهمية لما كانت المنتخبات الخليجية لا تنافس قاريا...

",0,0,0,0,0,0,0,0,0,0,0,0
arb_7ad7f111423df9b709942adbe9b04b10,أحلام رووووووووعه بكل شي  احبببببببببببببببببببببك من كل قلبي,0,0,0,0,0,0,0,0,0,0,0,0
arb_7ae1bece7c1edd394bb4c48e79119abf,تقل دم لا مثيل له .. عسيرى ايه وميسرى ايه,0,0,0,0,0,0,0,0,0,0,0,0
arb_7b160e7fcda4a58c6ca53dcb896867bf,"هل تركت غزة لوحدها ؟؟؟
قل استخلصها الله لنفسه سبحانه وتعالى عن سائر الكون",1,1,0,1,0,0,0,0,0,1,1,0
arb_7b32b5c3a80672fdc889d3056fcf400b,يجيك واحد راسه مربع يفضل دوري الابطال على كاس العالم,0,0,0,0,0,0,0,0,0,0,0,0
arb_7b3addfeb9f30244305af7edbec324e3,  مو هو قتالهم بالانمي محرف شوف مانجا و مصايب الي عملها اكاينو في اللحية و اللحية ما قدر غير يدرله ضربتين,0,0,0,0,0,0,0,0,0,0,0,0
arb_7b53f81b4508e0ba4bf2e1f7663a1ecb,عمرة رمضان.. كيف تستعد لإحدى أجمل رحلات حياتك؟,0,0,0,0,0,0,0,0,0,0,0,0
arb_7b5c3d024eed840e4f0927a7103ba286,"الأسواق العالمية""فوتسي"" تعلن ترقية ""العقارية"" السعودية و""باركن"" الإماراتية إلى مؤشرها العالمي",0,0,0,0,0,0,0,0,0,0,0,0
arb_7b6bf27e1cc46734a74e2a80e4a29138,**تقرير تسوية الميزانية لسنة 2022 يكشف عن ضعف تحصيل الضرائب في الجزائر!**,0,0,0,0,0,0,0,0,0,0,0,0
arb_7b8e28ad795d34dea2d973d4d219575d,مدرب باراجواي يحفّز لاعبيه في   بسيارات هدية  ,0,0,0,0,0,0,0,0,0,0,0,0
arb_7b98adb60d2f682744deb0cc81e2dc5c,فعلا قائد ذكي وبيعرف كيف يخطط لكل مرحلة ، الله يقويه ويصلح بطانته ويجعل فيه الخير للبلاد والعباد يارب,0,0,0,0,0,0,0,0,0,0,0,0
arb_7ba24c14ccbb7db20e0b851a19323177,طبعا الثقافه البيئيه تلعب دور في تنشأة الشخص وتحدد شخصيته وبالتالي تنعكس على ستايله,0,0,0,0,0,0,0,0,0,0,0,0
arb_7bbceb6691a03ffe1f5d02fb47a905f6,لاتحزن نساء قحاب معرفه تونس تيلند هههههه وبره سرك بير,1,0,1,0,1,1,1,1,1,1,0,0
arb_7be64e81beface1ac0e7b901904e1b5d,#الجزائرالآن ...تونس ترفض ما جاء في بيان المفوض السامي لحقوق الإنسان,0,0,0,0,0,0,0,0,0,0,0,0
arb_7c10c7e2196ecefd770c81f93f10d28b,#سوناطراك توقع عقداً جديداً للمحروقات مع شركة سينوبك الصينية,0,0,0,0,0,0,0,0,0,0,0,0
arb_7c2fe4e0104d50192736422094a6ca02, انتفاضة ايه يارفضي  ، محتاج مصاري  سيارة جديدة لابنك يخرب بيتك شو افاق وشحات,1,1,0,0,0,1,1,1,0,1,0,0
arb_7c3190338eac0392ef6fe32f789f98b3,  ممكن مصاريف الإعلانات اللي اخدها ابن الفنان عادل إمام نصرفها على تحسين مستوى الخدمه؟؟,0,0,0,0,0,0,0,0,0,0,0,0
arb_7c368a050fe0fa3f2e3ce9381b044a92,لطيفة فنانة كبيرة ومحترمة وهي مدرسة متجددة وراقية وجديرة التعليم,0,0,0,0,0,0,0,0,0,0,0,0
arb_7c4574c60366305a6544e126c674c18a,والنبي يا اخواننا دي المرة العاشرة اكتب كده اي حد راجل او ست خايف علي نفسه من التحرش والاغتصاب الالكتروني وعامل locked profile ميبعتليش عشان بعمل accept واشيلهم من القرف,1,0,0,0,1,0,0,1,0,0,0,0
arb_7c62a72557e8cbbc7ef8f1ea63e6c151,عطاها زلعة حلوة وتستاهلها عدوة الدين المدعية الثقافة والتقدم وقتلك تونس مدنية,1,1,1,1,0,0,1,1,0,1,0,0
arb_7c9448cfefd90ef2c9de372da2bfc5f6,مسجد سادات قريش أول مسجد تم بناءه في مصر بل وفي إفريقيا كلها وهو أقدم من مسجد عمرو بن العاص وتم بناءه عام 18 هجريًا,0,0,0,0,0,0,0,0,0,0,0,0
arb_7cb801abbca55a51e3df110976d04d7a,مع العلم اسعار البترول انخفضت على مستوى العالم .. من هنا تعرف ان الحكومة كانت بتضحك عليك وتم التسعير مش تابع للسعر العالمي دي تعليمات صندوق النقد,0,0,0,0,0,0,0,0,0,0,0,0
arb_7cdf756d152212216180aec5715df521,"#عاجل |
مصادر ميدانية تتحدث عن انتفاضة قبلية داخل مديرية بيحان بشبوة ضد تواجد ""ميليشيات الحوثيين""",0,0,0,0,0,0,0,0,0,0,0,0
arb_7cec9e07a144993c5b614141f67eac71,عاجل.. رسائل ومكالمات تسرق حسابك البنكي .. 4 طرق يستخدمها الهاكرز للنصب الإلكتروني,0,0,0,0,0,0,0,0,0,0,0,0
arb_7cf8b3649d80bd5a822c25f450dd6680,خويا الساحلية ولاد قحبة يفطرو رمضان مهمش الرجال جماعك الجنوب خاطينا برجالنا,1,0,1,1,0,1,1,1,1,1,0,0
arb_7d00bb9e5edb7addc7afe139045b4940,استعملي حبوب الاجهاض  الطفل يحتاج مسؤولية كبيرة,1,0,0,0,1,1,1,0,1,1,1,0
arb_7d1e8351cd3cba0a85cdcd00698765ca,يعني ان يزيد لم يقتل حسين هههههه منطق الاغبياء سواء من السنة او منكم,1,0,0,1,0,0,1,1,0,1,1,1
arb_7d2a98eac0d9090bc51328179271888f,إن كان يغالط فى أحداث مصر حتى يلوم الإخوان عمال على بطال، فما بالك بما يحدث باليمن.,0,0,0,0,0,0,0,0,0,0,0,0
arb_7d3317ceea442cfd9b8b799bb269e73e,"الي ما تتحجب وتحط الحجاب دايما علي جنب والشعر كله يبين ليش ما تقط الحجاب وتفكنا ؟

ليش استخدام الحجاب كرمز وستايل ؟",1,0,0,1,1,0,1,0,0,0,1,0
arb_7d3de1ad6ded544021bff96ff24168ed, يعني ماممكن نلاقي واحد بس بينقل احتجاجات ايران وعم يدعما بس بدون مايحرف ويكذب؟ القافلة كانت مشتقات نفطية رايحة للبنان مو اسلحة,1,1,0,0,0,0,0,0,0,1,0,0
arb_7d47123f7b49a7b5614a49ae252f60df,إنّ الرشوة من الموضوعات الهامة ذات الطابع الاجتماعي والاقتصادي ،لأنها في كثير من الأحيان تعطي صورة لما يصيب المجتمع من تفكك وانحلال,0,0,0,0,0,0,0,0,0,0,0,0
arb_7d7adc5c3bc14a0d4f89c8806a204791,ثلاث وفيات بحادث سير مروع في البصرة #السومرية,0,0,0,0,0,0,0,0,0,0,0,0
arb_7d863ca0bd9d9050ec9aaa39a2b3b6cc,صورة تلتقط طيور الزرزور خلال تشكيلها طائرًا واحدًا عملاقًا,0,0,0,0,0,0,0,0,0,0,0,0
arb_7d89faa0b6eedc3faaff0d5cff6ba77f,التوتر الطويل الامد بيزيد الاكتئاب والقلق لان بيخبص توازن النواقل العصبية، متل السيروتونين والدوبامين، وهيدا الشي يؤثر على الذاكرة والتركيز، واحتمال الإصابة باضطرابات المزاج,0,0,0,0,0,0,0,0,0,0,0,0
arb_7d8b38472c2af4613006837087cee6dc,الوسط الفني وسط حثالة الا من تاب وتاب الله عليه نسأل الله لنا ولهم الهداية,1,0,0,0,0,1,0,1,0,0,0,0
arb_7d9aadf9e3676a7f5d16f0c50028b0bf,"بوجاتي تقدم حزمة تحديثات جمالية خاصة لتوربيون ب 8 أنابيب عادم وسعر 900,000 ريال",0,0,0,0,0,0,0,0,0,0,0,0
arb_7da3d1977d7d6b6d10c7960aa6ff25d9,اني صراحة كنت أكره أحلام بس أحس متغيرة هذي اليام,0,0,0,0,0,0,0,0,0,0,0,0
arb_7da8ea7e538d2ecff1f27932c7c8e96a, هو سعر جيد للدول العربية الطاقوية وإقتصادها بقي إلا تحقيق الأمن الغذائي بزراعة أراضينا وصناعة أسلحتنا بأيدينا.,1,1,1,0,0,0,1,0,0,0,0,0
arb_7db5742d69302379d10920d51726dc06,هذي انسانه غريبه شايفه نفسها وهي نفسها مو واثقه بنفسها غلط تخلوها بكذا,0,0,0,0,0,0,0,0,0,0,0,0
arb_7dc6c1fd36c5c6d7226193b081a39097,ضريبة الأراضي غير المبنية في #آسفي: الأغلى في المغرب!,0,0,0,0,0,0,0,0,0,0,0,0
arb_7dd0cbd6c0309819c559b837b8803335,فليك يطالب لاعبي برشلونة بالحسم أمام أتليتيكو مدريد في كأس الملك,0,0,0,0,0,0,0,0,0,0,0,0
arb_7dd870d2d725e300652aba77e1cef2ff,فاول للاهلي من الناحيه اليمين قريبه من نص الملعب ,0,0,0,0,0,0,0,0,0,0,0,0
arb_7df84cba1d13b4dfa69f975870ad4e4d,دا الإعدام شويه عليه دا مجرم موتها ودخلت انت السجن أو اتعدمت مفكرتش بولادك الله يلعن الا ربوك,1,0,0,0,0,1,0,1,0,1,0,1
arb_7df89a51ceddc78dbce8294964ee65e6,رئيس الاتحاد الإيطالي يثير الجدل بشأن اليهود  ,0,0,0,0,0,0,0,0,0,0,0,0
arb_7dfba86e9a19ac77d15accdaec06b9b5, داعش غبت عن ايران كل هاذي المدا وعندما بدا الحراك في ايران اتات داعش,1,1,0,0,0,0,1,0,0,0,0,0
arb_7e209737bcf26e3a22900840ed9a010c,من اجمل البطولات كاس الخليج ان شاء الله النجمه الخامسة والثانية على التوالي لمنتخبنا الوطني العراقي ,0,0,0,0,0,0,0,0,0,0,0,0
arb_7e25fdd6efb71a71c9360919ad3954f9,زمان الفتن اللهم أقضي اعداء الدين ربي دنيا دوم لحد لفلوس تقعدش عمركم تتقدمو بلاد عملاء لصهاينة,1,1,1,1,0,0,1,1,0,1,0,0
arb_7e368ed4de4f4a09f06f123a0549f215,سياسة التجويع ليست مجرد فشل اقتصادي، بل هي تكتكه سياسيه لإضعاف الشعوب وجعلها أكثر قابلية للخضوع والهيمنه ...!!!,0,0,0,0,0,0,0,0,0,0,0,0
arb_7e9a68cd56c247cb69713490ffc0cf78,حتى اما تقدم على انك تلبس شماس فى الكنيسة يوم العيد محدش بيرد مش عايز اشتم,0,0,0,0,0,0,0,0,0,0,0,0
arb_7ea4b37fa1b6cbebde92525537e80c92,قصة مريبة.. وفاة مهاجم نيجيريا بعدما أعد الشاي لصديقته,0,0,0,0,0,0,0,0,0,0,0,0
arb_7eb7c91f1f555574bafea37ba35b9589,الشيعة مش مهم عندهم الأصول  المهم يزيدوا اعدادهم في العراق حتى لو زيفا و كذبا.  ,1,1,0,1,0,0,1,1,0,1,1,1
arb_7f03f7dc5b020d7e8e5f5382bb4ae889,"الحكومة ستذهب الى زيادة الضرائب لمحاولة تعظيم الإيرادات بعد ""إشعار"" من صندوق النقد الدولي للعراق بضرورة خفض الموازنة التشغيلية.",0,0,0,0,0,0,0,0,0,0,0,0
arb_7f218e13d39ed4d6232f5aae659599b0,"""الأشخاص ذوو الوعي العالي لا يعرفون الإساءة ، فالإساءة تنشأ من نقص الإدراك والفهم العميق"" ",0,0,0,0,0,0,0,0,0,0,0,0
arb_7f3a2494474aef390ef1f9a5eb443aa6,الاتحاد السعودي للسهام يتوّج الفائزين في منافسات «السهم الأسود»,0,0,0,0,0,0,0,0,0,0,0,0
arb_7f52bfed150528a41fc82db87ff12b25,إلزام شركة تأمين بسداد 72 ألف درهم فاتورة إصلاح مركبة,0,0,0,0,0,0,0,0,0,0,0,0
arb_7f5677cbca057b5643c2d099254ef4f1,مصورة ترصد العلاقة بين والدها وأخيها غير الشقيق على مدى أكثر من 20 عامًا.. قصة عن العائلات وصراعات الحياة,0,0,0,0,0,0,0,0,0,0,0,0
arb_7f586385a7e58c33275bdb6b46e732ab," مع العبقريه المصريه
في الاداره
مش هتقدر تغمض عينيك
ايه ثاني
الطريق الى جهنم
واللعب مع صندوق النقد
صندوق الشيطان",1,1,1,0,0,0,1,1,0,1,0,0
arb_7f79f0caf6be46326bd406cc48fb47d1,ماهذا الحقد والغيرة الدفينة عمرهم ما يصلون للمستوى الراقي الي وصل له كاظم,0,0,0,0,0,0,0,0,0,0,0,0
arb_7f9d703cadebe2eba3b6c39d8e01daa2,متعود يسوق السيارات المفخخه ويقتل الابرياء ويشرب الخمر ويصلي هكذا هي اخلاق بني اميه الجبناء الانجاس الدواعش الإرهابيين النواصب ورىسهم الارهابي الداعشي المجرم اللقيط الجورابي #الشرع,1,1,1,1,0,0,1,1,1,1,1,1
arb_7fa61bb0f26590a7b869e67d3e5765d0,اوقح جن.س بشري هو هذا النوع لو وجدته في حساب احذف المرض لانه سوف يعادي الجميع بالكذب و نشر الاخبار الزائفة مثله مثل قناة الجزيرة و من معاها لا مصداقية لهم الا عن طريق الاعلام الغربي اسيادهم الاحرار,1,1,0,0,0,1,1,1,0,1,0,0
arb_7fabeab34b0fc5cec904de387e5e83cc,امنيتي اشوف كاظم يتكلم بسوء عن احد ...  مستحيل.. كبير يا قيصر,0,0,0,0,0,0,0,0,0,0,0,0
arb_7fbbcc7eb43d5e99f1c377924f7afcad,عاجل | زعيم حزب الليكود المعارض بنيامين نتنياهو يتوعد بإلغاء اتفاق ترسيم الحدود البحرية مع #لبنان في حال فوزه.,0,0,0,0,0,0,0,0,0,0,0,0
arb_7fc5b290b5b61a3c40629f7a3fec4ee5,عرف أجدادنا الاكتئاب لذلك صنعوا أول مستشفى نفسي في التاريخ,0,0,0,0,0,0,0,0,0,0,0,0
arb_7fc8c9cae4675103e606b24969755c50,نذكر أن اخر بطل كان المنتخب الجزائري بطل نسخة 2021,0,0,0,0,0,0,0,0,0,0,0,0
arb_7fce109ca26274e5c71868810145f95e,اقسم بالله العظيم اني اول مره اشوف داعشي يحجي عن للانتهاكات هههههههههههه وبسط الامن وانته اختصاص جهاد النكاح والذبح وتهجير واعتقال الأبرياء والقتل على الهوية,1,1,0,1,0,1,1,1,0,1,0,0
arb_7fd2a9b013ac91725a62090d53bb25d6,"يا ولاد الكلب هو حلال لما كنتوا بتقتلوا الناس على الهوية والانتماء والي هم فعلا ابرياء في الميادين، وحرام على السوريين يحفظوا بلادهم من هجمات فلول النظام السابق!؟
ياخي شوية معرصين قواويد أنتم!",1,1,1,0,0,0,1,1,1,1,0,0
arb_7fd6018729a5cee3d39b2922c6c3d527,"خلاااااااص تم الدعس والفعس والمعس والفطس بالصرامي والاحذية والنعالات القديمة 🥾👢🥾👢 
على اخت فلول  النظام وايران وكالابها 💩🇮🇷👹🔥",1,1,0,0,0,0,1,1,1,1,0,1
arb_7fe9870a9386afee4e702b6c380fc492,مشكلة مصر بدأت منذ إنقلاب الزعران واللصوص والمتآمرين ضد الشعب في سنة 1952,1,1,0,0,0,0,1,1,0,1,0,0
arb_7ffdd458ecfda4ac72a0a9fe765d88bc,مؤثرات وممثلات تورطن في استدراج الضحايا.. الاستيلاء على 900 ألف درهم من ضحية ابتزاز إلكتروني,0,0,0,0,0,0,0,0,0,0,0,0
arb_7ffe3e699288be596837990b6eeb151c,"""قنبلة"" الموسم.. ميسي يقرر العودة إلى برشلونة",0,0,0,0,0,0,0,0,0,0,0,0
arb_80061adb13f094e9b2760c6f810454d4,إنهاء مهام لمياء بوجناح الزريبي رئيسة المجلس الوطني للإحصاء,0,0,0,0,0,0,0,0,0,0,0,0
arb_800ea76c8416441d67f273971e7343cf,استغفر الله اعتقد ان احلام صناعة صينية وليست مخلوق لان الله عز وجل لم يخلق هذه الكائن الذي اسمه احلام,1,0,0,0,1,1,1,1,1,1,0,1
arb_8017d7909002f479b35942207ac32cc1,من الضرائب إلى الحد الأدنى للأجور، سيتغير المشهد المالي للأستراليين بشكل كبير اعتباراً من الأول من تموز/يوليو.,0,0,0,0,0,0,0,0,0,0,0,0
arb_802bbef3349ce88e7ca261c9556a4513,ليش ميمي وغير من عطلات وين نوديهم خطية مانحب الفوز احنه,0,0,0,0,0,0,0,0,0,0,0,0
arb_803da4d0174da128709f5cb4c9ed3b2d,سيبك انه علم الطاقة اللي انت قصدك عليه هو مش دارسه ..فمش فارقة ... للأسف هو بيقول اي كلام يبان انه منطقي و مفيد و هو كلام فاضي هجص ,0,0,0,0,0,0,0,0,0,0,0,0
arb_80402ac8ae3b4eea51f553ce998cf7ea,    دي قمر في كل حاجة تعملها و ادوارها جميلة زيها هي مش ايتن يبقى قطعة سكر تتكلم   ,0,0,0,0,0,0,0,0,0,0,0,0
arb_80686a7850eebb392e2956c83d348803,اتفاق الدوحة للسلام وفّر أرضية طيبة لانطلاق الحوار الوطني,0,0,0,0,0,0,0,0,0,0,0,0
arb_808ce1a582616932041fd5ea8abb43c6,الفنانين مسخروا نفسهم بالسياسة يا ريت كانت التهت بفنها كانت ظلت بقيمتها...هيك نزلت لسابع ارض,1,1,0,0,0,0,1,1,0,0,0,0
arb_80b160163721505a85f6ba07d705d16f,الكويت تسجل أبرد أيام فبراير منذ 60 عاماً,0,0,0,0,0,0,0,0,0,0,0,0
arb_80c36fac51c25683f5029c32619f2fc8,  لازم لاعيبة الاهلى تلعب بسرعه ونخطف هدف لو الشوط الاول خلص تعادل هاينزلو يدافعو ويلعبو بنفس اسلوب شمال افريقيا 😂   ,1,0,1,0,0,0,1,1,0,0,0,0
arb_80d11ad899f0e40d174fbdae190f9d50,"انت لو عندك شرف ما تسوي هيج لغير  ناس يجي يوم ويسون لشرفك هيج
طبعا اني ما احبهة ولا اكرهة لاحلام بس عيب هالحجي يا عار",0,0,0,0,0,0,0,0,0,0,0,0
arb_80d316abc126e4f0780b26fe9bed5c4e,حاطه روج من تحت مناخرها لغاية شفتها اش ده,0,0,0,0,0,0,0,0,0,0,0,0
arb_80d44a5dd04eeb0190d64a98abde3617,"مشكلة هذا الجيل من البرازيليون انهم اتو في زمن
الأسطورة #ميسي",1,0,0,0,0,1,0,0,0,1,0,0
arb_80d4d583503dd604d54395b760d73cf6,هههههههههههههه يا ليتك ما سويتي شعرك,0,0,0,0,0,0,0,0,0,0,0,0
arb_80e1e5c45d976dd26ec0d465829035f5,ترند الزمالكاوية و هم عاملين فيها بيشجعوا الاهلي عشان النحس بايخ جدا .. هتودينا فين تاني يا اتينشن و يا سوشيال ميديا.,1,0,0,0,0,1,1,0,1,0,0,0
arb_810a9c7b8636d04705c92ed9a45bb5a5,والكورد يحتاجون إلى قرون حتى يتصرفون بدون خيانة فخياناتهم في كل دولة على حساب حجمهم فهم خونة دولهم بامتياز في تركيا والعراق وسوريا,1,1,1,0,0,0,1,1,0,1,1,0
arb_811454b8942a07f8933a59d402a15d35,تساؤل حقيقي؛ ليه العالم يعاملنا كأننا مضطرين نتقبل المثلية؟ زي ما لهم رأي انا لي رأي بالموضوع اني مش متقبلة بكل سهولة.,0,0,0,0,0,0,0,0,0,0,0,0
arb_8120ca8b488e8fdd14cbc7314870f9b5,فنانتة العرب نوال الكويتيه بلا مناااافس الفن ذوق واخلاق واحلام ماااااعندها ذوق ولا اخلاق ولا عندا ادب,0,0,0,0,0,0,0,0,0,0,0,0
arb_81343c44fcea17dd285901f456084fac,وزير الخارجية عبد الله بوحبيب: المطلوب من مجلس النواب إقرار القوانين التي أحالتها الحكومة والتي يريدها صندوق النقد,0,0,0,0,0,0,0,0,0,0,0,0
arb_814e8c68b8ba0aa86bcb71d9fae7b37a,مع احترامي بحياتا سورية ما كان فيا حروب طائفية . كان في شيعة ايرانين وعلوية( اسدين ) ضد كامل الشعب السوري الواحد,1,1,1,1,0,0,1,0,0,1,1,0
arb_815faf0886a0b3620fe6671615b7942c,ليش الناس عاملينلها قيمه لهالدرجه ومعبيرنها لا تحضرو اغانيها ولا تسمعوها العما ضرطونا اذا هيي عاهره مشكلتها والذنوب ذنوبها,0,0,0,0,0,0,0,0,0,0,0,0
arb_818710ba72c1279af8c81af89ca528ae,النظام خبيث يصنع يوسخ يلطخ اهل السنة الاسلام ينما غافل عما يفعل الظالمون,1,1,0,1,0,0,1,1,1,1,0,0
arb_81f6229ce89a5fd513e7ec58982bd507,"بس لو نتخلص من نضريت المحلي احسن من المغتربين جان صار براسنة حض
بدل ما تدور فلالن وفلان علي الحمادي ما يلعب وينزلي ميمي حرام اذا يندل الكول وين",0,0,0,0,0,0,0,0,0,0,0,0
arb_81ffec13413aacad104945803b320e6a,الخلايجه كانوا في أرضهم يرعون الإبل والأغنام ثم صارو يرعون الأمم بعد مافتح الله عليهم خزائن رزقه,1,1,0,0,0,1,1,1,0,0,0,0
arb_822d325c4d13c452d4cb95c4a33a512c,اييه ع كأس الخليج و منتخب الإمارات ,0,0,0,0,0,0,0,0,0,0,0,0
arb_823535a4d8d61035a8f2c7086d7f5396,"دولة أوروبية تحظر تطبيق ""ديب سيك"" للذكاء الاصطناعي",0,0,0,0,0,0,0,0,0,0,0,0
arb_823cbe6287223c6c088f5b277e2a0572,مش معنى انك تكبر اعضائك بقيت انثى..بص لنفسك تانى كده ..شكلك راجل بردو رغم الكورتين بتوعك..,1,0,0,0,1,0,1,1,0,0,0,0
arb_824800afaf33aa62366cde3c719b3ff5, لا تلومه طبال ومهرج يتعتاش على اكتاف الناس اللي اكبر منه مسكين ومن الخمسه باقي ماثره عليه,0,0,0,0,0,0,0,0,0,0,0,0
arb_825229f688abe4ffa6b1bcee8f2f1c02,"استغرب من الفنانات اللي يرضون يطلعون مع عادل كرم 
سفيهه وتلميحات قذرة احس عيب عع احد يرضى بهالتلميحات حتى لو من باب مزاح 🌚",1,0,0,0,1,1,0,1,1,0,0,0
arb_825b2030bfd35a8ac0d0df1c5e5bd706,"لأن أصلا عرب أسيا مالهم تاريخ ببطولة كأس العالم...

",1,0,1,0,0,1,1,0,0,1,0,0
arb_825b41c1b5e2491468a2afb322dff457,"عندي سؤال محرج
هو اللي بيجلدوا فيلم أصحاب ولا أعز علشان كام مشهد عن المثلية.. شافوا فيلم أسرار عائلية؟ 😳",0,0,0,0,0,0,0,0,0,0,0,0
arb_827b549a851173553d012550e1b74a66,والله يا احلام تبقين بعيني زباله مشتمع يا فاشله,1,0,0,0,1,1,0,1,1,1,1,0
arb_828819803dc34838aac4f55b6f84b2ec,السعودية تهدي منظمة الأمم المتحدة لوحة فنية,0,0,0,0,0,0,0,0,0,0,0,0
arb_8290ca0132018cedbff7af3104754037,"بلااااااش التطبيل للمرشحينننن 
بلاااااشششش التطبيل للمرشحين 
المرأة و حقوق المرأة تعتبر مادة لها ثقل يستخدمونها للتكسب الانتخابي.",1,1,0,0,1,0,1,1,0,1,1,0
arb_82b57be3b371c8f340e0397dcda2cb47,شرطة عجمان تعيد طفلاً مفقوداً لوالديه في منطقة المنامة,0,0,0,0,0,0,0,0,0,0,0,0
arb_82bb0a2f79946a14b3cc349fca056742,"اخيرا شوفت انفانتينو مذلول ومش قادر يقعد حتي
ولما يجي الدول العربيه يقعد ويحط رجل علي رجل
قدام ملوك وحكام الدول العربيه",1,0,0,0,0,1,0,1,0,0,0,0
arb_82c0d7efcfce9ffa1bb75b269bacf939,كثير من المنتمين لهذا التيار الإسلامي يتمنون فك أسر إخوانهم المعتقلين وزوال حكم السيسي لكنهم في الوقت نفسه لا يعدونها قضية مهمة في حياتهم. لذا فهم يطبِّعون (من التطبيع) علاقاتهم مع أعوان السيسي وأنصاره من مشايخ ودعاة وممثلين.,0,0,0,0,0,0,0,0,0,0,0,0
arb_82cf9690ec8439fcd604802594443609,إلزام شركة بدفع 56.4 ألف درهم مكافأة نهاية خدمة لموظف,0,0,0,0,0,0,0,0,0,0,0,0
arb_82d88c32791f941dc3675c5b7cea0fc2,فصل عام للكهرباء في معظم أرجاء محافظة اللاذقية بسبب حدوث انقطاع في خط ال 230 ك.ف (توتر عالي) المغذي للاذقية، بسبب الأعمال التخريبية الناتجة عن العمليات الإرهابية التي نفذتها فلول النظام البائد,1,1,0,0,0,0,0,0,0,1,0,0
arb_8309af05e8c10ad5ee0fa76bfc2a090f,بلي نقلعو الصوم اعلمو جهلاء ملحدين المسيحيين اليهود يصومو الأوربيين يصومون الصوم مليح للصحة,1,0,0,1,0,0,1,0,0,0,0,0
