id,text,polarization,political,racial/ethnic,religious,gender/sexual,other,stereotype,vilification,dehumanization,extreme_language,lack_of_empathy,invalidation
arb_b4c770d0e1370eaa3abeaed2988219d5,إغلاق 29 منشأة غذائية في الفجيرة خلال 2024,0,0,0,0,0,0,0,0,0,0,0,0
arb_b4db4542808072d791f1fdfd4258c8bc,"استدعت نقل عدد من المشاركين إلى المستشفيات.. ""تحدي الباراسيتامول"" يشيع التسمم بين مراهقي فرنسا #فرنسا #المستشفيات #الباراسيتامول #التسمم #short_story",0,0,0,0,0,0,0,0,0,0,0,0
arb_b50b66f8f8d51fcd4fbaf6a90c6fb15a, بن سعود و الكنيسة النجدية بفرعيها المدخلي و الجامي لعبوا دور كبير في تدجين شعب الحرمين,1,1,0,1,0,0,0,1,1,1,0,0
arb_b51de494ba04232eb991f94348a0f06a,الي اول مره يشوف المخلوق الفضائي هذا يخبط لايك 🐸🚬,0,0,0,0,0,0,0,0,0,0,0,0
arb_b51f25987a85254e2cda915c4bb9e184,الحمير المصدقين ان السعوديه مع الهند . ما عرفوا ان السعوديه هي أم النووي الباكستاني؟,1,1,0,0,0,0,1,1,1,1,0,0
arb_b52fc6cbbf17cd01c01bf96916611821,الشعب التونسي شعب ديوث ويعطي رأيه احكام القرآن الكريم ويقول الموضوع لايهمه لاحول بالله العلي العظيم,1,0,1,1,0,0,1,1,0,1,0,0
arb_b53642a287f57ec439d9e769993ea36b, موش عارفين الي ك الطلب يفوت العرض، تسقيف الاسعار يضاعف الازمة و يخلق التهريب و الاحتكار. الرئيس موش حاطط ناس تفهم في الاقتصاد.,1,0,0,0,0,1,0,1,0,0,0,0
arb_b5788731ad6f2dd555c8d1903d951d61,خويا هذو المخنثين يتهز العرش العالي وملعونين واكثر قوم هذبهم بداية الخلق القيامة قوم لوط السلام االله ينظف الارض,1,0,0,1,1,0,1,1,1,1,0,1
arb_b5798f20a4a8a42a831e61e2b1d5b58a, لازم يعرف المسلم ان التكفير امره عظيم كانك تحكم على العبد بدلا من الله في حكم الله وفي حق الله. يجب اي يعي المكفر ذلك.,0,0,0,0,0,0,0,0,0,0,0,0
arb_b5a3a6c72f97392dc536512b6436ba09,"البطولة مهمة بالنسبة لليمن
لانها الوحيدة اللي بنشارك فيها والى الآن مازلنا نبحث لفوز
لك أن تتخيل المشاركة التاسعة على التوالي صفر فوز أي منتخب انت يالاحمر اليماني",1,0,1,0,0,1,1,1,0,1,0,0
arb_b5a6f318b44b4459b450f27d9e82cda9,يااا الله تعبت واني اباوع متحولين جنسيا يا الله دنقرضووووااا,1,0,0,0,1,1,1,1,0,1,1,1
arb_b5b832e388fa75dd644c183e432982b7,د. فيصل القاسم : بعد الذي حصل في سوريا: أقترح إلغاء وظيفة المحلل السياسي,0,0,0,0,0,0,0,0,0,0,0,0
arb_b5becd81a10b4f1916ac99e221243a1a,هذي مصممه انها محترمه هذا مجنونه رسمي ربي يقلعها شوهت البنات محترمات لما تضم حالها منهم المفروض هذي يوقفوها ايش الاحنطاط هذا,1,0,0,0,1,1,1,1,1,1,0,0
arb_b5cfca2120c0340ea314a6f8e31d5896,والله برديس شكلها زي القرد اصلا وصوتها زي الرجاله وكلها علي بعضها تقرف,1,0,0,0,1,1,0,1,1,1,0,0
arb_b5f32a6ad19452ea27cb658d1dfa3232, مصر مهمة جدا للصين اكتر مليون مرة من اثيوبيا و بتدخل عندنا مصانع وشركات كتير ,1,0,1,0,0,0,1,0,0,1,1,0
arb_b5fcf3ff6d274be758ddac6aeff111b2,"بطوله عريقه وتنافسيه خصوصا بالسابق وما يعرف هالكلام الا اللي كان يتابع المنتخبات بعز قوتها جميعها

",0,0,0,0,0,0,0,0,0,0,0,0
arb_b61aa37cd788ee2688e654016703b601,ياترى عندك الشجاعة والحيادية انك تجيبي اخبار قتل الزوجات لازواجهم ولا ده هيخلى شكلك وحش وينسف مبدأك المتعفن,1,0,0,0,1,0,1,1,0,0,0,0
arb_b62188cb0735bdf6ffef49f8d643dbfc,"لك اكلوا تبن تروحله فدوه 
تاج راسكم هو مضغوطين😏😏",0,0,0,0,0,0,0,0,0,0,0,0
arb_b62753fd55050b08356b506fdcb1fa2e,مكروهة محد طايقها لازم تفهم انا مو من مصر بس بكرهاا واعتبرها اهانه لمصر,1,0,1,0,1,0,1,1,0,1,1,0
arb_b6292567473c7b39166a903d3928e5b0,الإمارات دوله ماجوره من الغرب,1,1,1,0,0,0,1,1,0,1,0,1
arb_b6833b26f3e337be1b689fddff76fa33,"السعوديه وقطر والإمارات؟ ماذا بعد تريدون بعد تدمير الأوطان العربيه لن ننسى
لن ننسي",1,1,1,0,0,0,1,1,0,1,1,0
arb_b68365484a43a2a34ceb79c868383258,مصيرك جهنم أيتها الفاصقة والفاجرة لعنة الله عليك ستعلمين ذلك يوم لاينفع فيه مال ولا بنون إلا من اتي الله بقلب سليم.,1,0,0,1,1,1,1,1,0,1,0,1
arb_b68bab6ca4dc505f79562df72729240d,عاشا الجيش العربي السوري رغم انف السلفين الانجاس اللواطين,1,1,0,1,0,0,1,1,1,1,0,0
arb_b69472fe3de6b94f3564b2b135bc70d1,إجتماع للجنة مكافحة الإرهاب الروسية بعد تفجير جسر القرم وتوقعات بتصعيد روسي كبير تحت غطاء مكافحة الإرهاب.,0,0,0,0,0,0,0,0,0,0,0,0
arb_b6bc54c98241f4384de15cc3282b8963,أعضاء الكونغرس الأمريكي وكل العاملين في البيت الاببض ، بما فيهم الرئيس وأعضاء حكومته ، ليسوا إلّا موظفين يعملون بتوجيهات من منظمة الآيباك (AIPAC).... الآيباك هي الدولة العميقة التي تدير أمريكا والدول التي تدور في في فلكها حول العالم..,1,1,0,0,0,0,1,0,0,1,0,0
arb_b6fe11159a9f52ec25105f34901b52ad,ترامب يتحدى الدولة العميقة و يعلن بأنه سيرفع السرية عن ملفات اغتيال الرئيس جون كينيدي، وشقيقه روبرت كينيدي، ومارتن لوثر كينغ.,0,0,0,0,0,0,0,0,0,0,0,0
arb_b70170c4fda1e2708180ac523cd61adb,  للاسف دا اصلا تراث قبطي مصرى وليس مغربي موجود في الكنيسة المعلقة بمصر قبل دخول الإسلام 😂😂,1,0,1,1,0,0,1,1,0,1,0,0
arb_b704a650e61c2c8e5b7e39a5f33c25ef,الجمعية المغربية لرؤساء مجالس العمالات والأقاليم تعزز التعاون الدولي في مؤتمر بوخارست,0,0,0,0,0,0,0,0,0,0,0,0
arb_b71d336252fb97d85e7c397fcec8b521,عصيتين الغلايه اللي  فرحانه بيهم         برديس,0,0,0,0,0,0,0,0,0,0,0,0
arb_b73739d379ff15268051d355c6b19cfe,ههههههههههه مهزلة   بقرة  بمعنى  الكلمة,0,0,0,0,0,0,0,0,0,0,0,0
arb_b75aa728579de74c35635917df79c55f,مش فاهم النسوية اللي تقول انها هربت من التحرش وتروح تشتغل ىتش في كندا او غيرها,1,0,0,0,1,1,1,0,0,0,1,0
arb_b75f17e0044c700d5db2db010d24c156,دي مش بتمثل الشعب المصري الشعب المصري في ناس كتيرة محترمه,0,0,0,0,0,0,0,0,0,0,0,0
arb_b77588881c40dbe44189fbea67665881,"تخيلي ان الرجل اذا شاهد مكياج على الوجه او شاهد قدم امراة ستثار شهوته ويزداد هرمون الرجولة عنده في تلك اللحظة؟
بالمناسبة هذا الهرمون يسمى هرمون العنف والغضب والشهوة",1,0,0,0,1,0,1,0,0,1,0,0
arb_b7921aca414a05e3730afa6a323a06d7,كافي كذب مخلي صوره فتشوب اكبر مجرم الجولاني حاله حال بشار لا تلمع بي كان رجل يشتغل وي الدواعش كوه تلمع بي حاله حال بشار المجرم,1,1,0,0,0,0,1,1,0,1,0,0
arb_b7a8c1f8ff2441ed2dd4081caff91c1b,انطلاق عملية بيع قسيمة السيارات 2025: التفاصيل الكاملة والمركبات المعفاة,0,0,0,0,0,0,0,0,0,0,0,0
arb_b7ab9136ef2201f5d863a365ac21e885,"العنف يولد عنف أكبر والدائرة تتسع لتشمل وتحرق كل شيء
#سوريا
#اوقفوا_العنف",0,0,0,0,0,0,0,0,0,0,0,0
arb_b7aba211c93ddb3f5e72a3016ec137de, تكبييير هؤلاء أسرى صهاينة يا أختاه أليس كذلك! كم أنت عظيم يا خليفة الأمممة👁,0,0,0,0,0,0,0,0,0,0,0,0
arb_b7b62bb2dd638539bbc306b87b0797a0,غريب ...اقوى قناة اعلامية في الوطن العربي تسال الجمهور شو لازم نعمل .....هههههه..قسما بالله مصيبتنا لم يخلق الله مثلها ابدا,1,0,1,0,0,0,1,0,0,0,0,0
arb_b7e6c5f7513c805e2f27cd9400a350fa,هو لازم هل زبالة تنلم لكن قالة كلمة صحيخة ليش ما ينقبض على هيفاء وهبي وغيرها ؟،؟؟؟؟؟؟ولا لانهم ماسونياات,1,0,0,0,1,1,1,1,1,1,1,0
arb_b7ef1de9d8f32abccac953c400fe4711,رسالة زياية لجماهير الذهب ! تفاصيل الخبر  ,0,0,0,0,0,0,0,0,0,0,0,0
arb_b7f8991a214ec6fe9b09622eb88b28be,الفنان بشار اسماعيل يبكي على الهواء بعد المجازر التي حدثت ويؤكد أنه لايوجد فرق بين بشار الأسد وأحمد الشرع,0,0,0,0,0,0,0,0,0,0,0,0
arb_b7ff75b93b1ae3215b2de49254902fe8,"بصراحه مالها قيمة لان بالكويت

",1,0,1,0,0,0,1,1,0,1,0,0
arb_b80e1d8a9bfa7a27d704447a1d2464da,لم يعد هناك داع لمشاهدة مسلسل معاوية بإمكانكم رؤية اجرام بني امية على الهواء مباشرة,1,1,1,1,0,0,1,1,0,1,1,0
arb_b814817b9e9536f51406c29dd5bdbc86,"اطالب بانسحاب مصر من هذا المسمي جامعه الذل والحزن العربيه.
 وتتحل وتغور ف داهيه.",1,1,0,0,0,0,1,1,0,1,1,1
arb_b81fbe0eb1d24d188488630fb1c48f05,أحداث انسحاب القوة الجوية أمام اتحاد الجزائر كأس العرب للأندية الأبطال 2018-2019,0,0,0,0,0,0,0,0,0,0,0,0
arb_b822d6c879b10bd2e2bc82e3c6a90429,أربعة لاعبين عرب في التشكيلة المثالية الأفريقية 2024,0,0,0,0,0,0,0,0,0,0,0,0
arb_b8577a354eb2cff0fe01a7672885ca0c,"هي ملكة بس 
على
 عرش
قمة الحمير اللي يسمعوها
ويكرم السامعين والمتابعين هنا
بالردود",1,0,0,0,1,1,1,1,1,1,0,0
arb_b895e194adb180a67ae59865ac19d102,العنف الأسري ضد المرأة يؤثر على الأسرة بأكمله فالأطفال الذين تتعرض أمهاتهم للعنف من قبل الأب يكونوا ضحية لإساءة المعاملة  ، يحرموا من الأمان الأسري، وفقدانهم الثقة بأنفسهم ، ويعانون من مشكلات نفسية وسلوكية وتراجع مستواهم الدراسي.,0,0,0,0,0,0,0,0,0,0,0,0
arb_b8ada923fae171e9c76d78f32da8d492,مرضى القلب يستطيعون ممارسة الرياضة ولكن بشروط,0,0,0,0,0,0,0,0,0,0,0,0
arb_b8b12d81fa8f5a7eab103b58e5c43834, ماذا تعرف عن التاريخ، الحوثيين مجرد نطفة نجسة من ظهر إيراني في رحم حبشية، فأنجبت من نراه اليوم الحوثيين,1,1,1,1,0,0,1,1,1,1,1,0
arb_b8b45cc7f0aaf993cb7df5605d5bce56,وكالة شؤون الأفواج الأمنية تحتفي بيوم التأسيس,0,0,0,0,0,0,0,0,0,0,0,0
arb_b8ba65ce86f0c16c68fb7e399983b61d,السلطات المغربية تكشف تفاصيل تفكيك خلية إرهابية,0,0,0,0,0,0,0,0,0,0,0,0
arb_b8c3c8fcc4e98d85ccbfc1fa2876e66b,ليش ما تاكلون وحل احسن.. كاظم الساهر مو بحال هل وجوه الغمة... يبقى ملك ابو وسام,1,0,0,0,0,1,0,1,0,1,1,0
arb_b8dd706a2c461ccff0fac8f9b937cac6,علم الطاقة علم وثني ، محرم ، وفالدين الاسلامي مافي اي شي يمنع انك تتصدق بملابسك الا اذا كانت باليه وتعبانة جداً هذي لاتقبل ، وغير كدا تقبل الله,0,0,0,0,0,0,0,0,0,0,0,0
arb_b8fcff6e27561e0730ed0a8edbceb3fb,الكل غير من كاظم لأن هو نجاح وانتو فشلين,1,0,0,0,1,1,1,1,0,1,0,0
arb_b90e6a706d9d3cbfd7d05e2864fdecf9,شمس احسن منج يزربه مو متربيه انتي اعتقد ماتعرفين شنو التربيه,1,0,0,0,0,1,1,1,0,1,0,0
arb_b9134752588a72d9cac2f2f61e27d85f,عدسة «الشرق الأوسط» ترصد لحظات وصول حافلة #النصر إلى ملعب المباراة متأخراً عن موعد انطلاق مباراة #الوحدة_النصر,0,0,0,0,0,0,0,0,0,0,0,0
arb_b9250c5c7ca51a11952cffe39f6c23a5,كونك راجل و استرجع تندوف انت أصلا لم استرجع حتى منزلك 😁😁🕳️🥞🥞,1,1,0,0,0,0,1,1,0,0,1,0
arb_b92abc5e5c73a9af595f196ce3e474ba,هذا جعلها شريكة لله  عليك من الله ما تستحق.منافق مبتدع الاسلوب جديد من النفاق والله لن ينالك منه سوى الخزي في الدنيا والعذاب في الآخرة ,1,0,0,1,0,0,0,1,0,1,0,1
arb_b9335b99dabb4a4fc96e58709ebfda72,وزارة المالية: 60 بالمائة من موظفي القطاعين العام والخاص سينتفعون بإجراء تعديل جدول الضريبة على الدخل,0,0,0,0,0,0,0,0,0,0,0,0
arb_b938cc74a998a82774c003f03a233d6a,حسبنا الله ونعم الوكيل يارهابي قاتل الاطفال وشيوخ ونساء انتم محتل فلسطين رجع إلى بلدكم الأصلية يارهابي,1,1,1,0,0,0,1,1,1,1,1,1
arb_b9394972d3cff9162b7f15c03a9d4684,#غزة… من طوابير العلم والنضال إلى طوابير الجوع والحرمان.,0,0,0,0,0,0,0,0,0,0,0,0
arb_b96e46f4eb91d80de37a9ce419730bb3,مسودة دستور سوريا: مرحلة انتقالية لـ5 سنوات ورئيس مسلم,0,0,0,0,0,0,0,0,0,0,0,0
arb_b9a5d515958eee966ec3ce54bdaf152d,الوزير الشيباني يجري اجتماعات مع بعثات دبلوماسية لإحاطتهم بالوضع الأخير في سوريا,0,0,0,0,0,0,0,0,0,0,0,0
arb_b9c1198757404dabbdfc6adb9c7f319f,سنداتالسندات السعودية الخضراء تُسعر بـ155 نقطة أساس فوق عقود المبادلةأسواق المال,0,0,0,0,0,0,0,0,0,0,0,0
arb_b9f374f815d93df1ee69b7d4211bd42b, بقالي يومين خطي متعطل عن الاتصال وبدون سبب ومش عارف ليه,0,0,0,0,0,0,0,0,0,0,0,0
arb_b9fffe2324f3b0e6b4119395346ccdfb, لن يعجبهم رافضي العلمانيه جميع ما ذكرت الا اخر جميع هي تعدد ضد الاحتكار ظنا منهم تعدد الزوجات,1,1,0,0,0,0,1,0,0,0,0,0
arb_ba1461263c45120b8abe63ac8f908485,يعني إما تقدم للمعارضة و إن لم يكن أي تقدم للمعارضة، فيقولون النظام يقصف المدنيين.,1,1,0,0,0,0,0,0,0,1,0,0
arb_ba1b9a049a35d9a0a06415dffb0a702b,فرصة لمنتخبنا الوطني للاستعداد لنهائيات كأس الأمم الافريقية بالمغرب التي ستلعب في الفترة من 21 ديسمبر 2025 إلى 18 يناير 2026.,0,0,0,0,0,0,0,0,0,0,0,0
arb_ba50f3c27d2d80f6f3ac917ee9d16eee,اذكر وارى نزوح الافواج من المصرييين الى شرق السودان!هم اخطر من اليهود احذروهم!!,1,0,1,0,0,1,1,1,0,1,1,0
arb_ba6c8eadf445ea5013d52c7d2a32f2e6,"اي والله التوزيع بهالعصر اهم عنصر 
مثلا توزيع كيف بداويك ١٩٩٩ احدث من توزيع ياهو ٢٠١٧ تخيل😂",0,0,0,0,0,0,0,0,0,0,0,0
arb_ba70c1e9b0d51ce8673a6312a95a7729,"إن الله وزّع الأرزاق بالعدل، ولم يوزعها بالتساوي؛ لإن العدل مبدأ أسمى من المساواة.

-أدهم شرقاوي",0,0,0,0,0,0,0,0,0,0,0,0
arb_ba752cb086e574fe78031ff21aa15483,الامارات الصهونيه هى الوجه الاخر لإسرائيل,1,1,0,0,0,0,1,1,0,1,0,1
arb_ba79cb3538176959f7d5c73c37f6894d,كاظم الساهر القيصر العربي احسن مطرب عراقي وعربي وعالمي تحياتي إلى كاظم الساهر,0,0,0,0,0,0,0,0,0,0,0,0
arb_ba82de4aac53b1cbda9e2967f8d8fc2f,"عندما يمثل النادي شعبا كاملا وبعبر عن قضيته 
لاعب نادي النجمة يخاطب ابا هادي في بطولة كاس التحدي الاسيوي... لذلك نقول كرة القدم اكثر من مجرد رياضة",0,0,0,0,0,0,0,0,0,0,0,0
arb_baa4ecf79d5b4dbdeeafe8e05d35881d,ايران واقف مع عبيد البقرا لكن اذنابها يقومون بتروج الموضوع ضد السعوديه حتى لا تظهر حقيقتهم في دعم الهند,1,1,0,1,0,0,1,1,1,1,1,1
arb_baab03fe8b69a51bf0458b2d886f0b0c,صحيح هذا قوات افرزتها حرب ٩٤ وهي قوات احتلال   ويجب إنهاء الاحتلال لأجل تستمر الوحده  لاتوجد وحده بوجود احتلال,0,0,0,0,0,0,0,0,0,0,0,0
arb_bab39dac3ffd05896784e47e32cce4dc,هيفاء وبرديس ومروه وفيفي عبده وسما المصري وغيرها شويه عاهرات وانشالله كلهم فنار جهنم للابد حسبي الله ونعم الوكيل فيهم,1,0,0,0,1,1,0,1,0,1,0,1
arb_bad110e27dc14e2bfc2020ea2cbb685e,كنز العراق التاريخي.. ذاكرة وطن في مهب الريح بين بغداد وواشنطن,0,0,0,0,0,0,0,0,0,0,0,0
arb_bb1305fa3670a60951e5b309151244b3,رغم حظره بشكل رسمي في مصر عام 2008 إلا للضرورة الطبية، لا يزال ختان الإناث يمارس على نطاق واسع، وتتراوح عقوبته بين السجن ثلاثة أشهر وسنتين,0,0,0,0,0,0,0,0,0,0,0,0
arb_bb14edee19ea90e9d0e53d54cd62cca1,ذكرى ما نسيناك وما حد بينسينا صوتك الجميل وطيبتك وقدراتك الغير موجوده في أي بشر رحمك الله,0,0,0,0,0,0,0,0,0,0,0,0
arb_bb16eb8e2301cd3474c2d2457d6c2fb6,“مذاقات الموت والركام”.. الروائي الغزي عبد الله تايه: لا لغة تصف فواجع الحرب,0,0,0,0,0,0,0,0,0,0,0,0
arb_bb2cc40d0573dc4714ffe591bcf4216d,أقل شي انج انطردتي يا رغدة من دولة الكويت,1,0,1,0,0,0,0,1,0,1,1,0
arb_bb3056ae0d6b3ccf0ae837a081f2619a,شو هذه الكرات اللى حاطها على صدرك و وجهك مازالو وجه الرجل ليس لديك اَي علامات الأنوثة,1,0,0,0,1,0,0,1,0,0,1,0
arb_bb3a539997a163bb3edb194f33850968,اللهم انصر ابطال السودان وارنا عجائب قدرتك في اماراتةالمؤامرات الصهيونية,1,1,1,1,0,0,1,1,0,1,1,1
arb_bb49057e9faaf67403990b2cd45fa609,لا يا بوسي كداب اللي يقولك الناس المحترمة كانت بتمشي كده، ده كان ف الافلام بس واتفرجي على الذارع دلوقتؤ واللي ماشي فيه مانتي هتلاقي محزق وقصير وحجاب مش حجاب وهتلاقي برضه المحتشمة والمنتقبة,0,0,0,0,0,0,0,0,0,0,0,0
arb_bb5fbd948384be3ccb894d390c9af141,"شراكة إستراتيجية بين أوتو موبيليتي و""كونتكت للوساطة التأمينية"" لتوفير خدمات تأمين متكاملة لعملاء جيلي",0,0,0,0,0,0,0,0,0,0,0,0
arb_bb72807fa0ff88524425d47382758796,فلسطيني يبحث عن عَلَم الزمالك تحت أنقاض منزل مدمر في غزة #قناة_الغد #فلسطين #غزة,0,0,0,0,0,0,0,0,0,0,0,0
arb_bb79d96dd17d7622343dc3c6bef37850,ههههههههههه والله انت اغبى خلوق تقارن نفسك بكاظموكلهم غيرانين من كاظم والله اصواتهم موحلوة بس كاظم,1,0,0,0,0,1,0,1,0,1,1,0
arb_bb7ac59a6c218579796d9fd287e9da93,ثورة الجياع اذا انطلقت لن يطفئها الا ان يشبع الجياع والشبع لايعني الطعام بل جميع مناحي الحياه,0,0,0,0,0,0,0,0,0,0,0,0
arb_bb7f6c1f044c85adbcb22e30fd753433,"⚡️المتحدث باسم منظمة الطاقة الذرية الإيرانية: نتفاوض مع روسيا لتطوير المرحلتين الثانية والثالثة من محطة بوشهر النووية.
#روسيا #إيران",0,0,0,0,0,0,0,0,0,0,0,0
arb_bb8ae1a3bd08c4c5b40b18d976ed7d3f,الواقع أن قاعدة البغض العقدي للكافر قد أطبقت عليها المذاهب الأربعة لأهل السنة والجماعة وليست مسألة ابتكرتها الدرر السنية.,1,0,0,1,0,0,1,1,0,1,0,0
arb_bba98259f9a42f7bdc2ba0589b74ae98,"بيل غيتس""بيل غيتس"" ندم على ترك هذه الجامعة لتأسيس ""مايكروسوفت""",0,0,0,0,0,0,0,0,0,0,0,0
arb_bbbf0933b10deee0ae2f333150020da2,الجولانى إرهابى اصحى يا شعب نايم ,1,1,1,1,0,1,1,1,0,1,0,0
arb_bc1c3f29fa8b5a0c35440f48304829fb,اتكلم لك عن ضعف الرقابة و محد يجي من العمال يسكّتهم، ولا اتكلم لك عن الفلاشات و التصوير، ولا اتكلم لك عن التضاحيك اللي بلقطات مافيها ضحك.,1,0,0,0,0,1,0,1,0,0,0,0
arb_bc29d3d84f381279bb886e52d663b254,هذا الاعلان ليس له أي شرعية قانونية كونه مشرع من قبل سلطة استولت على السلطة دون تخويل شعبي او انتخابات فهو غير ملزم الا للجهة التي وقعته,0,0,0,0,0,0,0,0,0,0,0,0
arb_bc51e31fa75249aff664b6d8e80b80a2,محرم بك مقلوبة عندي عشان الكاهن الكنيسة اللي اتقتل 💔وحقيقي الله ينتقم من اي حد بيقتل ناس في حالها وملهاش ذنب,0,0,0,0,0,0,0,0,0,0,0,0
arb_bc669118a51bd71645609b7122bf8d53,عندما كان اسيادك المغاربة يحاربو العثمانيين والصليبيين كنتو انتم مجرد عبيد وجواري الاتراك ههههههه,1,1,1,0,0,0,1,1,1,1,1,1
arb_bc895146f6781cbb9bd2598f2b4bb931,"يجب على الذين يدعون نفسهم أنهم ""عرب"" أن يقرأو تاريخ العرب الحقيقيون ، فنحن عرب مع مزيج صهيوني يهودي ...",1,0,1,0,0,0,1,1,0,1,0,1
arb_bc89a235f23d5fc444924c9ec6ed2c2a,أمني سابق يحذر قيس سعيد: انتبه جيدا.. ثورة الجياع على الأبواب..,0,0,0,0,0,0,0,0,0,0,0,0
arb_bc8fc69b23b9fb33c222e2dd0cbcf421, إسرائيل أعلم بما سيفعل حزب الله حزب الله لا يلعب وأنتظر كي ترى قلوبكم تشتعل على الكيان اللقيط 😊😊,1,1,0,0,0,0,1,1,0,0,0,0
arb_bcb121dfb50ffa3523a4351ceb9114b5,المفروض طردة وعدم التعامل معه ومقاطعتهم ال تعوسية والإمارات فهم اذا اعداء الاسلام والمسلمين بلد وداعمين للكيان الصهيونى,1,1,0,1,0,1,1,1,0,1,1,0
arb_bcefd302ec83fc6d9455c52d94eb8bef,  نيجيريا كالعادة في الكنيسة و العالم لا ينقل الخبر و لا يهتم لان الضحايا ليسوا مسلمين,1,0,0,1,0,0,1,1,0,1,0,0
arb_bcf6662e46fdf910baca348588a0cbdd,معنى اسم احلام جميل اتصور هذا اسم الشهره واعتقد اسمها الحقيقي شهموزززززززززززززز,0,0,0,0,0,0,0,0,0,0,0,0
arb_bd0a032262b9d3f6a671d80176320812,الجمهورية الإسلامية الإيرانية هي الأخرى مثال واضح على الإصرار والكرامة الوطنية لامتلاك حق استخدام الطاقة النووية للاستخدام السلمي.,0,0,0,0,0,0,0,0,0,0,0,0
arb_bd0c26873e1c155ba8a7ea3e52ad4c89, لو سمحت كنت عايز اعرف تفاصيل فاتورتي الشهر ده - نظامي ايجل ???       ,0,0,0,0,0,0,0,0,0,0,0,0
arb_bd1fb6185fdde427b47eb348e700403c,ممارسة الرياضة لمدة ساعتين فقط أسبوعياً تقلل خطر الإصابة بأمراض القلب، فما القصة؟,0,0,0,0,0,0,0,0,0,0,0,0
arb_bd38e8a0ba0ddc6e43a07c8a2bf982aa,مثقفو الاستعمار الجديد في عصر النيوليبرالية.. بوعلام صنصال أنموذجا,1,1,0,0,0,0,1,1,0,1,0,0
arb_bd3eadf27db192d2356a11073eec56bd,احسن من سوريا سوو وزارة دفاع كل جنودها شيشان وافعان وايغور ونطوهم الجنسية السوريه ورئيسهم اسمه الشرج,1,1,1,0,0,0,1,1,1,1,1,0
arb_bd56e9f7ec4b2700be09af20a77a21d0,"حتى أنت يا محرز و ملاك سيتي أنثم مسلمون 
و تدعمون المثلية عار سوف يبقى على جبينكم",1,0,0,1,1,0,0,1,0,1,1,0
arb_bd6b2bf17094c26a99ff202d5f1ef5e9,رئيسة المكسيك تأمل باتفاق قريب لتجنب الرسوم الجمركية الأمريكية,0,0,0,0,0,0,0,0,0,0,0,0
arb_bd827b567cdfbad9fda1341ad781f300,  شركات المحمول فودافون اتصالات موبينيل وادعم المصريه للاتصالات ,0,0,0,0,0,0,0,0,0,0,0,0
arb_bd9c0a53196eaad28e108d89f095cb90,"  لانه مجبر تكون المفاوضات ب تركيا ماهي رغبه من تركيا 
اما تقول ينقذنا تخسي تركيا وغير تركيا",0,0,0,0,0,0,0,0,0,0,0,0
