id,text,polarization,political,racial/ethnic,religious,gender/sexual,other,stereotype,vilification,dehumanization,extreme_language,lack_of_empathy,invalidation
deu_ba2639be92aea416832de54110523c3f,Naja Terroristen kann man FFF jetzt nicht nennen,1,1,0,0,0,1,0,0,0,0,1,1
deu_ba278b90b5d3b03c3dd0f6da066ec452,"Kein Krieg, keine Afnee",0,0,0,0,0,0,0,0,0,0,0,0
deu_ba386543a998081ea34b63033146eb20,Wie wäre es mit einer Anerkennung des Holodomor als Völkermord an die Ukrainische Bevölkerung von seiten Russlands?,1,0,1,0,0,1,0,0,1,1,1,0
deu_ba58cafd7aa27f14a6f58ff328179a74,"Das waren nicht die Ukrainer, die etwas getan haben, sondern der russische Staat und russische Medien im Auftrag des Staates ☹️.",1,1,0,0,0,0,1,0,0,0,1,0
deu_ba6a847d6ba692ec370a4fdfab483cfe,"Da wir selbst jüdische Familienmitglieder hatten die emigrieren mussten, bin ich natürlich in der Lage zu verstehen; trotzdem halte ich die Position der Union gegenüber für überzogen",0,0,0,0,0,0,0,0,0,0,0,0
deu_ba85092cbafa9b3f4664d1fa5e0eea5b,"Ich habe FFF nie als progressive Bewegung wahrgenommen, da gibt es andere Gruppierungen die wesentlich progressiver sind und mehr fürs Klima erreichen. Nur wird über die halt nicht kaum gesprochen, da es dort halt um die Sache geht und nicht um Selbstdarstellung wie das bei FFF der Fall ist.",1,1,0,0,0,0,1,0,0,0,0,0
deu_ba89fa1d349923812b22642a02e322be,5G hat Corona erfunden?,0,0,0,0,0,0,0,0,0,0,0,0
deu_ba8c29d7afd4ed58becc18f01c6cca35,"Pro-ukrainische Hacker: Erneut folgenschwerer Cyberangriff auf Russland
",0,0,0,0,0,0,0,0,0,0,0,0
deu_ba9393717e71a98cef0b294d215a3d24,"Nur bei orthodoxen Juden, gibt einige jüdische ""gruppen"" die auch die Konvertierung so akzeptieren, ist aber meist eher ein langer und anstrengender weg",0,0,0,0,0,0,0,0,0,0,0,0
deu_ba98687e77f3f4501eb9a4b849709399,"Was schweben die denn für Grenzen vor? Meine Grenze ist ja, dass nicht unschuldige Zivilisten umgebracht werden. Aber scheinbar ist das ja nur unmoralisch, wenn man Araber ist.",1,1,1,0,0,0,1,1,1,1,0,0
deu_baaf292debc0c8b144e9bbad27164f0e,"Nö, aber alle im Ausland lebenden nationalistischen Türken sind irgendwie nach Definition im Ausland lebende Türken und um die wird es vermutlich auch in Threads gehen wo sich einheimische Türken über ""Gurbetçi"" aufregen",1,1,1,0,0,0,1,1,0,1,0,0
deu_bab4edca384948090bbf2aaa17d38265,">Unter Antisemitismus leiden vor allem Muslime.

- unsere Bundesheulboje",1,1,1,1,0,0,1,1,0,1,1,0
deu_bac3accd5b450834785c0967f77fa421,"Eine Legende, Ruhe in Frieden",0,0,0,0,0,0,0,0,0,0,0,0
deu_bac74992546a27cf7b3c0e3d50d0f7a1,Hoffentlich verschwindet der Gender-Nonsens endlich.,1,0,0,0,1,0,1,0,0,1,0,1
deu_bac91af6df6c23672187535b7b1fef09,Was meinst du mit endlich? Solche Aktionen gab es schon richtig häufig gegen Landratsämter etc. Halt gegen Einrichtungen die verkehrswende und Umweltschutz blockieren.,0,0,0,0,0,0,0,0,0,0,0,0
deu_bac9382bf1ecfb191e9c0b8c17ca2574,">	die vielen gescheiterten Versuche einer Digitalisierung durch den Bund

Bei der Digitalisierung auf den Bund warten. Finde den Fehler.",0,0,0,0,0,0,0,0,0,0,0,0
deu_bad84e8d2abaea977d292ea60eb7b345,Glaube das war weniger die Pandemie und mehr die Diskussionen mit Lindner.,0,0,0,0,0,0,0,0,0,0,0,0
deu_badea8e5ddcaff7961085df9950cfd11,Reizungen können @USER Entzündungen in den knien hervorrufen. ich meine das ein Arzt sagte das Fett gut für das immunsystem ist und fehlendes Fett das immunsystem schwächt,0,0,0,0,0,0,0,0,0,0,0,0
deu_baedd12665bbcec9e824011bc28929a1,"Das Wort Querdenker war im ursprünglichen Wortsinn und nicht als ""die"" Querdenker gemeint.",0,0,0,0,0,0,0,0,0,0,0,0
deu_baf02b0048bbd48810c2125fb51756cb,Ja ich habe auch mega Lust auf weiter ungebremste Migration,0,0,0,0,0,0,0,0,0,0,0,0
deu_bafbe55eca4105613a13a7cbf18021e6,"NDA

Und es sollte euch nicht egal sein, ob Flüchtling oder nicht!
Sind schon Leute wegen Schlepperei angezeigt wurden, die nur Gutes tun und helfen wollten.",1,1,1,0,0,0,1,0,0,0,0,1
deu_bafe28b89db58080550ceb2fdd0cb057,Alternativer Titel: Ukrainische Behörden verhängen Einnahmezustand im Gebiet Kursk,1,1,0,0,0,0,0,0,1,0,1,1
deu_bb136cbd9d25292983fb38706cec0c72,"Die schaffe es grade nicht mal bis Kiew.  Da ist es nicht so einfach mit ""mal eben so dies und das und ""Fertig""""",0,0,0,0,0,0,0,0,0,0,0,0
deu_bb30d59303dfd72846715c831c0fae87,jedes jahr denke ich herbst jaa cozy und wenn dann herbst ist will ich mich oombreengen,0,0,0,0,0,0,0,0,0,0,0,0
deu_bb4bb4d97589c017838e6560882c72cb,"Wenn man bedenkt was ein Flüchtling hier für kosten verursacht, dazu den verbleib oder die betreuung durch das Justizsystem etc. ist das ein Schnäppchen.",1,1,1,0,0,0,1,1,1,0,1,0
deu_bb5443e57d90a27fd61ab7a9ccc3d973,Ich bin Deutscher und du bist Faschist :) danke für den Kommentar.,1,1,1,0,0,0,1,1,0,1,0,0
deu_bb78c9998157bf38d5d4d5e209cb315b,"Naja, jüdische Weltraumlaser sind schon weg.",0,0,0,0,0,0,0,0,0,0,0,0
deu_bb8bdcf94da84378db8b2c9febaa514d,"Warum genau muss man jetzt öffentlich Mitleid zeigen, wenn ein Faschist leicht verletzt wird?",1,1,0,0,0,1,0,0,1,0,1,1
deu_bb92b0bceb574b93d826db83c0d0304a,Die Diskussionen um covid-19.,0,0,0,0,0,0,0,0,0,0,0,0
deu_bb94259a67ead8742fe1a0205cd4ae1e,"Doch, Anerkennung der Covid-Infektion aus legalen Gründen und falls du Post/Long-Covid entwickelst.",0,0,0,0,0,0,0,0,0,0,0,0
deu_bb95e00734abe6ffdd2505b8af9d0b8b,Nicht als antisemitischer Pro-Hamas Scheiß,1,1,1,0,0,0,1,1,1,1,0,1
deu_bb9956c8c06105830d512665f37809e7,Ich sach nur Klima-Referent der FDP.,0,0,0,0,0,0,0,0,0,0,0,0
deu_bbcaa9d2a820d0bdbcd80ec7708f0561,"Oder ""bis wir die Wähler davon überzeugt haben, dass ""linksgrün"" und SPD und sowieso alles was weniger rechts ist als wir, deutlich schlimmer als die AFD ist.",1,1,0,0,0,0,1,1,0,0,0,0
deu_bbd860bc1c7c184409dd1d499391c10c,"Tasächlich macht der Handelsbereinigte Co2 Ausstoß relativ wenig aus , bei uns zumindest

@USER",0,0,0,0,0,0,0,0,0,0,0,0
deu_bbd9ea67ba23bbdc774e4a929a65e1ba,Frei fahrt für freies Klima,0,0,0,0,0,0,0,0,0,0,0,0
deu_bc3964ed5094ace3b618d0cd25cc4208,"Naja, vielleicht sollten russische Truppen hinterm ""Ofen"" hervorgelockt werden.",1,1,0,0,0,1,1,0,1,0,0,0
deu_bc616efbf88ab49c8760360795275b33,Wer bleibt denn für eine Koalition übrig in dem Fall? Alles Kriegstreiber.,1,1,0,0,0,0,1,1,0,1,1,0
deu_bc7b6b98ba1f85330a053bc636ff4619,Besonderer Putin-Tee.,0,0,0,0,0,0,0,0,0,0,0,0
deu_bcab3f634353484bf09d33755e64e07e,"Wenn das Lemma *linksgrün* oder gleichbedeutende Lemmata im Satz auftreten. Es gibt mehr als genug, das an der aktuellen Bundesregierung kritikwürdig ist. Aber das was denen als *linksgrün* vorgeworfen wird, pickt sich lieber die gammligsten Rosinen raus.",1,1,0,0,0,0,1,1,0,0,1,1
deu_bcb2cc32076ac32f94a25c247b8b2662,Klima ist mehr als nur CO2 oder Temperatur. Auch die Luftqualität gehört zum Klima,0,0,0,0,0,0,0,0,0,0,0,0
deu_bcbc668d33669445089871ea45e05fef,"Ich warte darauf, dass jemand mit der Impfung kommt",0,0,0,0,0,0,0,0,0,0,0,0
deu_bcdc101bf51dae7f2903ef64246b5ee4,"Laut Polizei ein Iraker, 3 Türken und 4 Syrer.",0,0,0,0,0,0,0,0,0,0,0,0
deu_bce51d1a601a199019360eb1dd4d8a34,Bestimmt nicht der der Juden loswerden will,1,0,1,1,0,0,1,1,0,0,0,0
deu_bcee409a5487c709aafd684d5d7167f1,"NDA

Mehr und größere rote Flaggen als Berlin und Moskau am 9. Mai 1945",1,1,0,0,0,0,1,0,0,1,1,0
deu_bcf5cad4c571f18f4bc2302a79e21d06,"So sehr ich diese Haltung zu Migration ablehne: Migration einschränken zu wollen oder eine Obergrenze für Migration zu fordern ist per se noch nicht rechtsextrem. Es ist schon noch ein gewaltiger Unterschied dazu, Migration grundsätzlich komplett abzulehnen, prinzipiell Rassentrennung zu befürworten und mit Gewalt die freiheitliche, demokratische Grundordnung abschaffen zu wollen.",0,0,0,0,0,0,0,0,0,0,0,0
deu_bcff1bad8fd8fb4578595519d28440e9,Die wechseln dann alle zu Gender Studies und zack Boom Bachelor  ,1,0,0,0,0,1,1,1,0,0,1,0
deu_bd0b9bd40fcbe627725e7007df7fda4d,Wird Zeit das die russische Handpuppe Orban verschwindet.,1,1,1,0,0,0,1,0,1,1,0,0
deu_bd269b82ec1d65570b76101c692907ce,Das Wort wird in Deutschland durch die Wiedervereinigung und die Pandemie ein Geschmäckle behalten.,0,0,0,0,0,0,0,0,0,0,0,0
deu_bd312a5843dc3a89247edf77b61b1f26,Hitler hat auch öfters abstruse Vergleiche mit Juden angestellt…,1,1,1,1,0,1,1,1,0,0,1,0
deu_bd34bf0b98ec5e69e3a25be609dccef4,Wir nehmen die rote Linie und schieben sie nach Moskau,0,0,0,0,0,0,0,0,0,0,0,0
deu_bd471b92b421fd80e42515d90b5c45f1,Ich glaube der ist tatsächlich einfach ein Faschist.,1,1,1,0,0,0,1,1,0,1,0,1
deu_bd4b0e5b4a903031193ffe86590a1ab3,Russische Steuermillionen. Oder? *Oder?*,0,0,0,0,0,0,0,0,0,0,0,0
deu_bd573c610eba1cfe88d5f2449db35d0d,"Ja cool und ich melde Leute die schreiben ""Ist krank der Typ, der wird immer ein Mann bleiben!"" bei einem Artikel über eine Transfrau, aber das ist voll fein und wird nicht gebannt, lächerlich.",0,0,0,0,0,0,0,0,0,0,0,0
deu_bd60aeb061bf58652544a80ebc8a876e,">die Araber

Welche genau? Iran? Katar? Die Saudis? Irak? Ägypten? Libanon? Alle gemeinsam?",1,0,1,0,0,0,1,0,0,0,1,0
deu_bd617c39e1d00ff21c89b11cc7823447,"Das grinsende Gesicht von Jörg Asmussen (GDV) ist der Grund wieso wir kein Gutes nicht Versicherungsprodukt für die Altersvorsorge bekommen. Interessant am lobbyregister: Greenpeace und DUH haben jeweils nur 21-30 Lobbyisten, die kriegen richtig Return on Investment (Campact hat dafür einen der größten Millionen-Etats in Deutschland).",1,0,0,0,0,1,1,1,0,1,0,0
deu_bd675601ddcf45c8713cdfe56b365589,"Irgendeine Impfung musste ich mal selbst bezahlen. 
30€ - nicht der Rede wert.",0,0,0,0,0,0,0,0,0,0,0,0
deu_bd767e54e749a5010b2d142ade99faee,"Immer wieder derselbe Quatsch. Russland wird weiterziehen, wenn es nicht gestoppt wird. Russland will nicht verhandeln, Russland will annektieren. Die Nato ist ein Verteidigungsbündnis, keine Gefahr für Russland, sondern wäre vielmehr eine Chance gewesen in eine neue Zukunft mit nie dagewesenem Frieden zu starten Zusammen mit der Nato.",1,1,1,0,0,1,0,0,0,1,1,1
deu_bd7ee684f6c7adf900acd9fcd0bd003c,"Es gibt ein paar Jüdische Untergruppen die Zionismus klar ablehnen, namentlich zum Beispiel die Satmar Hasidic Juden und die Neturei Karta, beide Gruppen sind sehr Orthodox Jüdisch geprägt, sind das jetzt alles Antisemiten?",0,0,0,0,0,0,0,0,0,0,0,0
deu_bd8497e40afab5b922921f08310c283a,Dass ich die Existenz von Israel befüworte und die Existenz von Israel nicht gleichzeitig mit einem Fortbestehn der Hamas kompatibel ist.,0,0,0,0,0,0,0,0,0,0,0,0
deu_bdaa59acb099a8ca4d4fc8b6d3d72b17,"Naja Lesbe Carla hat wegen Flüchtling Mohammed zu fürchten auf öffentlicher Straße bespuckt, getreten oder verprügelt zu werden. Oder vielleicht noch schlimmeres und fühlt sich nicht mehr sicher.",1,1,1,1,1,0,1,1,1,1,0,0
deu_bdad73fea6b684726cd8740f5e02d4e1,Geh doch nach russland,1,1,1,0,0,0,0,1,0,0,1,0
deu_bdb44ca72e33e9e5dd4e207e8172f227,"Die Querdenker, Putinversteher, Coronaleugner und Klimawandelleugner haben also Recht?",1,1,0,0,0,0,1,0,0,1,1,1
deu_be0fafa4512773604f9817f77d8fdfa9,"Vielleicht ums Eck gedacht, Faschismus führt zu Krieg und im Krieg wird viel CO2 und Feinstaub freigesetzt",0,0,0,0,0,0,0,0,0,0,0,0
deu_be11949bbf10105a45973490c50c522b,Komplett Lost der Mann. Intelligenz wird durch ideologie ersetzt.,1,1,0,0,0,0,0,1,0,0,1,1
deu_be30bf36eb656424206d95d738ce9ec1,"Also ich nehme auch gerne ""Faschist""",0,0,0,0,0,0,0,0,0,0,0,0
deu_be392c14956f4eebd9201c6ed4477e73,Irgendwie müssen die 5G-Nanochips in der Impfung ja auch mit Strom versorgt werden.,1,1,0,0,0,1,1,1,0,0,1,1
deu_be463d28f90c06aacf6edc115092b76b,"Ja , aber die nordkoreaner wurden von russland geholt und nicht der ukraine, das die Ukraine Auch verluste macht, ist logisch",0,0,0,0,0,0,0,0,0,0,0,0
deu_be5d0c58266f060dbc3a4bacd1364792,Du meinst so wie man damals im 2. WK Juden versteckt hat?,0,0,0,0,0,0,0,0,0,0,0,0
deu_be7a70dc760bf3d6b1dd56a944aa7c78,"Na, die Impfung, was denn sonst? /s",0,0,0,0,0,0,0,0,0,0,0,0
deu_be7e342a136ef6a254c1fa591362564e,"Das ist jetzt genau dasselbe, was die letzte Generation macht. Absolut unnötig",1,1,0,0,0,0,1,1,0,1,0,1
deu_be838009a7027aca682d35538da9cfef,Hallo letzte Generation? Ich hätte hier ne Zielliste bei der euch sogar die SUV-fahrenden Massen unterstützen @USER,1,1,0,0,0,1,0,1,0,1,0,0
deu_be95614ba206d1fd5721166f3d99492d,"Solange es gegen Schwarze, Araber und Antifa geht.",1,1,1,0,0,0,1,1,1,1,0,0
deu_be983c09c4bcf0c830e0d08fc73e3d33,Die meisten Menschen in Thüringen wollen anscheinend striktere Regeln beim Thema Migration.,0,0,0,0,0,0,0,0,0,0,0,0
deu_bea4bd8d2eecb93ac707de4351881296,NDA - die Türken bei uns sind absolut scheisse!,1,1,1,0,0,0,1,1,1,1,0,0
deu_beb7013c119107fe0000962e713d19ca,Rechts ist eine legitime Meinung. Jeder der etwas anderes behauptet ist Faschist.,1,1,0,0,0,0,0,1,1,1,1,1
deu_bebe5deb418db8486d00cc6ea6599c9f,"Eine Ausbildung zum Soldaten ist etwas völlig anderes als ein realer Krieg. Auf das, was Sie im Krieg sehen, kann Sie nichts vorbereiten.

Sie können ja gerne mal Soldaten fragen, die im Krieg waren.",0,0,0,0,0,0,0,0,0,0,0,0
deu_bedd2265e64b45511862a4a6de4588dc,Die Hamas hat Gaza von Israel abhängig gemacht also darf Bibi den Hahn abdrehen und sagen dass die Hamas schuld ist? Wirklich?,1,1,1,0,0,0,0,1,1,0,1,0
deu_bf0680a65cb9e41f39bf3110e04649a5,Wie krieg ich den Job? 😳,0,0,0,0,0,0,0,0,0,0,0,0
deu_bf1e8cddf15280ecb4f5cac509e8784f,"Welche konkreten Meinungen werden denn @USER mit toxischer alter weißer Mann oder Querdenker gekontert, nach deinem Empfinden?",0,0,0,0,0,0,0,0,0,0,0,0
deu_bf2fb8ccea5abee64f51c594c83cf312,"Es gibt eine online organisierte Schule für ukrainische Kinder. Sie können dort deutlich eher etwas lernen. Ich habe es nicht gecheckt, aber kann mir allgemein sehr gut vorstellen, dass andere online Angebote für ukrainische Kinder sehr ausgebaut wurden (zB die Khan Academy).",0,0,0,0,0,0,0,0,0,0,0,0
deu_bf3dcf52768bfbbd6320b025e310a10c,Tiere sind noch besser als Hamas,1,1,1,1,0,0,0,0,1,0,0,0
deu_bf3ff7f8acedf0c5331c6e62138596d3,Konsequenzen werden auf die Ausländer und Migration geschoben.,1,0,1,0,0,1,1,0,0,0,0,0
deu_bf7c67eadc6c77f07a9c1b831c4e4638,Wer sabbert denn der Hamas nach?0,1,1,1,0,0,0,0,1,0,1,0,0
deu_bf84ebf5cff9fef0315e68f8248a6deb,"Eine Frage, die mal nichts mit dem schrecklichen Krieg zu tun hat: 

Was sind deiner Meinung nach die schönsten Orte in Kyjiw, die man bei einem Besuch unbedingt sehen sollte?


Und welche Variante des Namens ist vor Ort eigentlich geläufiger? Киев/Kiew oder Київ/Kyjiw?
Sowohl schriftlich als auch mündlich?^^",0,0,0,0,0,0,0,0,0,0,0,0
deu_bf8576c6dd507e89143a6f3ea56b786c,"Während Corona: 0
Nach Corona: 0

Bin Arzt, ich weiß, mäßig lustig",0,0,0,0,0,0,0,0,0,0,0,0
deu_bf86e8aeb64d412f4a839c6dad76c51b,Die jüdische Ecke und der Zentralrat der Juden haben Ofarim für seine Aktion stark verurteilt und die vollständige Rehabilitation des Managers gefordert,0,0,0,0,0,0,0,0,0,0,0,0
deu_bf9183ef9a4b5a6810617df871c74f37,Nunja das Hanta Virus haben die meisten Menschen wenigstens nicht dabei.,0,0,0,0,0,0,0,0,0,0,0,0
deu_bfa93ef2dce9f877f156b017219961cb,"> unkontrollierter Migration 

Fand den AfD Wähler.",1,1,1,0,0,0,1,0,1,0,0,0
deu_bfb527645348e42ce9469301bfa0f790,"Sicherlich richtig, aber damals war wohl noch niemand klar, dass er ein Faschist ist, sondern eher als Milliardär und abgehalfterter Gameshow-Host bekannt.",0,0,0,0,0,0,0,0,0,0,0,0
deu_bfb81989113c7df210fd8559c3007677,"Wir sind längst direkt vom Krieg getroffen. Es ist nur kein Krieg in klassischen Sinne, sondern im Informationsumfeld.",0,0,0,0,0,0,0,0,0,0,0,0
deu_bfcd0baf4ebc8de28598b8d1895226e6,Kratze eine Neoliberalen und der Faschist blutet :),1,1,0,0,0,0,1,1,1,1,0,0
deu_bfe2c9d549fb172b29297ad93cc788ba,ist er pro russland?,0,0,0,0,0,0,0,0,0,0,0,0
deu_c0183c355bc645535f13910277e70622,Putin zündet taktische Atombombe,0,0,0,0,0,0,0,0,0,0,0,0
deu_c051ed79ac6d6c1da6c69e1115016859,"Was nicht verkehrt ist da China mit der ganzen Welt unfair konkurriert (Arbeitsbedingungen, Umweltschutz, etc).",1,1,1,0,0,0,1,0,0,0,0,0
deu_c06780636daffb5d77578936b0744740,"> Um diese Forderung umzusetzen müssen ganz viele Leute auf Lastenräder umsteigen, aber scheinbar FFF nicht.

Auch FFF, doch nicht von heute auf morgen und nicht einfach so, sondern mit entsprechendem Ausbau anderer Möglichkeiten- wie dem auch sei, wir sind uns einig uneinig zu sein.",0,0,0,0,0,0,0,0,0,0,0,0
deu_c0a5801183b52c0b0abc003691594dd6,"Wäre dafür die Demo nach Moskau zu verlegen, finden die bestimmt ganz toll :)",0,0,0,0,0,0,0,0,0,0,0,0
deu_c0a6cef633e75b358380fe4161cab85b,"Russische Kriegsführung und russische Kriegsverbrechen sind so untrennbar miteinander verwoben, dass sie synonym zueinander stehen.",0,0,0,0,0,0,0,0,0,0,0,0
deu_c0bb38e32e570e72bbe87aacc8dab109,Man stirbt 1x pro Impfung,1,1,1,0,1,0,1,1,1,1,1,0
deu_c0bd18ac01af1a0f7eae7757a1d6cf36,Putin du hs wann frieden,1,1,1,0,0,0,0,1,0,1,0,0
deu_c0e0095a0d911c0db021c9abb4e73563,"Chemikalien in die Umwelt kippen ist richtig gut für den Umweltschutz! Das @USER

&amp;#x200B;

&amp;#x200B;

Vielleicht wenn man wochenlang Klebstoffdämpfe schnüffelt.",1,1,0,0,0,0,1,1,1,0,1,0
deu_c0f15fd19ff382d57884edf0de1c5735,Araber müssen nicht in den entsprechenden Ländern @USER Da die Zahl Araber unter jungen Menschen in Europa stark angestiegen ist und stark steigt plappern die halt ihren gefährlichen Schwachsinn überall rum,1,1,1,1,0,0,1,1,1,1,1,1
deu_c1186017766c80d9f78997262884ab0c,Wie kann man da schon wieder irgend eine gender kacke draus machen….,1,1,1,0,1,0,0,1,0,1,0,0
deu_c12d0aa17ae9e4e3cfa6cebea7de864e,„Bahnstreik an Ostern - warum hasst die Bahn das Christentum?“,1,0,0,1,0,0,1,0,0,1,1,0
deu_c14f214516b824f0721251f6b9b3d271,An und mit #Impfung?,0,0,0,0,0,0,0,0,0,0,0,0
deu_c15810a1daade628f55f96d7806c2029,"Du kannst ja sagen dass es mit Umweltschutz zu tun hat, und dass du willst, dass sie bessere Lebensqualität hat.",0,0,0,0,0,0,0,0,0,0,0,0
deu_c15a41f3bb6baf2b67a54a67305031bf,Die Lösung: ~~Ausländer~~ Nazis raus,1,1,1,0,0,0,1,0,1,0,1,0
deu_c187852190b78fbfe933607f7a27f84a,putin den technohahn zudrehen,1,1,0,0,0,0,0,1,0,1,0,1
deu_c18c82725a2a9363001ba7c0d326f0da,Zeit für ein Konzert/Demo/Sonderbeitrag gegen Rechts.,0,0,0,0,0,0,0,0,0,0,0,0
deu_c19ab2c3147bf3a129c5895a9694867c,"Russland greift Russland an?

Das Baltikum anzugreifen wäre völlig Wahnsinn, Russland hätte gegen die NATO selbst ohne USA keine Chance irgendwas militärisch zu erreichen.",1,1,0,0,0,1,0,0,0,0,1,0
deu_c1dbdc0cc4f569f003b6b5e89c4ca1d5,Putin wird blass vor Neid,0,0,0,0,0,0,0,0,0,0,0,0
deu_c1e815cf6ece1b0ea5453f4be2641db6,"Nein, es gab eine ausführliche Rechtfertigung der Thailandreise durch die ""Letzte Generation"".",0,0,0,0,0,0,0,0,0,0,0,0
deu_c2033a205037f483d4340a99ce97492f,Greta war zu based für die deutsche Klimabewegung. Zum Glück macht FFF De jetzt schon Realpolitik.,0,0,0,0,0,0,0,0,0,0,0,0
deu_c206b6c877a465aef966559d0b96c3c9,Frieden in den Erste-Welt-Ländern.,0,0,0,0,0,0,0,0,0,0,0,0
deu_c21bb2fea055a8ee056643c00bb64fa9,"Sowjetische Technik ja, nicht russische Technik.",1,1,0,0,0,0,0,0,0,0,0,1
deu_c21cb1128ed1c384a5f16439777a9991,"Man kann sich als #Transfrau aber was wichtig ist was im Personalausweis steht als Geschlecht. 

#TessaGanserer",1,1,1,1,1,1,1,1,1,1,1,1
deu_c22bc78b0dfc0fe881bab8c4c710d060,[This post or comment has been removed in protest of Reddit's API changes],0,0,0,0,0,0,0,0,0,0,0,0
deu_c239695df8dc179bea94eb0ec620372f,Plädiere für 'die letzte Generation wirft Bagger 288 in einen Pool Kartoffelbrei',0,0,0,0,0,0,0,0,0,0,0,0
deu_c248c68ac2d4dc778c96ba7240fd81e7,"Vorallem jetzt wo die Ukraine am verlieren ist im Krieg, ist einfache der Ukraine die nord stream Sabotage anzuhängen.",1,1,1,0,0,0,1,1,0,0,1,0
deu_c2625cdca5aa7a442d74ddf7e4e57c34,3-4 Jahre nach der Impfung ist es ja etwas schwer noch zu behaupten dass die Impfung alle umbringt. Klar behaupten die das nicht mehr. Schon die ganzen Telegramgruppen mit den ganzen Querdenkern vergessen?,0,0,0,0,0,0,0,0,0,0,0,0
deu_c28f836384d53f101780f75321ff6651,">Da kann man sich queer stellen, muss dann halt auch mit den Konsequenzen leben, wenn man die Realität nicht einsehen will.

Die da wären?",0,0,0,0,0,0,0,0,0,0,0,0
deu_c2b3432bec3a7212855a1ef654a70879,"Das Pornographieverbot ist nur dafür da, Schwule, Lesben, Transgender etc. verfolgen zu können. Project 2025 definiert öffentlichen queer zu sein als Pornographie.",1,1,0,0,1,0,1,1,0,0,1,0
deu_c2be8ace8346ea6eec1cb0e8eb35745d,"Du sagst im Grunde: Gewalt ist keine Lösung, ausser wenn sie doch eine Lösung ist.

Problem: Hannes Attackiert dich Gewaltsam.
Lösung: Du wehrst dich mit Gewalt.

Gewalt bleibt also eine Lösung.

Was du hier beschreibst ist man sollte Gewalt nicht proaktiv nutzen aber selbst da nennst du ja bereits eine Ausnahme. Wenn ich bereits Gefahr in Verzug sehe.

Problem: Hannes zeigt äußerst aggressives Verhalten und hat Peter schon am Kragen.
Lösung: Du packst den Hannes und fixiert ihn.

Gewalt ist also wieder die Lösung gewesen.

Gewalt ist eine Lösung. Ist und bleibt die Tatsache. Sie ist nicht die Lösung auf alles, das impliziert der Satz ja auch nicht!

Probelm: Autopanne
Lösung: Den Kerl vom ADAC vermöbeln.

Gewalt war keine Lösung.

Edit: Davon abgesehen sollte man, die Tatsache das Gewalt ein Lösungsmittel ist von moralischen und ethischen Vorstellungen entkoppeln. Das wir uns einig sind das Gewalttäter, Kriegstreiber, Diktatoren etc. nicht moralisch gut sind. Ich denke das sind wir uns einig.

Dennoch existieren sie und für diese Menschen ist Gewalt halt doch ein universales Lösungsmittel. Zur Gewalt gehören immer zwei.",0,0,0,0,0,0,0,0,0,0,0,0
deu_c2eefe04b7e863e431f8f6051640ca66,"Viele Leute schreiben ernsthaft Faschist*innen. Also, über alle Leute, die anders denken als sie.",0,0,0,0,0,0,0,0,0,0,0,0
deu_c2f6b39e728794104e9835bfae5adfe0,"&gt;Oder hast du dich vor Corona jemals darüber beschwert, dass keine Maskenpflicht herrscht?

Vor Corona gab es ja auch noch kein @USER

Die Logik mancher Nutzer hier ist so für die Tonne, @USER",0,0,0,0,0,0,0,0,0,0,0,0
deu_c2ff93715bd6dde031434c514bbc3f5d,Böse eingedeutschte Ausländer,1,1,1,0,0,0,1,1,0,0,1,0
deu_c308464efa387b815a226a9986c31de6,"Auch eine Schilddrüsenunterfunktion schwächt das Immunsystem. 
TSH, fT3 und fT4 Wert testen lassen, falls sie noch andere Symptome einer Unterfunktion hat",0,0,0,0,0,0,0,0,0,0,0,0
deu_c34b29a6d69344546771beb589249dfa,"Man muss sich auch nicht ""ums Klima kümmern"", es würde reichen das Klima nicht konsequent kaputt zu machen.",0,0,0,0,0,0,0,0,0,0,0,0
deu_c34ecfc5e3b535ce9681937ecef106fe,"&gt; Die Grundsätze hierfür stellt das Reich (aka Bund) auf.

Die Schranken, die der Bund hierfür hat, sind nicht festgelegt.",1,1,0,0,0,0,0,1,0,1,0,0
deu_c37073f467b3f1126ef690035dbf1996,Ach na dann ist die Pandemie ja Humbug,0,0,0,0,0,0,0,0,0,0,0,0
deu_c38e608e4b4b1820124900b5aa1edfcc,An der Uni Moskau findet sich bestimmt noch ein Plätzchen.,0,0,0,0,0,0,0,0,0,0,0,0
deu_c3951aec80da74e0196f3fec167c14b7,Hauptsache Israel treu sein 💪,1,1,0,0,0,0,1,0,0,0,1,0
deu_c39bab9bd69faf51a917a1682919b3a4,Die Frage is ein mindfuck und absurd. Man kann nicht wissen auf was man nicht vorbereitet ist weil sonst wäre und könnte man sich darauf vorbereiten. duh,0,0,0,0,0,0,0,0,0,0,0,0
deu_c39bb5a3fa522f04f66f689f6931e5ce,Russland macht Russland-Dinge. Es wird immer dreister.,0,0,0,0,0,0,0,0,0,0,0,0
deu_c3a1f2dbc29091f4fae0b7395dd2056a,"Wenn du beim doc um ne Impfung betteln musst, läuft was falsch.",0,0,0,0,0,0,0,0,0,0,0,0
deu_c3ca4a9dea1266a3473dced59e8ab25e,Wenn ich schon wieder dieses Woke lese. Der AfD ist sogar unser Grundgesetz zu Woke. Hört auf das Wort so inflationär zu gebrauchen.,0,0,0,0,0,0,0,0,0,0,0,0
deu_c3d3a2434f56dc8595186d7e65f92c4d,"Wäre bei solchen Vergleichen eig. nicht auch relevant, wie viele zusätzliche Tonnen CO2 eine Person pro Jahr in der CO2 -Kreislauf gibt, statt wie viel Tonnen CO2 sie insgesamt erzeugt?",0,0,0,0,0,0,0,0,0,0,0,0
deu_c3d4bd1bbb5b560349f495f3b39287dd,Die Hamas ist die Regierung im Autonomen Gebiet Gaza. Selbstverständlich kann diese Kriegsverbrechen begehen,1,1,1,1,0,1,1,1,0,0,1,0
deu_c3e0a97ad3da515efe85cc604c9f3588,Er ist Team Russland.,1,1,0,0,0,1,1,0,0,0,1,1
deu_c405fa83d29a7480954b51ff08c2e233,"Der Treibstoff Mythos ist der beste 

Wobei der mit der Logistik auch gut ist 

Ukraine betreibt ja nicht die größte(zweitgrößte  nach Russland) europäische Panzerarmee derzeit 

Mit t72,t80 turbine, t80 diesel,bmp1,bmp2 als Fahrzeuge mit höherer Stückzahl aka über 100 außer t80s duh",0,0,0,0,0,0,0,0,0,0,0,0
deu_c45aa7ac0248ce676dac5bd74509c7ad,"Zuerst dachte ich, dass der Typ meint, dass die russische Armee so schlecht ist, dass keines ihrer Waffensysteme bis nach Kiew durchdringt. Aber – wie es scheint – ist das auch nur so ein pro-ivan futzie.",1,0,1,0,0,1,1,1,0,0,0,0
deu_c45ac5a3da2be36870c4c4caddac8498,Es gibt keinen deutschen Islam.,1,0,0,1,0,0,1,1,1,0,1,1
deu_c46e3280c770915cc401fc4c455db613,"Ist doch immer so bei Ideologie. Nicht dass ich den ""Wokismus"" oder wie man das sonst nennen möchte für eine besonders gute Ideologie halte.",0,0,0,0,0,0,0,0,0,0,0,0
deu_c4b0650396a15542daf3c2abb34c73cf,">Genau einen Monat nach Kriegsbeginn fährt Paul Ronzheimer als erster deutscher Reporter mit der israelischen Armee in den Gaza-Streifen. In Beit Hanun wird in unmittelbarer Nähe gekämpft. Hamas-Terroristen greifen aus einer Schule heraus an. Sehen Sie die hier den exklusiven Bericht aus Gaza. 

@USER (3:34 min)

Artikel:

@USER",0,0,0,0,0,0,0,0,0,0,0,0
deu_c4bcbef6e6ff717a85781d2e9e6cad6d,Querdenker lässt Wunde nicht verarzten: Chirurgie würde „Fäden ziehen“,1,1,0,0,0,1,1,0,0,0,1,1
deu_c4bf696c2d7120d9b1cf4b8bc4bd26e4,Hat der bot wieder zugeschlagen. Schroedingers Polizeistaat. Zu dämlich… @USER,1,1,0,0,0,1,1,1,0,0,1,1
deu_c4d260a81b713cc97bf85c2bfec89b64,BDA steht scheinbar für Bund der Arschlöcher,1,1,0,0,0,0,0,1,0,1,0,0
