id,text,polarization,political,racial/ethnic,religious,gender/sexual,other,stereotype,vilification,dehumanization,extreme_language,lack_of_empathy,invalidation
deu_490efd97fcd0192ba20340c6eae311b2,Verbreitet den gleichen Virus nocheinmal!,1,0,0,0,0,1,0,0,0,1,1,0
deu_49135d52b01cdbcf631a7b76cad5ef5e,"Die Schwarzmeerflotte feuert vom Hafen aus viele Marschflugkörper vom Typ Kalibr auf ukrainische Städte, das sollte schnellstmöglich gestoppt werden.",0,0,0,0,0,0,0,0,0,0,0,0
deu_4916cc335636a62423e48d2476dcc3d2,"Jaja das Jüdische Viertel in Jerusalem hat sich durch Zauberhand geleert.  
Genauso das Jüdische Viertel um das Grab von Shimon haTzadik.

Alles durch Magie wenn die Araber schalten und walten.

Aber das gleiche bei Juden ist geplant und böse.",1,1,1,1,0,0,0,0,1,0,1,0
deu_49390ac8da0215df7b9e4c4c0f3567b3,Wo war Moskau als Damaskus fiel?,0,0,0,0,0,0,0,0,0,0,0,0
deu_493d1e22b65a66f7c5fc6a03b006b4cf,"Ein gefährliches Virus, das sich weltweit ausbreitet und vor allem ältere Risikogruppen tötet, wäre mal nicht schlecht. Sarkastisches /s.",1,0,1,0,0,1,0,1,1,1,1,1
deu_4970c3959cd64d7ea9271b9f0d77d185,"> Als Frau bin ich das Daueropfer toxischer Männlichkeit und als Gen Y werde ich immer mit den Boomern in einen Topf geworfen, das schmerzt/ s

Tragisch! Ich als männlich präsentierende lesbische Transfrau habe jetzt endlich den Opferstatus, den ich mir als hetero Mann immer so sehr gewünscht habe.",1,0,0,0,1,0,1,1,0,1,1,1
deu_497d4bceb0db15124a5edae56292c174,Und das rechtfertigt jetzt wie genau Angriffe auf Juden in Deutschland?,0,0,0,0,0,0,0,0,0,0,0,0
deu_49a20b9d499d4532b110f16888a58e82,Komisch das Wolodymyr Selenskyj und auch alle anderen Politiker in der Ukraine nicht geflohen sind. Scheinen irgendwie noch dort zu sein.,1,1,0,0,0,1,0,1,0,0,1,0
deu_49d04a8f0b01d05e4bc87d97d5cac911,"Die Leute oben wurden ja nicht angeklagt weil sie Faschisten waren, sondern weil sie dazu noch Völkermörder und Kriegstreiber waren.",1,1,1,0,0,1,1,1,1,1,0,0
deu_49f1ec69b0f90453c4adde2347765845,Ich betrachte diesen ganzen Woke-Aktivismus auch al eine Form von Ersatzreligion,1,1,0,1,0,0,1,1,0,0,0,0
deu_4a388b4b8d5e0cf7b420460437a8a321,"Da diese in Fester form gut kontrolliert und verpackt sind, nein. Genauso ist ja auch Arsen aus der Produktion für EE keine ""Emission"" der EE, das wäre Absurd. Es ist ein Abfallprodukt, womit man aber gut umgehen kann.

Nur mal so am Rande: Bei der Kohleverbrennung, welche dank Atomausstieg stärker ist als nötig, werden radioaktive Stoffe einfach so in die Luft geblasen, ohne das es jemanden Interessiert.",1,0,0,0,0,1,1,0,0,0,1,0
deu_4a403b9673e57afd05bb931015d7e238,"Nein, nicht ausschliesslich. Es verprügeln auch nicht ausschliesslich Homosexuelle Muslime.",1,0,0,1,1,0,1,1,0,1,1,0
deu_4a4c21f7dda949443979407112d9ffb0,"Fun Fact: ""Gender-Wahnsinn"" nutzen nur Leute die verzweifelt was zum Aufregen suchen.",1,0,0,0,1,1,1,0,0,0,1,1
deu_4a4ff53dc08f05e4aad467a159018cad,Die Maßnahmen waren definitiv zu lasch und die Pandemie ist noch bei weitem nicht zuende.,0,0,0,0,0,0,0,0,0,0,0,0
deu_4a5a65e3a051a482e053d2dcf1d290fb,"""Alle Optionen offen"" reicht aber von Russland unterstützen bis Russland angreifen. Es macht schon Sinn einige davon im Vorfeld auszuschließen.",0,0,0,0,0,0,0,0,0,0,0,0
deu_4aa428fcf852a64f194877c7b97447ce,Da fliegt man einmal nach Moskau und dann sowas…,0,0,0,0,0,0,0,0,0,0,0,0
deu_4ab54f7b273c9d666929b681550baf96,"Wobei die Ukraine sich aktuell so verhält, dass die Untersuchungen torpediert werden.


Flucht im ukrainischen Diplomatenfahrzeug @USER


Auch Kooperation wie bspw Auslieferung der verdächtigen oder verhör in der Ukraine gab es bisher keine.",0,0,0,0,0,0,0,0,0,0,0,0
deu_4ac959eca4b44d6f83831bd89524939f,"1991 waren die mal in Moskau, dürfe ziemlich nett gewesen sein",0,0,0,0,0,0,0,0,0,0,0,0
deu_4ada2a76d8f366816a4cd4abdc643a38,Weil der islam eine spaltende Hass Religion ist und das Christentum größtenteils harmlos.,1,1,0,1,0,0,1,1,0,1,1,0
deu_4b10d4f84bd9b3cc0b8668a39118b129,"Wo sind die Politiker und ihre Bekenntnisse ""Nie wieder""?

Warum wird diese Demonstration nicht mit Wasserwerfer und Polizei aufgelöst und die Veranstalter zur Verantwortung gezogen?

Wo sind die Gegendemonstranten, die immer gegen rechts demonstrieren?

Wo ist die Stellungsnahme der Politik?

Was ist mit voller Härte gegen Antisemitismus?",1,1,0,1,0,0,1,0,0,0,0,1
deu_4b1679c3322ae4e124ea75de21e53479,"Problem ist, dass die letzte Generation null Druckmitteln hat. Alles was sie ausgelöst haben waren genervte Stimmung gegen sich selbst.",1,1,0,0,0,1,1,0,0,1,1,1
deu_4b36012124459ad8dc79b72e65ff687a,@USER Kommt auch drauf an ob du überhaupt Geld zum verleihen hast. Und jetzt?,0,0,0,0,0,0,0,0,0,0,0,0
deu_4b3bf79b13aba991fc03caab2ade2ebe,Lass doch bitte die Afrikaner in Frieden.,0,0,0,0,0,0,0,0,0,0,0,0
deu_4b53d7e943062824cbcea5726bccbf5b,"Keine Regel aber eine Spanplatte wurde wegen mir angeschraubt: 
Das Gelände meines Kindergartens ist Eck-an-Eck mit einer Grund- und Hauptschule. An dieser Ecke gab es eine ganz schmale, offene Lücke. Tja und klein Mia hat sich eine Freundin geschnappt, zum gemeinsamen Ausbruch angestiftet, durch diese Lücke gequetscht und wir haben uns in die Schule geschlichen. Und gewundert, wo alle Schüler sind - im Unterricht, duh. Ich bin jetzt 27 und die Spanplatte zu meinen Ehren ist dort immer noch. 🥺",0,0,0,0,0,0,0,0,0,0,0,0
deu_4b6216fc1bc9aa3fbc3dfb921620d1ee,"Es macht jemanden queer nicht heterosexuell zu sein. Cross-Dresser und vor allem Leute die sagen ""ist ein reines Sex Ding"" sind heterosexuell mit einem Fetish.",1,0,0,0,1,0,1,1,1,0,0,0
deu_4b70ef461d3b08dc48622733381de054,Faschistische Partei faschist einfach.,1,1,0,0,0,0,1,1,0,0,0,0
deu_4b7decdac1e2bd9db481304ea028722f,Weil es ihrer Ideologie entspricht!,1,1,0,0,0,0,1,0,0,0,0,1
deu_4b8fca77704e9d6002244c2f2a542b37,"„ But the level, the number of people dying is number one, not sustainable“  

Well duh, killing enemy soldiers until the enemy  can’t send replacements is kinda the point. ",0,0,0,0,0,0,0,0,0,0,0,0
deu_4b9b1b1843d76940d7408018de28cfac,"Der besagte Virus nennt sich  AVG, weg damit :D",0,0,0,0,0,0,0,0,0,0,0,0
deu_4b9f4d207f2ba4d284c0c926f3770474,"Die da wären?
Die stumpfe Gender/ LGBTQ+- Story oder was meinst du?",1,1,0,0,1,0,1,0,1,1,1,1
deu_4ba688ed83c6c96a55ec94611cfa2c78,Meinst du aus der Woke Culture aussteigen?,0,0,0,0,0,0,0,0,0,0,0,0
deu_4bb5e669a573a18847c51ef23333ba82,jetzt noch geplante co2 steuer abschaffen,0,0,0,0,0,0,0,0,0,0,0,0
deu_4bb8c9a911deee600842fda5ab22c9c9,linksgrün. Du hast linksgrün vergessen.,0,0,0,0,0,0,0,0,0,0,0,0
deu_4bdbec159caf5c1a2a8212207d4ea038,Klingt eher nach Ukraine.,0,0,0,0,0,0,0,0,0,0,0,0
deu_4be2624856333536ca22e9f2cb12df51,"Steuerzahler, bzw. die Bevölkerung in D und auch EU wünscht sich außerdem mehr Tierwohl und Umweltschutz.",0,0,0,0,0,0,0,0,0,0,0,0
deu_4bf7f8eeacd63ca8bd6de9b8c16105c9,"Bei meiner Google-Bildersuche mit dem Begriff ""Faschist"" immerhin Platz 8 und 10.",0,0,0,0,0,0,0,0,0,0,0,0
deu_4c0132d13c48407ce732ce04720ecac5,"Arbeits- ins Umweltschutz kosten. Darum produzieren wir hier ja auch fast nichts mehr, sondern lassen das da machen, wo diese Kosten nicht anfallen.",1,1,0,0,0,1,1,1,0,0,0,0
deu_4c316416de5299956a84afcd1f1e7412,"Wenn man bedenkt, dass es nur rund 6 Millionen Muslime in Deutschland gibt, behaupte ich, dass es da nicht nur um Muslime geht.",0,0,0,0,0,0,0,0,0,0,0,0
deu_4c60e9453da628e07bd2fa526d3d9d49,Pride flag pro Palestine demonstration,0,0,0,0,0,0,0,0,0,0,0,0
deu_4c6fef65f685c879488c4dcb4bf7f860,Krieg da nur einen 404 :-(,0,0,0,0,0,0,0,0,0,0,0,0
deu_4c86ed24ea664d45884edcb1a4fda67d,Stimmt türken und russen waren schon wichtig und richtig,0,0,0,0,0,0,0,0,0,0,0,0
deu_4cae22b10a800e92e30c4a8d45a5c7fa,">Wir werden Neukölln zu Gaza machen.

Sie fordern einen Zaun!",1,1,1,1,0,1,1,0,1,1,0,0
deu_4cb067932e6e50aaab8a14a4b14a8b69,Ich krieg mich nicht mehr 😭😭😭😭😂,0,0,0,0,0,0,0,0,0,0,0,0
deu_4cc3825d5be093563f6a3a2475bdd4c0,"Wir haben 4,7 Milliarden für U-Boote, nicht aber für neuen Wohnraum oder Frauenhäuser? Verkehrte Prioritätensetzung. Der Kriegstreiber muss weg.",1,1,0,0,0,0,0,1,0,1,1,0
deu_4cd9ced61ccbd5c8c45362e70e31b6a6,Mein Beileid. Ruhe sie in Frieden.,0,0,0,0,0,0,0,0,0,0,0,0
deu_4ce411a3b815da3e637cc1f9ae90c72e,Dann ist mal wieder Zeit für ein Konzert gegen Rechts!,1,1,0,0,0,0,0,1,0,1,0,1
deu_4d1d3fba1cd096f204cd9dfaa764e879,Wer mit dem #Impflicht Bürger kriminalisiert ist ein Faschist! #impfenohnepflicht #Impfzwang #coronavirus,1,1,0,0,0,0,0,1,0,1,0,0
deu_4d33560dd1f90a9e508748a7ebc33811,Ich für meinen Teil ziehe einen kalten Krieg einem heißen Krieg massiv vor.,0,0,0,0,0,0,0,0,0,0,0,0
deu_4d33b4fffa8b98044dc0b79c6cd3a5e4,Corona hatte es versucht /s,0,0,0,0,0,0,0,0,0,0,0,0
deu_4d5e6bcd9745be0ee9b05a72f0ed55c3,"Der Westen der Ukraine von Lviw bis Kiew ist nun recht sicher. Besser jetzt fahren, als es später bereuen. NDA.",0,0,0,0,0,0,0,0,0,0,0,0
deu_4d64303d4ccdad03b3a81e9723c5c7e0,"Wie erkennst du den Türken, also woran?",0,0,0,0,0,0,0,0,0,0,0,0
deu_4d7ca5f502008c45c0d56093791fcc9d,"Ich bin jedesmal froh, dass ich mit keinem dieser Gruppen zu tun hab. Weder Nazis, noch Queer-Personen. Sollen ihren Kampf ohne mich führen.",1,1,0,0,1,0,1,0,0,0,1,0
deu_4d7f2f5c4f56fdbda6a0aad7661727af,"Ich ergänze um Machtgier, Geldgier, Ideologie und Verblendung.",0,0,0,0,0,0,0,0,0,0,0,0
deu_4db0bb0a06ea48a754b2cfb4a693a99f,"Errinert mich an den Fall in Kanada wo eine ""Transfrau"" mehrere Waxingstudios verklagt hat weil sie dort nicht ihre Hoden waxen wollten.",1,1,0,0,1,0,1,1,1,0,1,1
deu_4dd9cbf3de35f1ba35068ee43eb2caf7,"Was meinst du mit "" 'Ausländer' ""?",0,0,0,0,0,0,0,0,0,0,0,0
deu_4de4f53c6194f36b55fa2d9e371d49d9,"Ich will mich jetzt nicht großartig weiter mit dem Fall befassen, aber kann mir wer erklären, wie zur Hölle man *mit dem Auto* einfach mal ""in eine Demonstration gerät""?

Wenn man sich fahrlässig in so eine Situation begibt müsste das doch dein Recht auf straflose Selbstverteidigung ziemlich beinflussen.",0,0,0,0,0,0,0,0,0,0,0,0
deu_4dea410423b81a9b6c3f538ef5a73900,Hattest du  Corona??,0,0,0,0,0,0,0,0,0,0,0,0
deu_4e24ee56896b657571d1ef907a205ec1,"Ja, weil dann Corona kam.",0,0,0,0,0,0,0,0,0,0,0,0
deu_4e2a76bfa3d1fcfc62e2e858b86964fe,Auch ne gute einstiegsfrage: „was hältst du von der Impfung oder vom Ukrainekrieg?“,1,1,0,0,0,1,1,0,0,0,0,0
deu_4e41f96cbe6b8dda857714e93d6dd2b6,Löschdecke und am besten ein Co2 Feuerlöscher,0,0,0,0,0,0,0,0,0,0,0,0
deu_4e4c622f496300658561817f7e9c7eed,"@USER

@USER

@USER

@USER

@USER

@USER


@USER


Die AFD hat am Anfang auch mal einen größeren Kredit aus Russland bekommen. Das finde ich aber gerade nicht.",1,1,0,0,0,1,0,0,0,0,1,0
deu_4e554842030561c691e063d0a813706a,Vor social media und Globalisierung war Deutschland ein queer freundliches Utopia der Gleichberechtigung :‘),1,1,0,0,1,0,1,1,0,0,0,0
deu_4e57a543a17857e674bc68e5c085ad9d,"Körnerbrötchen, Fahrradweg, Windrad und kein Islam Appeasement, es könnte so schön sein.",0,0,0,0,0,0,0,0,0,0,0,0
deu_4e5de4c6d7a1fed78cef9a8a8cebe06f,"Musst ja nichtmal queer sein, christlich würde schon reichen, sofern  du keinen guide @USER an der seite hast.",1,0,0,1,1,0,1,0,0,1,1,0
deu_4e629e7f36c33b31da41b5c0a32f9a80,">Unter russischer Besatzung kann es keinen Frieden in der Ukraine geben.

Es gäbe dann keine Ukraine mehr. Die jetztige Ukraine wäre Russland einverleibt und man würde in einer Diktatur leben.",0,0,0,0,0,0,0,0,0,0,0,0
deu_4e95abee7b02df6d10ce966a59f3149f,Frieden und Wohlstand für Alle!,0,0,0,0,0,0,0,0,0,0,0,0
deu_4ebcad717624b8092960df91b452e0a8,"Vom Tellerwäscher zum Millionär: in ""Amerika""? Nein, sowas ist in Deutschland möglich, genauer gesagt: im ""linksgrün versifften"" Berlin. #Migration #Deutschland",1,1,1,1,1,1,1,1,1,1,1,1
deu_4ecb1b447aa968b6ec056363a4cc1d63,"Ich gebe dir vollkommen recht. Das beste daran ist aber, dass gleichzeitig allerorten von einem ""Linksruck"" im Land und in der CDU gefaselt wird, der angeblich unter Merkel stattgefunden hat.

Alles bleibt so, wie es ist. Und wenn die Realität doch mal Anpassungen **erzwingt**, wird das als Annäherung an linksgrün @USER",0,0,0,0,0,0,0,0,0,0,0,0
deu_4ee59705ad1c79f9b58ecd209301a6ca,"Junge dein Kommentar war ein edgy duh like ""uh alles bumbesgeschichten"" Dass du dich so verhälst ist dein Probelm.",0,0,0,0,0,0,0,0,0,0,0,0
deu_4f2149399ab22d1004f4775f0b411b64,"Echt mal, warum sollte auch nur der russische mitlesen dürfen",1,1,1,0,0,0,1,0,1,0,1,0
deu_4f352ffe81b298f50b3ce2253067920b,"Juden haben vor allem in westlichen Ländern gelitten. Meiner Meinung nach muss der Westen den Juden ein Land zur Verfügung stellen. 

So hat man es sich einfach gemacht und das Problem, also das finden eines Landes für Juden, einfach dem nahen Osten zugeschoben.",1,1,0,1,0,1,1,0,0,0,1,0
deu_4f4101f585853371f2b46a550c27915a,"Bei großzügig berechneten 1250€/Monat an Ausgaben für einen Flüchtling könnte man denselben Flüchtling hier 140 Jahre versorgen. Total absurdes Gesetz das dem Asylbewerber schadet, das der Gesellschaft schadet, das den Staatshaushalt schadet, das den Menschenrechten schadet. Und alles nur weil Konservative ihre Fremdenfeindlichkeit ausleben wollen.",1,1,1,0,0,1,1,1,0,1,1,1
deu_4f4f03ffe0ca079f7d87d9b2e103efe2,"Von wegen Geisel. Die Maus macht freiwillig mit, sie ist im Herzen Revolutionär!",0,0,0,0,0,0,0,0,0,0,0,0
deu_4f7ed09485404a3e801010ef61eadbfd,Wie viele Covid Infektion hattest du seit Beginn der Pandemie?,0,0,0,0,0,0,0,0,0,0,0,0
deu_4fc4c2395fc1ccea881d7000dc61421c,"> „Vom Gender Stern zum Juden Stern in fünf Minuten“ 

wtf",1,1,1,1,1,0,1,1,1,0,1,0
deu_4fc7bac3d8de09ca9811910f0af65bb0,"> Nein, war ja Geld für die Hamas und ich halte von der Hamas nichts.

Die Hamas war die Regierung im Gazastreifen, sehr viele Hilfsgelder sind am Ende an sie geflossen.

> Und halt dass er die Hamas stärker werden lassen hat.
Was wäre die Alternative gewesen? Die Hamas stürzen oder sie isolieren und damit im Endeffekt Gaza (inklusive die Zivilbevölkerung) aushungern.",1,1,1,0,0,0,1,0,1,0,0,0
deu_4fd5dc59883c7fe2eba4b13bf2c82f5f,"Ich weiß nicht, ob Sahra Wagenknecht eine russische Agentin ist. Die Frage, ob Sahra Wagenknecht eine russische Agentin ist, drängt sich mir aber jeden Tag auf. Ich google jeden Tag ""Sahra Wagenknecht Spion"" ""Sahra Wagenknecht russische Agentin"" und ""Sahra Wagenknecht KGB Agentin"". Ich hoffe so eines Tages die Antwort zu finden, ob Sahra Wagenknecht vielleicht wirklich eine russische Agentin sein könnte. Ob Sahra Wagenknecht wirklich eine russische Spionin ist, weiß am Ende nur die russische Regierung, sollte sie Sahra Wagenknecht als KGB-Spionin angeheuert haben. Es wäre wirklich schade, wenn sich herausstellen würde, dass Sahra Wagenknecht die Deutsche Bevölkerung und die der Ukraine an Russland verraten hätte.",1,1,1,0,1,0,1,1,0,1,0,0
deu_4fddada15f6e99ff6eb6b0d1e8a5b83d,Her daddy Putin approves,0,0,0,0,0,0,0,0,0,0,0,0
deu_50224c788ca0b9d11fc3caabb9a89a21,Stimmt. Die letzte Generation und ihre Methoden sind absolut unumstritten.,0,0,0,0,0,0,0,0,0,0,0,0
deu_5043c4e8cd5dace3fcd68f1aee6115da,"Nun ja, Alice Weidel meinte ja selbst, dass sie ""nicht queer ist, sondern nur mit einer Frau zusammen"". Diese Art von mentaler Gymnastik muss man erstmal hinbekommen.",1,1,0,0,1,0,0,1,0,1,0,1
deu_505fcbef1a34844c8a83e30e94ce0648,"Nicht, wenn ich Putin @USER :)",0,0,0,0,0,0,0,0,0,0,0,0
deu_507dea7e38541828b2c164d9cb1df851,"Wer nicht woke ist, ist ein Schlafschaf, ganz klar",1,0,0,0,1,1,1,1,1,0,0,0
deu_50993e02b800428ef14e358e7b020bf8,"Wie werden die Araber denn in Israel diskriminiert? Ich meine die Frage ernst. Landläufig hört man ja eher, dass die Kulturen in Israel friedlich zusammenleben.",0,0,0,0,0,0,0,0,0,0,0,0
deu_50ccf34a2ca7226d18fd8413430399ef,Das lächerliche Bild muss für die Ideologie herhalten und verteidigt werden.,1,1,0,0,0,0,0,1,0,1,0,1
deu_50e079a935f4513121127a4341e735b5,"Es war nur eine Frage der Zeit, bis diese Querdenker auf den Impfstoff-schaden Zug aufspringen.",1,1,0,0,0,1,1,1,1,0,0,0
deu_50eba98664e5cd746168b44c67691d24,Ukraine nutzt ja auch Streumunition.,0,0,0,0,0,0,0,0,0,0,0,0
deu_50eee6d8e7ff7010c44c705d4920fcb7,"Ne, aber sie sind gerade im Gaza-Streifen und Westjordanland.",0,0,0,0,0,0,0,0,0,0,0,0
deu_510d7b58c7b75cde317c190b40cf3e66,Zumindest kann jetzt niemand der noch die AFD wählt sagen er sei kein Nazi/Faschist.,1,1,0,0,0,0,1,0,0,0,0,0
deu_510de57579e2d7122fddbeab7df82db8,">Ein kompetenter PR-Berater täte der LG durchaus gut.

@USER",0,0,0,0,0,0,0,0,0,0,0,0
deu_511f84cac458f641fb5b4dc610200e24,"Das ist zu 100% Binär. Wenn du dich mit Virus A ansteckst bringt das nichts, 0, Nada wenn du Virus B später bekommst.

Das einzige was nicht Binär ist, ist wenn du Unterklassen von Viren bekommst, @USER Virus A-Unterklasse A1, dann *kann* es sein, dass du gegen Virus A-Unterklasse A2 ein gewissen Vorteil hast. 

Es gibt aber sehr sehr viele Viren und Bakterien.",0,0,0,0,0,0,0,0,0,0,0,0
deu_5123a457b9fab66e3dc2f0f298996c5b,"Warum wählst du eine Partei, die offen rassistisch ist - zudem mit Faschist an der Spitze?",1,1,0,0,0,0,1,1,0,1,1,0
deu_5129443ed4601aada07ddb220c2149ed,"Ausgeschlossen, da kriegen wir eher rot-rot-grün im Bund.",0,0,0,0,0,0,0,0,0,0,0,0
deu_51451e027e908c02a8f946bd7fc8f4c5,"Ich glaube letzteres ist Absicht. Das ist ja auch die Fraktion, die am ehesten für das Virus anfällig ist.",1,1,0,0,0,1,1,1,1,0,0,0
deu_5172fcfcdb66ca73fe2a0f7e26203e94,Und wieviele von denen haben Verbindungen zu Hamas und Hisbollah?,0,0,0,0,0,0,0,0,0,0,0,0
deu_5177bc6fe5a1d538a1d4f4d25ae59868,Klima retten durch Geld verbrennen!,0,0,0,0,0,0,0,0,0,0,0,0
deu_5190a9959c58126f99d9cc755683020e,Nicht impfen! Dann bleibt das Immunsystem auch intakt! Muss man wissen.,1,1,0,0,0,0,0,1,0,0,1,1
deu_51967f6fdbce3413a11c389e45389947,Das nimmt die Hamas ja ohne weiteres in Kauf.,0,0,0,0,0,0,0,0,0,0,0,0
deu_51acea0a54005cefe774398bd7f6e107,Faschist sein macht das Leben doch echt viel einfacher.,1,1,1,0,0,0,1,1,0,0,1,0
deu_51e6a19aae70e13aaf204c9b7acc9199,"Ah, da kam also die Dienstanweisung aus Moskau.",1,1,1,0,0,0,1,1,1,1,0,0
deu_51f39b7dc69103ed1bc8bdd44c21582c,"Bärbock aufzustellen war reinste Ideologie. 
Wäre Habeck angetreten, wäre er jetzt Kanzler",1,1,0,0,0,1,0,1,0,0,1,0
deu_51f80e76c52eb539bc7e0dadee00fd90,Oder einfach Religionen. Ist ja nicht so das Christen und Muslime für ihre Toleranz bekannt sind.,1,0,0,1,0,0,1,1,0,0,0,0
deu_52101d487fbe73ec4433a71a6ef4a407,Das freut die toten Kinder in Gaza!,1,0,1,0,0,1,0,1,1,1,0,1
deu_524a2ecf14a3e11b3526a5107fdb369e,"Bonusrunde: Wärmepumpen retten das Klima weil sie mit Strom laufen, aber Klimaanlagen zerstören das Klima weil sie mit Strom laufen",1,1,0,0,0,1,1,0,0,0,1,1
deu_525277aa97d68b3f9d74cf069b3ab7df,Ich meinte doch den anderen rechtsradikalen Faschist 😭,1,1,0,0,0,1,1,1,0,1,0,0
deu_52641c7e9cbc8cf7eef820302e595045,"Abgesehen davon, wofür ""queer"" heutzutage steht (quasi alles von ""hetero aber hält sich selbst für asexuell"" über ""hetero aber steht drauf andere im Bett grün und blau zu schlagen"" zu ""steht auf Kinder"") ist die ursprüngliche Bedeutung des Wortes ""queer"" nichts, womit ich mich identifizieren möchte. Ist doch unerheblich, ob man Spahn und Weidel politisch mag, and den zitierten Aussagen war absolut nichts verkehrt.",1,1,0,0,1,0,1,1,1,1,1,0
deu_52699b50c20988efc7189146fcabe84d,und die freie Welt möchte einen Regimewechsel in Moskau. Deal.,0,0,0,0,0,0,0,0,0,0,0,0
deu_526cbb58048cfd9e3188e28a04dbfc08,Wie genau sind das nun Kriegstreiber?,1,1,0,0,0,0,0,1,0,1,1,1
deu_528ca82918579ee4f5b5cf16b1d9456a,"Gibt es Belege dafür, dass Muslime zunehmend extremistischer werden?",0,0,0,0,0,0,0,0,0,0,0,0
deu_52932785c819520259d38bef4212b01b,"NDA
Reddit ist ein ganz übler Sumpf aus woker Scheiße und Gender Sternchen.",1,1,0,0,1,1,1,1,1,1,1,1
deu_52a1871ffdb982cb867ee698f812ed77,Russische Cruise Missiles haben ne Ausfall-/Fehlerquote von fast 20%. Also streich mal Karlsruhe und Dresden von der Liste und füge stattdessen zwei russische Städte mit hinzu :D,1,1,1,0,0,1,1,1,0,0,1,1
deu_52a4f8fda8e471ffb0e156cd48d11b5d,"""Moskau

Fremd und geheimnisvoll

Türme aus rotem Gold

Kalt wie das Eis
""",0,0,0,0,0,0,0,0,0,0,0,0
deu_52c429dd7eeca978f1aa3b7c78aa53aa,">Weil die Links- und Rechtsaußenparteien Krieg doof finden, finde ich Krieg gut.

Wahrlich eine Position der Mitte.",1,1,1,0,0,0,1,0,1,0,1,1
deu_52c9a70717eb8c18cc78b906921bc7bc,Wie Kiew die Offensive in der Disco vorbereitet :D,0,0,0,0,0,0,0,0,0,0,0,0
deu_52c9c77e8aa70efead3791b87ad0f603,Für Radinfrastruktur zahlt der Bund dieses Jahr ca. 350 Mio. EUR. Für Seilbahnfantasien 0 EUR. Oder nicht? Welches Seilbahnprojekt fördert der Bund?,0,0,0,0,0,0,0,0,0,0,0,0
deu_52cd88a129b05b01d0738e2f5cc6d4a4,Garkeins. Jeglicher Protest wird als Nazidemo abgestempelt und keiner geht dann hin,1,1,0,0,0,0,1,1,1,0,1,1
deu_531f2de20a0b66ffc67581c4b45ee6ef,Geopolitisch sinnvoll wäre es die Situation auszunutzen und Moskau einzunehmen.,1,1,0,0,0,0,0,0,0,1,0,0
deu_5326a3fc3a292102aabc3f69b2e123e9,Woke Soy Boys/Girls hier,1,1,1,0,1,0,1,0,1,0,1,0
deu_5339379857f6d37aa346bf4c031c517b,"Neuigkeiten:""Typ der mit Russland geschäfte macht sagt Russland keine bedrohung""",1,1,0,0,0,1,1,0,0,0,1,1
deu_53558ab74932bb644b09f65745bc4f4b,Außerdem wurde die Prüfung der Impfung über die angegebene Chargennummer des Impfstoffs durchgeführt,0,0,0,0,0,0,0,0,0,0,0,0
deu_539194d2e82c522a4b562c801f36464b,Die Hasskommentare hier sind echt peinlich. Die Türken und Niederländer sind 🤝,0,0,0,0,0,0,0,0,0,0,0,0
deu_5394bfc50ac8af7402fcc45995ea7c5c,Versucht Orban das Klima zu retten?,0,0,0,0,0,0,0,0,0,0,0,0
deu_53b137628279dba833b327980484d8de,Die russische Propaganda lügt so oder so.,1,1,1,0,0,0,0,0,0,0,1,1
deu_53bcc0f577421b282d08a38495ede8e9,Cool. Hat die Hamas mittlerweile alle Geiseln freigelassen?,0,0,0,0,0,0,0,0,0,0,0,0
deu_53ca0fd835c0e99791f37aeed8483d2d,"Ich weiss nicht was r/de für eine Bubble ist, aber ich kenne absolut niemanden der irgendwelche Sympathie für die FFF oder diese Klebeheinis hat.",1,1,0,0,0,1,1,1,1,1,1,1
deu_5409f658fa760b8a001a6fea5a10b88f,Und Russland support @USER,0,0,0,0,0,0,0,0,0,0,0,0
deu_5411e7ff113eb4f9d9b0da509dc4eee2,"Avira selbst ist das schlimmste Virus was Du haben kannst, change my mind.",0,0,0,0,0,0,0,0,0,0,0,0
deu_5414be88424d71716b2f39870002083b,"Außer Juden, die machen es extrem schwer zu konvertieren.",0,0,0,0,0,0,0,0,0,0,0,0
deu_5423f2d8b25d0d0b7027b88c45a6f2b0,"Linksgrün- extremes Lager, hast du etwas anderes erwartet?",1,1,1,0,0,0,1,0,0,0,0,0
deu_54249dcbb86b1167285acc0b5f70f96d,"Es wäre so geil, wenn sie ihre russischen Buddies erstmal insgeheim warnen würden, man solle vorsichtig sein, weil Assad ein syrischer Flüchtling ist.",1,1,1,0,0,0,1,1,1,1,1,1
deu_543058fb3d67452e1f618c27723bc04f,"Das wäre kulturelle Aneignung und damit rechtsextrem. Weiter Kiew zu schreiben, wäre wahlweise Deutschtümelei, Kolonialisierung oder der Sieg für Putin und damit auch rechtsextrem.",1,1,0,0,0,0,1,0,0,1,1,0
deu_544409b45df957c7ab4369424173710c,"Mainstream Muslime haben ein archaisches Frauenbild, sind homophob und wie du ja aktuell sehen kannst Antisemiten.",1,0,0,1,0,0,1,1,0,0,0,0
deu_5449904422ff5ecb55ef6860ad52e08b,">Transnistrien ist seit Jahren ein von Russland unterstützter und anerkannter ""Staat"".

Russland erkennt Transnistrien nicht als Staat an.",0,0,0,0,0,0,0,0,0,0,0,0
deu_544c1eb20039ef1616312d8ee0c15908,"Das glaube ich nicht, er erläutert nur, wie die sogenannte ""Gender-Ideologie"" zustande gekommen ist.",1,1,0,0,1,0,1,0,0,0,0,1
deu_54b8ef7db1f6d2c59aa8af405e8d0135,">und Israel hört auf zu siedeln.

Fun fact, Israel hat 2005 alle Siedler aus Gaza entfernt, teilweise mit Waffengewalt. Was daraus geworden ist, ist bekannt.",1,1,1,1,0,0,0,1,0,0,1,0
deu_54d93cd8b4eb4f5f465f973f23bfcefe,86qm zu zweit. Absolut zu Frieden.,0,0,0,0,0,0,0,0,0,0,0,0
deu_54fa9c00f4d2bbb04a04357886a70ce6,Häng Putin.,1,1,0,0,0,1,0,0,1,1,1,1
deu_550e7424858b7d0ef7480266bb581c80,Was ist denn diese Wokeness Ideologie?,0,0,0,0,0,0,0,0,0,0,0,0
deu_5512d02fec57f5df9e1ca1d294520ccd,Neuste russische Makro Abhörtechnik.,0,0,0,0,0,0,0,0,0,0,0,0
deu_5585fcf27df068c8fdc919a838d0877c,"Mach dich doch nicht lächerlich, jeder Querdenker sagt jetzt nur ""ich wusste ja dass wir Recht hatten, die können uns gar nichts!""",0,0,0,0,0,0,0,0,0,0,0,0
deu_55a46df0d013a7286a37bcda04291d15,🤣 Was ist denn ein asyl betrüger?,0,0,0,0,0,0,0,0,0,0,0,0
deu_55c5c337d1b163b9eae9d3cb9c77a364,Nur um das nochmals zu wiederholen. Ein paar haben es leider immer noch nicht mitbekommen. Putin. Die Antwort ist Putin.,0,0,0,0,0,0,0,0,0,0,0,0
deu_55c8ddb88ac056e8749c0528b9bd03fe,"Zusammengeschlagen werden bloß weil man kein Muslime und Deutscher ist, ist definitiv nicht harmlos.",1,0,1,1,0,0,1,1,1,1,1,0
deu_55e6c5675473fbb013564be0047e5d2e,"Wer aus einem Kriegsgebiet kommt kriegt Asyl.

Man schafft es aber nichtmal, Intensivstraftäter in Urlaubsgebiete abzuschieben.",1,1,1,0,0,0,1,1,1,1,0,0
deu_55f374eb40f5506d303ed570f768c02a,"> Ich denke, /u/Janusdarke bezieht sich da auf FFF am Peak, nicht auf die heutigen Protests von Thunberg

Genau, FFF hat seinerzeit die darauf folgende Politik der Grünen aus meiner Sicht zu Teilen erst salonfähig gemacht. 

Über die heutigen Proteste von Thunberg muss man denke ich nicht viel sagen. Schade, dass sie damit ihr Wirken so nachhaltig zerstört.",1,1,0,0,0,1,0,0,0,0,1,0
deu_55f99e182cf43da2c435805135e45e5a,"The good doctor, also Covid das Thema wurde.",0,0,0,0,0,0,0,0,0,0,0,0
deu_55fce0a01520c7f9d520c384fe40a2e3,"Wenn man Westwood Studios glauben darf, würde Stalin ein wesentlich schlimmerer Kriegstreiber und Diktator @USER",1,1,0,0,0,0,1,1,0,1,1,0
deu_561e6f5185701cd609538f4331e13873,Die neue Achse: Moskau - Erfurt,0,0,0,0,0,0,0,0,0,0,0,0
