id,text,polarization,political,racial/ethnic,religious,gender/sexual,other,stereotype,vilification,dehumanization,extreme_language,lack_of_empathy,invalidation
deu_0033bf0fd3726681fc5c746f3f7accdf,Ja genau. Nur Linke gewähren Menschen Asyl. Und Islamist steht immer groß auf die Stirn geschrieben.,1,1,1,1,0,0,1,1,1,1,0,0
deu_00356d7581da869969549469bbbe78c2,"Geil, einfach mal Menschen mit andere Ansicht als ""Querdenker"" beleidigen. Dabei hat S21 nichts mit den ""Querdenkern"" zu tun.",0,0,0,0,0,0,0,0,0,0,0,0
deu_004b3b0315a4f56097679a322b39a44f,"Ich bin eigentlich ein Freund des Konservativen, aber die verbeißen sich völlig am Thema Gendern/queer und sind korrupt wie Scheiße.",1,1,0,0,1,0,1,0,0,1,0,0
deu_004d837a0b3c80ec13b42dd2b08ebd09,"Wer soll die Parkraumüberwachung durchführen? Die Kommunen haben für weitaus dringendere Aufgaben schon keine Kapazitäten mehr. Was ein kaputter Laden, die DUH…",0,0,0,0,0,0,0,0,0,0,0,0
deu_004f6b1af00f01312c26885891279e85,Migrant ungleich Flüchtling,0,0,0,0,0,0,0,0,0,0,0,0
deu_005d9598d2565aa95504808515129990,"In Zeiten von CO2 emission und Klima/Umwelt sowas auf die Straße zu @USER @USER ich gebe mein bestes um das Klima zu retten, trinke aus Matheheften, verzichte auf Plastik und Einweg damit andere sowas hier @USER wie dieser RAM ",1,1,0,0,0,0,1,1,0,0,1,0
deu_005fc728be211eae1c308a0fc20d73df,"Ich drücke der Störchin die Daumen, Berlin ist voll linksgrün verseucht und hängt am Länderfinanzausgleich. Berlin taugt eigentlich nur zu einem Guantanamo ",1,1,1,1,1,0,1,1,1,1,1,0
deu_009afd073615b86c0ef166e9e56ffd9c,Ugurs Taschen begleiten mich länger als Long Covid. 🥹,0,0,0,0,0,0,0,0,0,0,0,0
deu_00a18a4bc96df86c3ae95eefd1794b68,"Die NSdAP wollte die deutschen Juden zuerst nach Madagaskar deportieren. ""Endlösung"" erst ab 1942.",0,0,0,0,0,0,0,0,0,0,0,0
deu_00b39936bd9eb59bd092b84054646e10,Ähnliches sagt man auch über Ausländer bzw. Muslime.,1,0,1,1,0,0,1,1,0,0,0,0
deu_00bebd4f623e9bf91e8f8ca9a9af40b8,Der Bund ist dann Schuld - ist doch klar.,1,1,0,0,0,0,0,0,0,0,0,1
deu_00c4f89fc4f6d14e95e00b56e7cda3df,Der Typ gefährdet Menschen und OP fragt sich ob man petzen darf. Soll das so eine Querdenker-Interpretation von Grunrdechten sein?,1,1,0,0,0,1,0,0,0,1,0,0
deu_00d194407ca9e342d3970b1119026f53,Die Klima Armee Fraktion wird kommen.,1,1,0,0,0,1,1,1,0,0,0,0
deu_01167c548742c8b1e5d8805b15d73209,Keine Ideologie!! Außer ihre @USER :'),0,0,0,0,0,0,0,0,0,0,0,0
deu_011bdc6d33e05365a91195e0d0a3f30e,Und ein Win für Tiere und Klima!,0,0,0,0,0,0,0,0,0,0,0,0
deu_0153386b8b55551a61ebe88b71e29ad9,Putin ist nicht alleine,0,0,0,0,0,0,0,0,0,0,0,0
deu_01644ece9402e494b105aae3468476dc,Hoffentlich verliert Putin.,0,0,0,0,0,0,0,0,0,0,0,0
deu_01752dba518bde451229303c9ef83cf3,"Kiew ist der traditionelle Name, Kyiv ist die englische Transkription aus dem Ukrainischen und Kyjiw die deutsche Transkription aus dem Ukrainischen:

@USER",0,0,0,0,0,0,0,0,0,0,0,0
deu_01bbfacf2a9e689bfd8e0d92123a8592,❗️Russische Falschinformationen❗️,1,1,1,0,0,0,1,0,0,0,0,1
deu_01c65390dead6b4ed1062130def5b10b,Scholz laviert schon von Anfang an im halbzögerlichen Raum herum und versucht es so beiden Seiten recht machen. Mittlerweile ist er allerdings für die einen Kriegstreiber und für die anderen ein Angsthase.,0,0,0,0,0,0,0,0,0,0,0,0
deu_01e2c81e1a1750393b40a40ed9ff3a23,slawen ab in die ukraine?,1,0,1,1,0,0,1,1,0,1,0,0
deu_01e7a0e55d557b2174acf00e9391e70b,Hat man ja auch in der Pandemie bei vielen Gastwirten gemerkt.,0,0,0,0,0,0,0,0,0,0,0,0
deu_020d7ac2161541caa57f67e567953b32,Das könnte die Gesamtfassung sein.,0,0,0,0,0,0,0,0,0,0,0,0
deu_022bca96f2d214806d219b2c0db8c704,Duu vergleichst hier den Co2 Verbrauch durch Autos in Deutschland mit dem Co2 Verbrauch eines Landes?,0,0,0,0,0,0,0,0,0,0,0,0
deu_023dc03329849d36b29199103d341508,Inwiefern ist Satanismus etwas anderes als Ayn-Rand-Ideologie mit edgy Ästhetik?,1,1,0,1,0,0,1,1,0,1,1,0
deu_023ea51af4480d20d88efb576b0486e1,"Danke für diese Demonstration der ""Freund oder Feind""-Mentalität die hier langsam rüberschwappt.

Hat gut beim Verständnis geholfen",1,1,0,0,0,0,0,0,0,0,1,0
deu_0253affc6d12fbda3f68735112a2d5f9,"> Man habe nichts anderes als diese Entscheidung erwartet, so DUH-Bundesgeschäftsführer Jürgen Resch. 

Wenigstens das Gericht noch etwas beschäftigt, die Kosten kann man ja dann an die S21-Kostenexplosion dranhängen /s",1,1,0,0,0,1,1,1,0,0,1,1
deu_025c014c35e8d7e7812201f46b1e1a2b,"Also es wird zumindest gerade immer verbreiteter. Ich gebe immer gerne Trinkgeld, wenn der Service gut war, aber wenn nicht dann halt nicht - und mir ist es schon mehrfach passiert, dass die Kellner dann noch extra lange mit dem Rückgeld warten, ob man nicht doch noch ""stimmt so"" sagt.  
Und dann gab es letztes Jahr noch diese Plakatwerbung von Jägermeister: ""nur für 50% der Deutschen ist Trinkgeld selbstverständlich!!"" Ja, duh.",0,0,0,0,0,0,0,0,0,0,0,0
deu_02e8c7ba2d04240e9576f878f457e2a9,"In der Pressekonferenz sagte der IDF sprecher, dass es seit dem 7. Oktover mehr als 400 failed launches gab die in Gaza @USER

Das ist definitiv nicht die erste Rakete die Zivilisten in Gaza trifft.",0,0,0,0,0,0,0,0,0,0,0,0
deu_02f1c830759cae9075675dd001cef590,"Man ohne weitere Hintergründe meinen, eine Pandemie ist gut für die Pünktlichkeit.",0,0,0,0,0,0,0,0,0,0,0,0
deu_02f4820f8cd94c2465bd66453f690bfb,"Die befindet sich auf einem Kreuzzug gegen alles was in der neurechten Sprache ""linksgrün-versifft"" bezeichnet wird. Im Grunde versucht sie das gleiche was die AFD möchte, die Uhren zurück drehen zu einer Zeit wo es Gastarbeiter gab, und Homosexualität unter Zuchthaus gestellt wurde.",1,0,1,0,1,0,1,0,1,0,1,0
deu_02f81c60d08b1fd31cdc655aa1d5d633,Nicht wenn du Putin bist,0,0,0,0,0,0,0,0,0,0,0,0
deu_0312c51f3688e05a474eef01cc7b5203,Gender bias  + angenommen deutlich höhere durchschnittliche Quote. Oder was denkst du zu Quote M/F?,0,0,0,0,0,0,0,0,0,0,0,0
deu_0319adafdbac30877e2944e8c0e8e0b2,"Hamas ist die defacto Regierung. Gibt gar keinen Unterschied, Hamas = Palästina",1,1,1,1,0,0,0,1,0,1,0,1
deu_03238a7845a4fc8c7b468b2a3d62fb3a,Ich denke kaum einer hat ein Problem mit Migration von Fachkräften. Die Realität sieht leider ziemlich ungeregelt aus und ist (leider) zu einem grossen Teil eine Migration in unsere Sozialsysteme.,1,1,1,0,0,1,1,0,0,0,1,0
deu_0323a40b019d0fa9457d382080460643,"Leider eher umgekehrt. Jede Partei hat 1-2 gute Punkte, aber der Rest ist Horror und macht diese unwählbar. Man muss eigentlich abgesprochen Protest wählen. Nein, AfD ist kein Protest mehr.",0,0,0,0,0,0,0,0,0,0,0,0
deu_0328d01e5d370c041827a8e480e729a9,"* @USER † @USER
Ruhe in Frieden",0,0,0,0,0,0,0,0,0,0,0,0
deu_032c07b5adb4e0ed48dbd31d4497e4e8,ausserdem werden mitglieder der lgbt+ community in gaza umgebracht.,0,0,0,0,0,0,0,0,0,0,0,0
deu_033737055d7cb6b8cdb5bb791c5469ba,"Es gibt - meiner Beobachtung nach - noch die ""gefühlte"" Definition wie in ""Disney goes woke"" oder aktuell ""40k goes woke"", bei der ""woke"" definiert ist als ""Irgendetwas hat sich geändert, dass mir persönlich nicht gefällt. Leute die mit dieser Veränderung kein Problem haben (oder ein Problem damit haben, aber aus anderen Gründen als ich) sind daher der Feind alles @USER",1,1,0,0,1,0,1,0,1,0,1,0
deu_03402dd2bf2ebd691ac534151afbbd34,"Achte stets auf Umweltschutz, sonst gehn wir kaputt von Schmutz und die Mutter Erde gibt es bald nicht mehr.",1,1,0,0,0,1,1,0,0,0,1,1
deu_0351e02eb1ae5582c0bef37e70d88ac0,Okay. Wobei psychischer Stress zahlreiche Formen annehmen kann. Die wiederum Auswirkungen auf das Immunsystem haben können,0,0,0,0,0,0,0,0,0,0,0,0
deu_03524d8e7ea56fa11f4aef4049c9845c,Dachte Israel hätte da aufgeräumt,1,1,1,1,0,0,0,1,1,1,1,0
deu_0354af570838412a7acda1cda88161bc,Scheiße die meine Partnerin und ich abbekommen weil sie eine Transfrau ist.,1,0,0,0,1,0,0,1,1,0,1,0
deu_03551801d3cad4779cf8fda2a5b29041,"Dumme, ignorante, Faschisten, Religiöse (im Grunde fast das gleiche), arrogante, Heuchler,  doppelmoralische, ""ich bin nicht rechts, aber"" und dann afd Wähler,  Mainstreammitläufer ('linksgrün  versiffter mainstream"" gelaber bringen, und dann das rechte Hetzblatt Bild lesen, das immer noch mehr verkauft wird, als sonst was).",1,1,0,1,0,0,1,1,0,1,0,0
deu_0360426087b78d12e731ad8c7ecc3e9e,"Nein, der Punkt ist, dass man nicht Migration für Antisemitismus in Deutschland verantwortlich machen kann. Antisemitismus geht alle was an und Migration stoppen wird Antisemitismus nicht verhindern.",0,0,0,0,0,0,0,0,0,0,0,0
deu_037da571677fd695caf048a8180686ae,"Ist wie mit Covid, der Virus machte die Regeln, ergo der Klimawandel die CO2 Steuer.

Unausweichlich.

Alternativlos.",0,0,0,0,0,0,0,0,0,0,0,0
deu_0383508f6c7ff275631b7eed784edf44,"Die Mehrheit der Gaza Bevölkerung unterstützt Hamas, und die Mehrheit der Bevölkerung ist für einen bewaffneten Konflikt mit Israel.      
  
März 2023:  
> Support for a return to armed confrontations and intifada increases from 55% to 58%  
 
Und das sind Zahlen für komplett Palästina. Im Gaza Streifen werden die Zahlen sehr viel höher sein.  

@USER   
  
'Die Gaza Bevölkerung sind alles Opfer' my ass.",1,1,1,1,0,0,1,1,1,0,1,0
deu_039450ea827b209bd7f5036cb52bdd06,Besser dem Tierheim vererben. Sonst wird die Kohle noch für irgendwelche gender Studien  weggeschmissen.,1,1,0,0,1,0,1,1,0,0,1,1
deu_039a7448ba6e055dbe64fbb942b06425,nach israel vermutlich.,0,0,0,0,0,0,0,0,0,0,0,0
deu_03c9f484924fadc4d101e555423600ef,"Nein, in ihre muslimische Brüderstaaten, da der Islam bekanntlich was Tolles ist",1,0,1,1,0,0,1,1,0,1,1,0
deu_03f2a180b376f53714b894f1b3a2935f,"Können sich ja in ""Bund der Nettosteuerzahler"" umbenennen.",1,1,0,0,0,1,0,1,0,0,0,0
deu_03f3a395fc8d06b71ef4c63806f05fa5,Hisbollah beschießt Israel mit Tausenden Raketen also ja Israel darf sich und sollte sich auch wehren.,1,1,0,0,0,0,0,0,1,1,1,0
deu_0409269b4bc98c65504e263d572ed5c8,"Gilt das ""Geklatsche"" für Pflegekräfte während der Pandemie?",0,0,0,0,0,0,0,0,0,0,0,0
deu_040d69a71fdc1e127f749184bddaee00,"&gt; Zwei Mal 0 COVID erkrankte Menschen im Land zu erreichen,

Covid ist in New Zealand mehrmals ausgebrochen, und die Menschen hatten unter drastischen Einschränkungen zu leiden ohne das zu verhindern. Mit deiner Ansicht wirst du ziemlich viel Widerspruch ernten. Auch in New Zealand.

Zero Covid als Politik ist gescheitert.",1,1,0,0,0,1,0,0,0,1,0,1
deu_04277cf621c9945b3ee502b3f3b1393f,"Wer ""Faschist"" sagt, will den Kreuz-Buben der deutschen Politik bemühen, unser berechtigten Bekenntnis zum ""Nie wieder"". Wer ""Faschist"" genannt wird, soll damit von jeder Kooperation und Debatte ausgeschlossen werden. Deswegen müssen wir vorsichtig sein und den Begriff nur da verwenden, wo er passt.",0,0,0,0,0,0,0,0,0,0,0,0
deu_0432948f79d7299d3e1cae1c2628a343,"Du drehst dich argumentativ im Kreis. Gaza war weder besetzt von Israel noch wurde es zerbombt.

Erst mit dem Überfall auf Israel von Gaza aus hat sich das geändert. Und zwar zu Recht.",1,1,1,0,0,1,1,1,1,1,1,1
deu_043b0313240e4e73a5f19681d042a41f,"> das meiner Frau und meiner zukünftigen Kinder schlechter wird. 

Ist deine Frau keine Frau? Was wenn deine zukünftigen Kinder queer werden?",1,0,0,0,1,0,0,1,0,0,1,0
deu_04609a9c6647bef16176ac836d2f9f9e,"Es wäre mir neu, dass die PKK einen Genozid an allen Türken verüben möchte.",0,0,0,0,0,0,0,0,0,0,0,0
deu_04630adc76bd41bde8b9ca8e7af5f376,"ja ja

>homophoben Menschen (quasi alle Muslime)

>ich bin weder AFD Wähler, noch Rassist

Merkste selber",1,1,1,1,1,0,1,1,1,1,1,1
deu_0465160ac4e29b5786f7e15619c5549a,"> Muslime

Islamisten, bitteschön.",1,0,1,1,0,0,1,0,0,0,0,0
deu_047ce530fe04d4b80f36ace03afe39f5,"Dauerhafte, unbegrenzte und unkontrollierte Migration bedeutet eben ununterbrochen Stress für die Gesellschaft.",1,1,0,0,0,0,1,1,1,0,1,0
deu_047f4bf0164b0d73a44146d1f4060cd5,"Religiöse Ideologie =/= Islam.

Christentum, Religion der Weltoffenheit und Toleranz.",1,0,0,1,0,0,1,0,0,1,1,1
deu_04852440eaf013080ae86eedfc81b9e8,"Oh nein, Putin macht Putin Sachen. Wie auch immer, zurück zu meinem Toastbrot.",1,1,0,0,0,0,0,1,0,0,0,1
deu_04a63ecd95e973e04a734198d424eb3c,"Auch vor Covid, während Covid und nach Covid galt und gilt: Wenn du eine ansteckende Krankheit hast, begibst du dich nicht in Gemeinschaftseinrichtungen. Sei es Grippe oder Corona ist dabei komplett egal erstmal.",0,0,0,0,0,0,0,0,0,0,0,0
deu_04a93838e38701f9c0941a5ce838028c,Lieber 2 Wochen Influenza Hölle als Long COVID Risiko.,0,0,0,0,0,0,0,0,0,0,0,0
deu_04ad9fd48d02ef23e78e68cf443e7923,Ich habe Angst ich habe unglaublich Angst als transfrau in die CDU wird mit offen rechtsextremen koalliren und ich habe Angst um meine Sicherheit und Zukunft in diesem land,0,0,0,0,0,0,0,0,0,0,0,0
deu_04c1aa153871d0e2570db393dbe06a67,"Erklärt die Corona-Fälle, definitiv!",0,0,0,0,0,0,0,0,0,0,0,0
deu_04c6700202c6516cc6d10d4342a69457,"Ich verstehe nicht, was das überhaupt bringen soll. Sehr wahrscheinlich hatte jeder mal Covid. Mit Gewissheit zu wissen, dass man mal Covid hatte, bringt einen da doch nicht weiter.

Das Problem ist, dass Long Covid keine spezifischen Symptome hat außer ein allgemeines niedergeschlagenes/geschwächtes Gefühl.",0,0,0,0,0,0,0,0,0,0,0,0
deu_04caf46c1fb45f70ab8d7e9cb756766a,"Hast du einen deutschen Pass und falls ja, fühlst du dich eher als deutsche oder araber?",0,0,0,0,0,0,0,0,0,0,0,0
deu_04e7424d9ee1a5fb43f2d91f90766078,Welche Art von Musik,0,0,0,0,0,0,0,0,0,0,0,0
deu_04f28dafbda41359362cafc147f74516,"Ob ich wohl noch ""Sie sagen sie sind für Umweltschutz, aber die Grüne Armee Fraktion wirft Molotovs aus Benzin und Styropor!"" erleben werde?",1,1,0,0,0,0,1,1,0,0,0,0
deu_0524832caf513ced6fbe7a6f248cbcc6,Die meisten Flüchtlinge sind alles andere als woke und links.,1,1,1,0,0,0,1,1,1,0,1,1
deu_053627133c173c3eb1ace85e15403e85,Der Bums muss zu 100% aufgearbeitet werden. Fehleranalyse für die nächste Pandemie,0,0,0,0,0,0,0,0,0,0,0,0
deu_05437fdcc9fec0c85daf720a1f7a4865,"Geh zu älteren Frauen, die sind weniger woke und empfänglicher.",1,1,0,0,1,1,1,1,0,0,1,0
deu_05443aaba0168e6a2d4cfef132075dd0,Mit Hund ist Klima obligatorisch,0,0,0,0,0,0,0,0,0,0,0,0
deu_0558a93a68d793c6810cbd754228d7ae,"Warum sollte Israel das auch nur ansatzweise in Betracht ziehen? Selbst **wenn** das neue Regime minimalst freundlich gegenüber Israel eingestellt **wäre**, wäre das Risiko für Israel zu hoch - für keinerlei Mehrwert.",0,0,0,0,0,0,0,0,0,0,0,0
deu_057b2b36d5192364326ef748c879e043,"Sagen wir mal so, das Immunsystem braucht auch Training",0,0,0,0,0,0,0,0,0,0,0,0
deu_057c63eee1aa9d7a27793673d7582c5f,"Antisemitismus ist in Deutschland halt nur relevant, wenn Muslime oder Linke involviert sind.",1,1,1,1,0,0,1,0,1,0,1,1
deu_05aea8f44faca3f1f3d9c20e7dd35498,Die Hamas regiert Gaza und damit einen Teil des unabhängigen Palästinas. Die Hamas führt Terroraktion durch. Gemäß deiner Logik wäre Palästina oder zumindest Gaza als Terrorstaat zu klassifizieren.,0,0,0,0,0,0,0,0,0,0,0,0
deu_05afdc635cc4181122b0917c27fdfe76,"

Nie wieder Geisel Austausch innerhalb des Gaza Streifen. Sowas darf nicht nochmal passieren!",0,0,0,0,0,0,0,0,0,0,0,0
deu_05b26ae691b19b0d59383883a09b4f20," NDA. 

Als hättest du ihn vergiftet. Dein Kumpel soll mal klar kommen. Klingt als wäre das jemand der denkt, mit veganen Lebensmitteln würde man eine ""linksgrün-versiffte"" Ideologie fördern.

Du solltest dir überlegen, ob du mit jemandem, der so abdreht wegen eines veganen Burgers, noch weiter abhängen solltest. Könnte sonst irgendwann anstrengend werden.",1,1,0,0,0,0,0,0,0,1,0,1
deu_05c663f3d91cfb583d77d0074a0e860e,Nur zur Einordnung. Laut Wissenschaftlern wäre ein fairer CO2 Preis bei etwa 280€. Also so viel Schaden richtet eine tonne CO2 an.,0,0,0,0,0,0,0,0,0,0,0,0
deu_060331cb583bb28707affd3ebe0f25c9,Strassenverkehr ist Krieg heutzutage.,0,0,0,0,0,0,0,0,0,0,0,0
deu_0631fd76cf7e72e6123d3c526058756c,"Er meint vermutlich deren Immunsystem. Das hat nicht gelernt, die richtigen Antikörper herzustellen",0,0,0,0,0,0,0,0,0,0,0,0
deu_064460707cdd10c61c5336f05b7fe50a,"Auffallend keine Ukrainische Flaggen. Dafür aber eine russenflagge links im Bild. ;) Der ""Frieden"" soll auf ukrainischen Knochen stattfinden.  Pest.",1,1,0,0,0,0,1,1,0,1,0,0
deu_0653015adfdb3249b450a8f572856f7f,"Putin zahlt, Chrupalla liefert.",0,0,0,0,0,0,0,0,0,0,0,0
deu_065690bc39e4ac30c76fb2ddc0cf8c31,"Wenn alle ""so ehrlich wären"" hätte die letzte Generation 120% mehr Mitglieder und wirklich einen Radikalen Flügel",1,1,0,0,0,1,1,1,0,0,0,1
deu_0675ae8d00c75d6576f5c702a46cdbed,"schlecht gealtert, ihr Kriegstreiber!",1,1,0,0,0,0,0,1,0,1,0,0
deu_067a0049c8d458c153539ee62ee362a7,"Ich mein die meisten im Westen hatten Kiew anfangs auch nicht viel Chancen eingeräumt. Aber wie du sagtest, unabhängig von der Dauer des Krieges hätte Russland in jedem Fall mit Konsequenzen wie diesen rechnen müssen.",0,0,0,0,0,0,0,0,0,0,0,0
deu_06965413428527f6116802465cda3421,"Ein Witz, wie Putin Fans.",0,0,0,0,0,0,0,0,0,0,0,0
deu_06d02e7d75e6a6a8640ef3e6e4ff5218,Wir sollten uns weniger um russische Gefühle kümmern.,0,0,0,0,0,0,0,0,0,0,0,0
deu_06d846dab11610281ae69639115977bb,Das ist sogar aus biologischer Sicht (sex) kompletter Schwachsinn. Zumal gender ein gesellschaftliches Konstrukt ist.,0,0,0,0,0,0,0,0,0,0,0,0
deu_06e813910d41d8a116d2486560e2f64c,"Die übernehmen alles von den Republicans in den USA. Was ist der gemeinsame Nenner? 

Putin. Es ist Putin *Aluhutaufsetz*",1,1,1,0,0,1,1,1,0,0,1,0
deu_06f6d73f193b9dd079dcde68e886cf46,"Spätestens nach den Ereignissen vom Samstag greift Godwin's Law leider nicht mehr.

Hitler — wollte die Juden ausrotten

Hamas — will die Juden ausrotten

Und da solle man nicht vergleichen?!",1,1,1,0,0,0,0,1,0,1,1,1
deu_06fedee5573a3edc39033cb9d424a51c,"wäre dann der Tag der Deutschen Keimheit gewesen

(ja ich weiß, Virus, nicht Keim, mir egal für den Spruch)",1,1,0,0,0,0,1,0,0,0,1,0
deu_070d2967b67d010b248606726acd4e46,Als Pädagoge meint er wohl Ahnung von IT zu haben… soll sich um seinen Queer job kümmern…,1,0,0,0,1,0,1,0,1,0,0,1
deu_071d16d44fd34640e87d20308c88fe80,"So lange es nicht in Strömen regnet, kann man trotzdem raus und eine Runde spazieren, ist sogar gut fürs Immunsystem 🙃",0,0,0,0,0,0,0,0,0,0,0,0
deu_0720859216a7458368c053aaa6154b4d,Es ist offensichtlich das der RN die Juden taktisch benutzt.,1,0,1,1,0,0,0,1,0,0,1,0
deu_0744e1679af3836a296f657d4a6a7f15,Das es in 50 Jahren deutlich mehr Muslime als Christen geben wird.,1,0,1,1,0,0,1,1,1,0,0,0
deu_074873542ba5e59619b636382fb906b3,"Hätte, hätte, Infektionskette.
Sag' mal, hast Du Covid verpasst? 😀",1,0,0,0,0,1,0,0,0,0,1,1
deu_0754cf9adb3e99161ffc544c48f3a96c,"Äh, das ist aber in jeder Talkshow genauso. Und der AfD-Typ war ja nicht alleine da. Ich habe nur duchgeskimmt, kann  mich also irren, aber die eigeladene Transfrau scheint ihn ganz ordentlich auseinander genommen zu haben.",0,0,0,0,0,0,0,0,0,0,0,0
deu_076c9043a69e5780eee65a458d871518,Die CO2-Emissionen werden bis 2051 kräftig zunehmen. Daher brauchen wir eine Förderung der CO2-Emissionen!,0,0,0,0,0,0,0,0,0,0,0,0
deu_07899877c1edd01bfefd8ccb0b6b9c16,"Ist das Immunsystem von einem Nazi so gut?

Frage @USER nein, nicht für Freunde. Nur rein interessehalber.",1,1,0,0,0,0,1,1,0,0,1,1
deu_079170b6f867a8b4512f6266a0e9dc97,Dennoch stammt es aus einer Ideologie mit grundlegenden faschistischen Werten.,0,0,0,0,0,0,0,0,0,0,0,0
deu_079609ccfceb3045f2db299e3f7c38fe,Andere trinken pferde entwurmer gegen covid 🤷‍♂️,1,0,0,0,0,1,1,0,0,0,1,0
deu_07b83c64a5a8893e53027c8e18a05490,"Heißt ja nicht, dass die nicht auch Unterstützung aus Moskau bekommen",0,0,0,0,0,0,0,0,0,0,0,0
deu_07e2deb5c8a1bbbbdb2355cea90aee09,Kommunismus ist eine gefährliche Ideologie!,1,1,0,0,0,0,1,1,0,0,0,0
deu_080337af489287ce8c69eeb2606d42f2,"Und wären die Rollen vertauscht, hätten die Araber die Macht über die Israelis anstatt umgekehrt, was würde passieren? Würden die Palästinenser sich von menschlichen Schutzschilden stören lassen? October 7th?",1,1,1,1,0,0,1,1,0,0,0,0
deu_0807e4d08ee6928129935c37be4e7e6e,Welt online Kommentarbereich ist nur noch Chat und Forum der Querdenker und AFD Fans,1,1,0,0,0,0,1,0,0,0,1,0
deu_080af3c7a65475ed4eb70c14ca764aa6,">Migrationsforscher, bekanntlich neutral was das Thema Migration @USER


Wer hätte das gedacht, ein Forscher, der nach Daten forscht über Migration, wäre nicht @USER",1,1,0,0,0,1,1,1,0,1,1,0
deu_08190ca45b21d1854f6d6c9168fbe7c0,Wie sollen die das machen? Die kommen ja nichtmal aus Gaza raus.,0,0,0,0,0,0,0,0,0,0,0,0
deu_082e07b0ffed880afbb9e9feab5b54c5,"Die Letzte Generation sollte die Lufthansa auch auf Schadensersatz verklagen, für einige Trillionen.",0,0,0,0,0,0,0,0,0,0,0,0
deu_086a53d3abd5bd4013331be5fdf5dea3,"Sind sie das wirklich? Ich hatte das gefühl, der hauptgrund warum man so gegen die Grünen Wahlkampf gemacht hat, war damit man aktiv gegen die Bundesregierung Wahlkampf machen kann, und damit von eigenen Problemen Ablenken kann.",0,0,0,0,0,0,0,0,0,0,0,0
deu_08736fd357fb8b605fd56c24a13ab79c,Bin selber Araber und ich glaube du kennst nicht genug Araber,0,0,0,0,0,0,0,0,0,0,0,0
deu_088f2a7fbf8ffb7e500afab2723457a1,Gender Pay Gap - warum?,0,0,0,0,0,0,0,0,0,0,0,0
deu_089bc748acdc98f83e7d1c6914d069ae,"Ja, ohne Kriegstreiber, Oligarchen und Massenmörder.",1,1,0,0,0,0,1,1,0,1,0,0
deu_08abb0d131f0ec99d10e4124f1df4b34,"Es war russische Infrastruktur. Nicht unsere Infrastruktur.

Russische Infrastruktur die überhaupt nur gebaut wurde um uns damit erpressen zu können.",1,1,0,0,0,0,1,0,0,1,1,0
deu_08b0bce2fdbe8a0a5d058e79bc5140e2,"Danke!

Die Menschen haben aus der Pandemie leider echt nix gelernt.",0,0,0,0,0,0,0,0,0,0,0,0
deu_08b0f198499d64a17f6f808ba2a0707c,"Danke - das Gleiche habe ich mir auch gedacht… „Aggro-Araber“?!? Ich dachte echt erst, dass es sich um Satire handelt, aber nein, die meinen das echt ernst",0,0,0,0,0,0,0,0,0,0,0,0
deu_08b28c71ab91c7a08faa61673bdd5506,"Die Bundeswehr ist selbst verteidigungsunfähig, wozu sollen wir uns also in diese jüdische Stammesfehde einmischen?",1,1,1,1,0,0,0,1,1,0,1,0
deu_08b6f82b1ca56a4c71c0f684deb91590,Einiges Russland (DE),0,0,0,0,0,0,0,0,0,0,0,0
deu_08b9680899c464c38490a8b778b1f4e4,"*Nur deutsche Goyim, keine deutschen Juden unter den Opfern.

Ich will absolut deinen Beitrag nicht schmälern, aber die Distinktion zwischen ""Juden"" und ""Deutschen"" sollten wir nicht aus versehen unterstützen.",0,0,0,0,0,0,0,0,0,0,0,0
deu_08cca6dce0eee9f29ca4ac07241706c7,Jeder Krieg war schon immer ein Krieg der Reichen. Sollen die sich doch gegenseitig erschießen.,1,1,0,0,0,0,1,0,0,0,1,1
deu_08d69a77bf3ea2ebdc5e93677ccbe440,"Joah Krieg ist geil Krieg ist nice mag auch Krieg ahahahahaaaa, Junge was soll man darauf antworten ?! 😂",0,0,0,0,0,0,0,0,0,0,0,0
deu_08f0665e79add1d28debe41949d35dec,Also Dr. und Fr. Ausländer-Paradies?,1,1,1,1,0,0,1,1,1,0,0,0
deu_0919c161465e3724582815692727c223,@USER Israel gewinnt.,1,1,1,0,0,0,1,1,0,0,0,1
deu_091e63e3be90f40fbd9cfc7a9eae0a2b,5 Jahre FFF war nicht genug?,0,0,0,0,0,0,0,0,0,0,0,0
deu_0927b3244df57a52438d0178ba42279d,"Behandlungen und Genesung verlangen dem Körper einiges mehr ab. Schon was an kinetischer Energie fällig wird, Zellteilung, @USER",0,0,0,0,0,0,0,0,0,0,0,0
deu_097a87ccfabd4b5d64bfe93561ab81e1,Reiche-Leute-Ideologie. Der sitzt #Tvduell,0,0,0,0,0,0,0,0,0,0,0,0
deu_09ac40240d7e434692e121934f550401,Corona ist mexikanisches Bier…,1,1,1,0,0,0,0,1,0,0,0,1
deu_09b9007c846dd10e5988626dc257aafd,Solidarität mit Israel hat halt nichts mit Einstehen für jüdische Personen zu tun. Man kann stramm antisemitisch sein und für das Existenzrecht Israels plädieren.,0,0,0,0,0,0,0,0,0,0,0,0
deu_09df5e84e2ee1661e8c42d9c888454da,"Da gibts einfachere methoden, da muss niemand einen virus auf deinen pc spielen.",0,0,0,0,0,0,0,0,0,0,0,0
deu_09ecc94476ab84230c60a9dacf6eb85c,"„Kriegstreiber“

-	Sarah Höckeknecht",1,1,0,0,0,0,0,1,1,1,1,0
deu_09fe60befa6492046a23d6ac1ba0e8f5,"Nein, Bundesland ≠ Bund! ",0,0,0,0,0,0,0,0,0,0,0,0
deu_09ffaa1008b5096c28ba6b5685607174,"> Auf dem Weg von Belarus nach Kiew konnten sie auch tausende Zivilisten töten. Wo ein Wille, ist auch ein Weg.

Es gibt keinen Krieg, bei dem keine Zivilisten getötet werden. Man muss nicht denken, man kommt da ohne drum herum.",0,0,0,0,0,0,0,0,0,0,0,0
deu_0a2d4939130e4fb2e1d7bbe5625e65de,"Nee die hatten ja die Rakete in FFF, die hatte ja auch Dreads, da war das dann auf einmal ok.",1,1,0,0,0,0,1,1,0,1,0,0
deu_0a6e4901a497d2dd6512f146c12c0b3a,Erlebst du in den letzen Jahren vermehrt  antisemitismus durch muslime?,0,0,0,0,0,0,0,0,0,0,0,0
deu_0a73f5e5fd3662f3d8eb9340b1ad6184,Corona oder Schwanger?,1,1,0,0,0,1,0,0,0,0,1,1
deu_0a77d9508ad6167267d45b3ac0cfb43b,"> oder einfach der Geist der Mitglieder?

Da man ihn beim deutschen FFF genau wegen sowas rausgeworfen hat, wohl kaum.",0,0,0,0,0,0,0,0,0,0,0,0
deu_0a9462abbbb012950ebaa6d0bf355a09,"Naja wann in dieser Kette das CO2 ausgestoßen wird ist ja egal, generell beruht das E-Fuel Konzept ja darauf CO2 zu Kraftstoff umzuwandeln und wieder auszustoßen aber eben als Kreislauf so wird das CO2 nicht mehr, aber halt auch nicht weniger.",0,0,0,0,0,0,0,0,0,0,0,0
deu_0aa92d86f27c14b94cd2b7d29dfb8e87,"Man könnte es genauso regeln.


Wenn ihr dem Vertrag zustimmt, müsst ihr helfen oder fliegt raus. Es ist aber auch nur eine 80% Zustimmungsquote für die Neuaufnahme von Mitgliedern notwendig, damit keiner wegen politischem Bullshit die Mehrheit als Geisel nimmt.

Yay or Nay?",0,0,0,0,0,0,0,0,0,0,0,0
deu_0ac2f21a66ffeb88a3dd44d82af28069,Nächste Woche Demo gegen SPD und FDP @USER Oder?,1,1,0,0,0,0,1,0,0,0,1,0
deu_0addeca1c62824f72265a86a3964c5fc,"Kinder können da auch angezogen spielen, duh. Wenn es so wäre wie du sagst, hätte das Schild sicherlich anders ausgesehen.",0,0,0,0,0,0,0,0,0,0,0,0
