id,text,polarization,political,racial/ethnic,religious,gender/sexual,other,stereotype,vilification,dehumanization,extreme_language,lack_of_empathy,invalidation
deu_81ff73c39e27cb600829750116def0d8,NDA sag dass du covid hast,0,0,0,0,0,0,0,0,0,0,0,0
deu_821205921537a4c56ab58ad54ba3a698,"Putin, nicht den Russen",0,0,0,0,0,0,0,0,0,0,0,0
deu_82186e548f5b2add7cd3dca7695cfeea,"Das wird definitiv nicht passieren, denn dann müsste Israel den Palästinensern die Staatsbürgerschaft geben und das ist das letzte was Israel will.",0,0,0,0,0,0,0,0,0,0,0,0
deu_822f3b13b427901598a2f9e0462d7eaa,"Israel hat Gaza seit Jahrzehnten besetzt, da es sowohl den Luftraum als auch die See von Palästina bei Gaza komplett kontrollierte.",0,0,0,0,0,0,0,0,0,0,0,0
deu_82580ee60279c4476955b568299784c9,"Bei ner Nuke auf Kiew wäre die Nato in 5 Minuten beim Kreml im Vorgarten, egal ob Biden im Atompilz mit aufgeht oder nicht.",1,1,0,0,0,0,1,1,1,1,0,0
deu_82901166cb11e5e1b30a0e1f5a00000c,Aber aber das ist ja die pöhse grüne Ideologie!,1,1,0,0,0,0,1,1,0,0,0,0
deu_82f0277a5336d679d49b7d757719c631,Das ist doch die letzte Generation? Oder wie meinen die das.,0,0,0,0,0,0,0,0,0,0,0,0
deu_83197f682579c101be5a73552394ca6f,"Was ist an ""Die NATO ist ein gegenseitiges Verteidigungsbündnis"" so schwer zu verstehen? Die roten Linien sind klar, waren es immer.

Also nochmal zum mitschreiben:

Russland greift NATO Land an --> NATO greift Russland an  
Russland greift kein NATO Land an --> NATO greift Russland nicht an.

Angekommen?",1,1,0,0,0,0,0,0,0,1,1,0
deu_8325854b5ff9d40e42188e7c7cc2e5d2,"> Ein Frieden in der Ukraine würde nicht den erwünschten Effekt einbringen

Was denn für ein ""Frieden""? Ein ""Frieden"" mit Massenvergewaltigungen, Folter, Kastrationen und Massenmord? 

**Das soll ""Frieden"" sein?**",1,1,0,0,0,1,1,0,1,1,1,1
deu_8338354ea6d0ea30bf7b04d8ffb6f72d,"Broke: Gigafactory

Woke: XXL-Batteriewerk",1,1,0,0,1,0,1,1,0,0,0,0
deu_8352a7696661eea99a3f78c3d60bcc82,Kann an der impfung liegen ✌🏻🤓,1,1,0,0,0,0,1,1,0,0,1,1
deu_835966fe7c1c99c0a237b687cf5955b1,"Islam ist auch eine primitive Religion und sollte, so wie jede Religion, verachtet werden. Islam ist Krebs.",1,1,0,1,0,0,1,1,1,1,0,1
deu_8362f929c3ce2c50e3ab4f71b054bcf3,"Die durch COVID geschwächten meinst du? Ja, ziemlich sicher.",0,0,0,0,0,0,0,0,0,0,0,0
deu_836edd579cf8f8722e7f884b62c77a38,Der Staat Palästina ist nicht gleich Hamas.,0,0,0,0,0,0,0,0,0,0,0,0
deu_8375f1c7d3b75ca0716aee73079f77b9,Die Pandemie ist fast 4 Jahre @USER,0,0,0,0,0,0,0,0,0,0,0,0
deu_8391aa3ece6f4313e7f62d5989479acd,Gar nicht weil mein immunsystem so krass ist das ich fast nie krank werde.,0,0,0,0,0,0,0,0,0,0,0,0
deu_839f0ea9346cf91d3d18c1d3c348d9aa,was wollen ddie dann bei uns in deutschland asyl und schutz? ekelhaft,1,1,1,0,0,0,1,1,1,1,1,0
deu_83c09ea039cd95b7aa77b15669b919dc,was für ein Querdenker ;-),0,0,0,0,0,0,0,0,0,0,0,0
deu_83ddabd1fe87f0e26b3ff65790b8443f,"Das komische ist, das die letzte Generation das anscheinend in der Stellungsnahme verteidigt.",0,0,0,0,0,0,0,0,0,0,0,0
deu_83fc1a743e1f0e62e97ebcafa1ae2de5,Ich kaufte es und bekam ein Virus,0,0,0,0,0,0,0,0,0,0,0,0
deu_842dbca970a8595dc5028e5e5cf9a174,Die deutschen FFF sind deutlich vernünftiger als Greta. Das ist keine geschlossene Bewegung,0,0,0,0,0,0,0,0,0,0,0,0
deu_842e95a2d68908619a03b33a620a7798,"""Russisch wird von fast der gesamten Bevölkerung der Ukraine beherrscht, schwerpunktmäßig aber vor allem im Osten und Süden des Landes, sowie in der Hauptstadt @USER

@USER

Und jetzt belästige mich bitte nicht weiter mit deinen alternativen Fakten!",0,0,0,0,0,0,0,0,0,0,0,0
deu_844581b1e526251599429395b094fca6,"Alle Artikel, die ich finde, sagen, dass Toyota sich vor ihrer über 5 Jahren von der DUH distanziert hat.",0,0,0,0,0,0,0,0,0,0,0,0
deu_844ec7455e385163de8e49c0f10241df,"Und der zweite Berufszweig ist die Fischerei. In meiner Stadt heulen die alle schon rum wenn man ""Umweltschutz"" nur denkt.",0,0,0,0,0,0,0,0,0,0,0,0
deu_84655410bdbded3276635245466a0c0a,"Ja du bisset. Fakten 1:1 von ARD und der Blöd Zeitung wiederkauen. Aber bei genügend linksgrün siff um einen herum, gibt's dann halt Applaus.",1,1,1,1,1,0,1,1,1,1,0,0
deu_8474766a55e9c6ef2d28c9a6aaa237ef,Ist Putin für dich rechtsextrem?,0,0,0,0,0,0,0,0,0,0,0,0
deu_84887ae98986d8678523aaa01dd6b692,"Es soll lustig sein. Hitlers Partei war braun und Herbst werden Blätter braun. Herbst steht dafür, dass sich etwas dem Ende nähert. Es wird gesagt, dass es mehr Nazis gibt.",1,1,0,0,0,1,1,0,0,0,1,0
deu_849e720c7e9acec7df2ed3f3134cf5e4,Die Putenpuppe soll nach Moskau,1,1,0,0,0,0,0,1,0,0,1,0
deu_84b2d73bb802134c5eb064693f1a5102,Und der Rest von Putin.,0,0,0,0,0,0,0,0,0,0,0,0
deu_84bb406b37f11811c7d04c5d863e7581,Fun Fact Thor Steinar wurde von nem Araber gekauft,0,0,0,0,0,0,0,0,0,0,0,0
deu_84c2290e1ba4197153a26b9f22fc0b62,Scholz wird womöglich mitten im Wahlkampf den Joe Biden machen.,1,1,0,0,0,1,0,1,1,0,0,1
deu_84cba9186e6e412bac17530503ec1b5d,die letzte generation verbieten,1,1,0,0,0,0,1,0,1,0,0,0
deu_84d7ce9e1e1c130bae9ea36b7f92e753,Putin sexiest man alive!,0,0,0,0,0,0,0,0,0,0,0,0
deu_84d95a39c32a2b5397516d6e8b8f88ec,"Was sind ""Querdenker Sticker""? Was steht da drauf?",0,0,0,0,0,0,0,0,0,0,0,0
deu_84dab3de3f43eea644380830170026df,Während Covid war es besser.,0,0,0,0,0,0,0,0,0,0,0,0
deu_84e643efc4b902fc5204fc76f1b8ab39,Mobile Klima Anlage kaufen und nutzen.,0,0,0,0,0,0,0,0,0,0,0,0
deu_84f819963c23b747b2ea2682c5e47a62,"Stop, du machst ihre Ideologie kaputt",1,1,0,0,0,0,0,0,0,0,0,1
deu_84fc4fa75168b59ffbbb5e3af04077c1,"Warum ZUM TEUFEL sollte Gott queer sein? Eine einzigartige, allwissende und allmächtige Wesenheit? Warum sollte Gott überhaupt ein Geschlecht haben? Das ist eine sooo absurde Phrase.",1,0,0,1,0,0,0,0,0,0,1,0
deu_8505e969afa74be5cdc37e806bcac71d,"Covid ist der Grund, warum fff gestorben ist. Das gesamte Momentum ist von einem Tag auf den anderen ausgenommen worden",0,0,0,0,0,0,0,0,0,0,0,0
deu_85129893c6fdecb08d18e91bd444995b,"Für alle, die es nicht gecheckt haben.

Transfrau. Also keine Frau, sondern eine Transfrau. Headline wird Frau geschrieben und darunter Transfrau. Warum man die Begriffe vermischt, ist mir nach wie vor schleierhaft.",1,0,0,0,1,0,1,0,1,0,0,1
deu_851b493e2ff8fb9f08d405170eb87130,Und die letzte Generation hat bei dir für schrecken und unsicherheit gesorgt? Tut mir leid für dich.,0,0,0,0,0,0,0,0,0,0,0,0
deu_851c256d2b5cea4327f47525e688944c,Wie sie versuchen schonmal Mitleid zu erwecken damit sie bald noch mehr importieren können hier her. Ich lese immer wieder das die Hamas die Leute als Geisel nimmt. Und Moral ist eins aber wenn du statt zu bomben 1000+ Soldaten verlierst im Häuserkampf ist die Entscheidung recht einfach.,1,1,1,0,0,0,1,1,0,1,1,0
deu_8521d9d042ecb8c3dd0e3ef137e28fc5,Die Ausländer sind aber nicht weg.,0,0,0,0,0,0,0,0,0,0,0,0
deu_852daa85b5f6b534139e679a411b8312,"„Some in Europe may be frustrated with Brussels, but let‘s be clear - if not Brussels, then Moscow. It‘s your 

Wolodymyr Selenskyj am bei der Münchner Sicherheitskonferenz",0,0,0,0,0,0,0,0,0,0,0,0
deu_8539fb7eac657d4c57c5badd19dcc53f,"Leider kann das nicht mit Russland passieren, weil Russland ein Veto Recht hat",0,0,0,0,0,0,0,0,0,0,0,0
deu_8558ebf97f9883977254e18f5f08c653,"> Einatmen, @USER Ausatmen.

Nice try, Virus!",0,0,0,0,0,0,0,0,0,0,0,0
deu_85627dd1d7eacc659b6163cd7c27ba21,"Das ich Deutsch spreche, Respekt vor Frauen habe und kein Flüchtling bin. Wurde ja hier geboren.",1,1,1,0,0,0,1,0,0,1,0,0
deu_8590aa69d618ac825b8d78f363f455e5,"Alternativ für eine Impfung statt einem Notfall, das kann auch klappen.",0,0,0,0,0,0,0,0,0,0,0,0
deu_859759059ac3df85dba612448a2c6501,"Zwei der drei Starbucks-Gründer (Siegl und Baldwin) waren auch Juden. Es kann also wirklich ganz platter ""Kauft nicht bei Juden"" Antisemitismus sein",1,0,1,1,0,0,1,1,1,0,0,0
deu_85a4402549e97a61c9f3866d839a5a28,Das liegt bestimmt an diesem CO2!,0,0,0,0,0,0,0,0,0,0,0,0
deu_85ad68f57c4bef7d43956c5a2c0891f0,"Partei der Freiheit und Liberalität, gegen Verbote, außer es geht um Arbeitnehmer. Oder Umweltschutz.",1,1,0,0,0,1,1,0,0,1,1,0
deu_8607fab4857ba71cf426e033562e7c4b,"Scheiße, kaum schlaf und habe Kopfschmerzen und mein immunsystem sagt auch schau",0,0,0,0,0,0,0,0,0,0,0,0
deu_861a34ff28ff3c8f9a3ddf9a4bd736fa,"Können wir bitte nicht die Lobhudelei auf Landesgründer einführen, die so viele Länder haben? Bismarck hat viel erreicht, war aber auch Kriegstreiber und hat ein Europa hinterlassen, das keiner mehr stabilisieren konnte.",0,0,0,0,0,0,0,0,0,0,0,0
deu_86224c95dd48053b9db84c9bdddcc621,"Du unterschätzt, wie wichtig Moskau und St Petersburg für Russland sind.",0,0,0,0,0,0,0,0,0,0,0,0
deu_8625467e2a42594547330308bde9f851,"Geil, da kommt Berlin ja endlich in den wirtschaftlichen Aufschwung, die ganzen Fachkräfte freuen sich schon drauf die nächste Queer-Vegane Dating App zu programmieren!",1,1,0,0,1,0,1,1,1,1,1,0
deu_864cf25bd250ab931a76af3379d8f30c,"Das ist kein Protest, das ist sinnlose Sachbeschädigung und sollte hart bestraft werden!",1,1,0,0,0,1,0,1,0,1,1,1
deu_86577fe170ea26d9ba45884ef5f98a58,">Die Dame am Telefon die mit mir den Termin zum Bewerbungsgespräch vereinbart hat klang nicht wie der typische Bankangestellte mit Krawatte und Lackschuhen

*Weil Frauen im Finanzwesen generell keine Krawatten tragen, duh!*",1,0,0,0,1,1,1,0,0,0,0,0
deu_866c5b6ba00ad4a6cbdaa09bb171db50,Weil die Juden deine Mobilität einschränken wollen.,1,1,1,1,0,0,1,1,1,0,0,0
deu_8676f4d8469505b4c4de33a47c7780fc,"Blödsinniges Argument. Wäre genauso zu behaupten, dass jeder, der nicht grün gewählt hat, sich nicht für Umweltschutz und Klima interessieren würde. (Wobei der Zusammenhang zwischen Grünen und Umweltschutz wieder ein ganz anderes Thema ist)",1,1,0,0,0,0,1,1,0,0,0,0
deu_868297cc4ff89d052916a64fac3edf4f,Schocks aufgrund des Ukraine-Kriegs,0,0,0,0,0,0,0,0,0,0,0,0
deu_86a4ab8ff6070bea0232eb988d43378f,Putin lurkt manchmal hier /s,0,0,0,0,0,0,0,0,0,0,0,0
deu_86b328176c0e42e3fe97c6b35ddb20aa,\*Der Islam ist eine radikale Bewegung,1,1,1,1,0,0,1,1,0,0,0,0
deu_86b668a7060cdd94ec84a03d0e7a689e,"Dagegen helfen mehr Auslandseinsätze, sagen wir zum Beispiel als Friedenstruppe im Gaza-Streifen.",0,0,0,0,0,0,0,0,0,0,0,0
deu_86c022dae786696ac09c94e652def964,Das klingt sehr stark nach Long covid r/covidlonghaulers,0,0,0,0,0,0,0,0,0,0,0,0
deu_86d0a9bafc2f5fa523c069d31a8ff8e6,International ist FFF aber auch weniger relevant als in Deutschland.,0,0,0,0,0,0,0,0,0,0,0,0
deu_86d8fbad30bc4d38aac71eef00e91a60,"@USER Influenza ist ein Virus? Ja, die Spanische Grippe ist kein ""Virus"", sondern eine Viruserkrankung, aber dein Satz lässt es so klingen als wäre es eine bakterielle oder Pilz-Erkrankung, bzw halt spezifisch kein Virus.",0,0,0,0,0,0,0,0,0,0,0,0
deu_86d9ea9789ebe2fd4388e1dd8016aaf0,Letzte Option wäre nachts um 3 beim Zahnarzt zu Hause aufzutauchen und die Kinder als Geisel zu nehmen bis der Termin aus seinem scheiß Buch verschwunden ist. Aber @USER irgendwo dazwischen.,1,1,0,0,0,1,0,1,0,1,1,0
deu_86ded985baeb64e16b636ff47de858c9,">Diejenigen kein Asyl wollen und das Vertreten müssen das aber auch ehrlich sagen.

Die nächste Frage wäre dann aber wie man Asyl definiert und was passiert wenn es nicht gewährt. Und das sind momentan sehr politisch relevante Diskussionen die 2015-2023 aktiv tot geschwiegen wurden.",0,0,0,0,0,0,0,0,0,0,0,0
deu_86e6141195521db53692fc9e0190726c,Der Islam in Europa ist ein maligner Tumor.,1,1,0,1,0,0,1,1,1,1,0,1
deu_86fb08ff79e0cb17ee8dbdd83c676e55,"Wer den Umweltschutz dem Bauernbund überlässt, bringt ihn um.",1,1,0,0,0,0,0,1,0,1,0,1
deu_8700dbcfac0c7332626d6648e4566000,Habe genügend Ukrainische Berichte gelesen das da auch haufenweise Männer vergewaltigt werden.,0,0,0,0,0,0,0,0,0,0,0,0
deu_8717114eaa51e9b31f51d22f2044fcd1,Für den kalten Krieg vielleicht.,0,0,0,0,0,0,0,0,0,0,0,0
deu_872b79634327d12d32c080f65849402f,Ist der Islam deiner Meinung nach eine friedliche Religion?,1,0,0,1,0,0,1,1,0,1,1,0
deu_87301d1288e905b22138a9e39f75439d,bitte Prototypen an die Ukraine liefern ,1,1,1,0,0,0,0,1,0,0,1,0
deu_875370160b984163b7896cc280a0f417,Die letzte Generation vor dem Grab kampieren lassen,1,0,0,0,0,1,0,0,1,1,0,0
deu_876944926c227317deec58a6ce8b0d82,"Ich sach ihnen, da geht was um, irgend so ein Virus",1,1,0,0,0,1,1,0,0,0,1,0
deu_8777ab869bf4aa9ee4b290175dc989c7,Hätt lieber ein funktionierendes Klima,0,0,0,0,0,0,0,0,0,0,0,0
deu_877977e122c9b05f147795cd85734d6d,"**Archiv:**

*Gaza: Israel meldet Entdeckung von Hamas-Tunnel unter UNRWA-Zentrale*  
@USER",0,0,0,0,0,0,0,0,0,0,0,0
deu_878f17e3077912c94e928c42d1dcaf7c,"Wenn's Scheisse ist, kommt's meistens aus Deutschland.

DB App, Post App, TK ident @USER etc PP",1,1,1,0,0,1,1,1,0,1,0,0
deu_87aebbe291c601ce240b23382b32b653,"Cool cool, 2 Sachen mit einander Verbinden die nichts mit einander zutun haben. Queer & gendern sind 2 Paar Schuhe. Und dein 'Gendergaga', de facto AfD Sprache zeigt wie gut es auf dich wirkt. Wer gendern mit Queer sein in Verbindung bringt, hat einen an der Waffel.",1,0,0,0,1,0,1,1,1,1,0,0
deu_87d693409e1d48f70376f8e8df95a9ab,"Nur weil eine kleine, aber laute und aggressive Minderheit das anders sieht, ändert es nichts daran, dass queer in Deutschland akzeptiert ist.",0,0,0,0,0,0,0,0,0,0,0,0
deu_87d9582c2370ba00c078042e2c15ad91,Absolut sinnlos dieser Hamas @USER Sind denn alle verrückt geworden? ..,0,0,0,0,0,0,0,0,0,0,0,0
deu_87fa41fb8b03a15b52feb65af7d7266a,Und keine Ausländer reinlassen!,0,0,0,0,0,0,0,0,0,0,0,0
deu_881e032c1db8dab24812fbcd10248f39,"Aber nur von Italiener oder Türken mit etwas dunklerer Hautfarbe draufrieseln lassen, sonst wirkt das nicht",1,0,1,0,0,0,1,1,0,0,0,0
deu_8831d10d13c5b87068aef2531ba54864,LG bester Wahlkampf für die AfD lol,0,0,0,0,0,0,0,0,0,0,0,0
deu_8838eaf414b9290d52d323896b0c2df2,"Es wurde auf einmal sehr ruhig, da die Ukraine nicht aus Jux und Dollerei Raketen verschießt, sondern um ihre Existenz kämpft. Ein Unfall wie er täglich überall vorkommen kann, hier leider mit einer Abwehrwaffe.

Du kannst hier bitte nicht ernsthaft mit einem Maß messen.

Es gibt einen Kriegstreiber und der heißt Russland. Hört Russland auf, ist Frieden.",1,1,0,0,0,1,1,0,0,1,0,1
deu_88445b29f99654b40d048c0b3026f1b7,Oder eine @USER Wie in meinem Fall. :(,0,0,0,0,0,0,0,0,0,0,0,0
deu_8846fd11c4943153b256f5dbcd78e5f9,"Raten Sie dem Zentralrat der Juden, auf € 22 Mio Staatsknete zu verzichten?",0,0,0,0,0,0,0,0,0,0,0,0
deu_884f7b924f87e0832bb8331efdb76f0b,"Nein, Long Covid geht nur mit Infektion, Long-Covid-*Symptome* gehen aber auch ohne. Long Covid ist eine Sammelbezeichnung für alle möglichen Symptome, die nach einer Corona-Infektion auftreten. So gut wie alle davon treten aber auch mehr oder weniger häufig bei gesunden oder anderweitig kranken Menschen auf.",0,0,0,0,0,0,0,0,0,0,0,0
deu_887bb804bfe7a70c46219d4b3fe2f182,"Ich bin mir sicher, die Leute von Letzte Generation und Fridays For Future freuen sich über alle Vorschläge für effektivere Maßnahmen.",1,1,0,0,0,1,1,1,0,0,0,0
deu_887d2efbe58b87bd395d3bc72304cde3,"
&gt;
&gt;Asyl ist eine Freundlichkeit, welche sich EU-Länder leisten, weil sie Menschen in not Situationen helfen wollen. Diese Menschen sind Gäste. 


Aus Artikel 14 der Allgemeinen Erklärung der Menschenrechte ergibt sich, dass Flüchtlinge das Recht haben, Asyl zu suchen und zu genießen.",0,0,0,0,0,0,0,0,0,0,0,0
deu_887e743ce10ba15aa9bb32868769f2ef,"Hoffentlich bin nicht wegen seiner ""homofeindliche Muslime"" Aussage. 😮‍💨",0,0,0,0,0,0,0,0,0,0,0,0
deu_888f21c5dc0ce566c6ae54695d1bb824,"Wir unterstützen Russland doch gar nicht. Achso, du meinst die leere durch Russland trotz Lieferverträge nicht versorgte Leitung. @USER schlimm. Vielleicht doch direkt in Russland einmarschieren? Denkste?",1,1,0,0,0,0,1,1,0,1,1,0
deu_88c976c042206ae18bae82f50471ab79,">Flüchtling  und stadtbekannter Verbrecher

Wobei man schon mal feststellen kann, dass das Abschieberecht ein gewaltiges Vollzugs-Defizit aufweist.",1,1,1,0,0,0,1,1,1,1,1,0
deu_88de2d04bbdbed03e5c343c8ea26a7cf,Und so entstand Covid-23.,0,0,0,0,0,0,0,0,0,0,0,0
deu_88ed53321307fcc61f2a17c1b6183ddc,"Du weißt aber schon, dass lauterbach zu Beginn der corona Pandemie kein bundesgesundheitsminister war?",0,0,0,0,0,0,0,0,0,0,0,0
deu_88ee6c81e7f14740bb32a34b45c2b540,"Denkst du, die Impfung ist auch beim nächsten Hochwasser schuld?",1,1,0,0,0,0,0,0,0,0,1,0
deu_890c1bbb994a730cb9fadc28fa7985c6,Ein Faschist tut was ein Faschist tun muss. oder so.,0,0,0,0,0,0,0,0,0,0,0,0
deu_89113f20c7bf74d5ebbbb56b3f74d792,Als Tipp für alle: Die Techniker bezahlt auch Männern unter 28 Jahren die HPV-Impfung. Ob man schon Sex hatte oder nicht ist dafür irrelevant. Die Impfung ist trotzdem wichtig!,0,0,0,0,0,0,0,0,0,0,0,0
deu_892c75ca63c8957100c31e3b57d5b800,Haben sich denn russische Truppen Prigoshin angeschlossen?,0,0,0,0,0,0,0,0,0,0,0,0
deu_893c17b4c6cb4af0655ae0c3f207e861,Deshalb ja nicht aussteigen duh.,0,0,0,0,0,0,0,0,0,0,0,0
deu_8943662c54bfc2ec6455618ab3cc0c56,Es regt mich so auf. Hier könnte man Material gegen ukrainische Leben tauschen und wir neben es nicht @USER @USER weiß nicht genau.,0,0,0,0,0,0,0,0,0,0,0,0
deu_894926406cbe49ff5a5c4234c7155719,Wenn wir eh spekulieren: Es war sicher der Jüdische Weltraumlaser!,1,1,0,1,0,1,1,1,0,0,1,0
deu_89751bc7c7ba9809aa5e7523611c1510,Wenn man keinen Krieg will soll man halt keinen Krieg anfangen.,0,0,0,0,0,0,0,0,0,0,0,0
deu_897cd3c4abb3a036a2c56d0fd2c386c5,Das wäre für Putin sehr unangenehm,0,0,0,0,0,0,0,0,0,0,0,0
deu_89d1910ac16ae4480863061c31a932e5,"Schwul sein bedeutet nicht, dass man sich der bei der LGBT Bewegung wohl fühlt. Queer ist ein von dieser Bewegung genutzter Begriff, weswegen sie dem halt nicht zustimmt.",0,0,0,0,0,0,0,0,0,0,0,0
deu_89e8e965b7e4762d9167b1eda81e0e1c,"Ja zur Zwei Staaten Lösung, nein zur Hamas Regierung in Gaza.",0,0,0,0,0,0,0,0,0,0,0,0
deu_89f5b52c2647f25ca9d5970ca5427397,"geht der ""Russische Fenstersturz"" echt noch als Verschwörungstheorie durch?",0,0,0,0,0,0,0,0,0,0,0,0
deu_89f7c2f7e9bcb651ad626c18cdf2366a,"Finnland, Ukraine, Deutschland

Bin Mal optimistisch",0,0,0,0,0,0,0,0,0,0,0,0
deu_8a2473a2fb4ad66ccffb2dbd32c5fd40,"Exakt.
Fahrlässig ist es, sonst nichts.

Long COVID wird als Lüge genutzt um die Nebenwirkungen der Impfung zu verschleiern. Hier nochmal eine Impfung drücken zu wollen ist fahrlässig.",1,0,0,0,0,1,1,1,0,1,1,1
deu_8a42bd3ad8b317c74c41bb24eec384ce,"Ich denke, das ist die russische Art der Entnazifizierung.",0,0,0,0,0,0,0,0,0,0,0,0
deu_8a4ef32a7cdd712324af0b2d56f39e71,Türken sind nicht willkommen aber Döner ist immer 😅😅,1,0,1,0,0,0,1,1,1,0,1,0
deu_8a5b8aa3588abb10764d38b603d464c3,Klima Immigration loading…,0,0,0,0,0,0,0,0,0,0,0,0
deu_8a6b2c81cd59e11122798c60a08604a5,Nö aber das Klima betrifft alle. Ein Fahrverbot hier würde dem Klima fast nichts bringen wenn vielen anderen Länder das Klima nicht juckt.,1,1,0,0,0,0,0,0,0,1,1,0
deu_8a7092fdcea5e2105755546b40ac3a1b,"Parkraumbewirtschaftung ist halt auch nicht wirklich Umweltschutz, sondern primär Einnahmequelle für die Stadt.",0,0,0,0,0,0,0,0,0,0,0,0
deu_8a74320cb54c2ee4d0491c542bd57c62,">wie entkommt man dem Flüchtlingsstatus? 

Das müsste man UNRWA und Syrien, Libanon & Jordanien fragen. Hier bekommt man als Flüchtling nach circa 8 Jahren in Deutschland die deutsche Staatsbürgerschaft, ein palästinensischer Flüchtling in Syrien & Libanon aber nach 70 Jahren noch nicht. 

Im Gegensatz zu UNRWA setzt sich UNHCR dafür ein, dass Geflüchtete eine sichere Heimat finden, wenn eine Rückkehr nicht möglich ist. UNRWA hat daran aber leider kein Interesse.",0,0,0,0,0,0,0,0,0,0,0,0
deu_8a7c08659b4c0d981d2346e493ee2175,Israel ist halt nicht in Deutschland,0,0,0,0,0,0,0,0,0,0,0,0
deu_8a8f65ffd3af7d2a716de84854938b19,"Sag mir, dass die russen dich bezahlen ohne mir zu sagen, dass die russen dich bezahlen. Faschist.",1,1,1,0,0,0,1,1,1,0,0,0
deu_8aa4c0152ca806a1c7bb205728012d96,"Ja sicher, wer mag es nicht wenn irgendwelche aggressiven Araber gegen die eigene Wohnungstür ballern.
Genau das wollte er …",1,0,1,1,0,0,1,1,1,0,0,0
deu_8abf9329e60c5415f30705210ae662e7,"Archiv:

*Wirtschaftsweise Grimm rät zur Stärkung der CO2-Bepreisung*  
@USER",0,0,0,0,0,0,0,0,0,0,0,0
deu_8aef24b32610ac93ac1a0e873ea45c00,Du meist als die Araber der UN-Teilungsplan für Palästina nicht akzeptiert haben und dann die Juden zurück ins Meer treiben wollten?,1,0,1,1,0,0,0,1,1,1,0,0
deu_8b16a3f45e21528f8798a23a4e9c7fcf,"Äußerer Feind?

russland?",0,0,0,0,0,0,0,0,0,0,0,0
deu_8b5bfbd0b3a0ce49c6a19e1ef1f75280,">Wenn man ehrlich ist, was ist die politische Veränderung von FFF?

Hatte dazu gestern schon mal etwas geschrieben:

@USER",0,0,0,0,0,0,0,0,0,0,0,0
deu_8b7f5397f9e510086e0e86ea7742dd21,"Nein von Israel, bisschen Geschichte lesen reicht völlig aus.",0,0,0,0,0,0,0,0,0,0,0,0
deu_8b83327568a78e10147c2fc854389f4e,Es gibt auch Fakten. Ich habe Stastistiken gesehen. Und ich meine der Gaza-Krieg,0,0,0,0,0,0,0,0,0,0,0,0
deu_8b8e31cd4869b8d0bf23498173d03e78,HOfFreItER DIesER aS…DeR gRößtE KRiEgstreiBER bEi DeN gRüNEn REDEt Was vON vOlKsvERÄtEr deR soll dIe scHnAUze haLTeN,1,1,0,0,0,1,0,1,1,1,1,1
deu_8b9cb501863437afd111c2583798c2ba,Schlechter Witz- es sollten Protest Mails ohne Ende zum gesendet werden!!!😡,0,0,0,0,0,0,0,0,0,0,0,0
deu_8bac58ad6c9c4a33837ed889df3b4a6b,"Ja leider sehr oft, 1,90 m 120 Kg, Glatze, Vollbart, im Gesicht 1 Narbe, und wenn ich offenere Shirts anziehe, sieht man noch um einiges mehr an Narben am ganzen Körper, also die Leute halten mich für einen Verbrecher.

&#x200B;

Wenn ich mit meiner Frau unterwegs bin Chinesin Dünn 1,58 m denken garantiert einige ich halte sie als Geisel oder so, wenn wir in asiatischen Ländern sind, ist es noch Schlimmer.

&#x200B;

Aber bin eigentlich sehr nett und sozial eingestellt.",0,0,0,0,0,0,0,0,0,0,0,0
deu_8bac770e98a3944abffa76095879db32,"Gab es ab und zu, zB @USER

Was es oft gab, war Gewalt bei Treffen auf GegendemonstrantInnen, und einige Angriffe auf JournalistInnen",0,0,0,0,0,0,0,0,0,0,0,0
deu_8be52a73cd626fc9d894393a7496c949,"Unsere Gesellschaft wäre keine liberale Demokratie, wenn man Leute nicht mehr kritisieren dürfte, die Putin und Querdenker Propagander verbreiten",0,0,0,0,0,0,0,0,0,0,0,0
deu_8bf617f1e512efe656cfdd5cfa202682,"Die Gewchichte ist folgendes:
Wieder ein Flüchtling wieder ein Messer.
Geschichte Ende.
Alles andere wäre nicht nötig wenn diese Schweine nicht hier wären.",1,1,1,0,0,0,1,0,1,1,1,0
deu_8bf6f9a7daaac1957ce4d6bb41fda030,"Good morning world
News from 🥶
#Gaza #Palestine #Genocide 
#Holocaust2024",0,0,0,0,0,0,0,0,0,0,0,0
deu_8c2ede1223d3023a166650941294fb42,Russland hat mich reagiert. Russland hat 2014 zuerst gehandelt und den Pakt gebrochen?,0,0,0,0,0,0,0,0,0,0,0,0
deu_8c49870e8e9c7f0d40fd8249dd910d47,"Muss dir Recht geben und Widersprechen gleichzeitig. Eisenach ist in Linker Hand, aber der Bernd war schon dort und wurde gebührend Empfangen: 
@USER",0,0,0,0,0,0,0,0,0,0,0,0
deu_8c59ad8d6c1df329832cb0a916304938,"""Friedensgespräche nur möglich, wenn der Weihnachtsmann zu Ostern kommt und Jack the Ripper am @USER die Kinder besucht""",1,1,0,0,0,0,0,0,0,1,1,0
deu_8c5dd7393e4ae8db634c7903623cedc0,Es wurde eine Transfrau von der Co-Chefin der Partei Die Linke geschlagen und das ist kein Skandal?,1,0,0,0,1,0,1,0,1,0,1,0
deu_8c6155dacb9455aad66b63a50c92f243,All-in ukrainische Agraraktien mit Hebel.,0,0,0,0,0,0,0,0,0,0,0,0
deu_8c635b06773455598d38caac859a2290,"Zumal ja noch der Verdacht im Raum steht, er könne 2015 als Flüchtling aus Syrien hergekommen sein. Junge, @USER",1,0,1,0,0,0,1,0,0,0,0,0
deu_8c82418a0a6c60f056bde1c6d7cb1156,"Hurra, jetzt ist das Klima gerettet.",0,0,0,0,0,0,0,0,0,0,0,0
deu_8cb6d731471f17c006e54af5606d07d7,"Bist du der Meinung, dass wir Vergewaltigern und Mördern Asyl gewähren sollten?",1,1,1,1,0,0,1,1,1,1,1,0
deu_8cbeb37fb8a61017f8e24256987f72be,"Grenzenloses wachstum ist die garantie für umweltschutz wie wir an der ddr gesehen haben, aluhut",1,1,0,0,0,1,1,1,1,1,0,0
deu_8ce6cdb1f1927bb35ef29b19e9ca9ab0,Wann neue Impfung legal?,0,0,0,0,0,0,0,0,0,0,0,0
deu_8cf41a1b990b6e2bd8c7e254a7b276b3,Warum ist Ihre Partei pro Israel?,0,0,0,0,0,0,0,0,0,0,0,0
deu_8cf883e2632dc024e27b339cc45bf7f0,Glückwunsch. Du bist ein Faschist. Falls dir das noch nicht klar war. Jetzt geh der Welt einen Gefallen tun und verbuddel dich irgendwo.,1,1,0,0,0,0,0,1,1,1,0,0
deu_8d04e71c6259d8695755f0ed084fc022,Aus welcher Quelle geht denn hervor dass die Finanziers Juden sind?,1,0,1,1,0,0,1,1,0,0,0,0
deu_8d47d25aee58c7b536842f3776fbe66e,Schade. Möge Lene in Frieden ruhen,0,0,0,0,0,0,0,0,0,0,0,0
deu_8d6f4436da9ee7c23c775d7e0e30d761,">Holz stößt nur soviel CO2 aus wie es die letzten 30 Jahren eingesammelt hat

Ja und? CO2 ist CO2. Egal ob es aus Holz oder Öl kommt.

Das Holz, was wir verbrennen, hätten wir auch als dauerhafte CO2-Speicher nutzen können. So blasen wir es hingegen wieder in die Atmosphäre.

>Ein Wald ist eine Gigantische Solaranlage.

Nein, ein Wald ist keine Solaranlage.",0,0,0,0,0,0,0,0,0,0,0,0
deu_8d716aca4b45f8ba8032478534f7c8a3,Das T-Virus kann ausbrechen,0,0,0,0,0,0,0,0,0,0,0,0
deu_8d7ec2b13aad71cb19b4f0adb8df8a40,Waffen die Frieden schaffen.,0,0,0,0,0,0,0,0,0,0,0,0
deu_8d8241ec38e291b9e623fb9f10b5f7c6,Die aus Gaza sind alle pro Hamas,1,1,1,0,0,0,1,1,0,0,0,0
deu_8d834e5cbb5a395862ed2d0d569b6de2,"Jemanden Faschist nennen dürfen =/= Jemand ist Faschist

Bei Bernd trifft es zu, aber das Gericht hat nicht darüber entschieden ob er Faschist ist.",0,0,0,0,0,0,0,0,0,0,0,0
deu_8da90a06ff15e72f719f959d7ca66b7f,"Ist auf vermutlich auf einer Ebene mit

- Hässlicher/dummer inselaffe ohne kulinarik
- Kartoffelfressender Kraut ohne Humor
- Spaghttifresser/Mafiosi
- arroganter franzose
- diebischer Pole
- explosive araber/moslem

verstanden. Stereotype halt.",1,1,1,1,0,0,1,1,1,1,0,0
deu_8dd5b63d857e1d4aa7eb4b6b9fefd76b,"Ja, aber die hassen Muslime noch mehr; da setzt man dann Prioritöten.",1,1,1,1,0,0,1,1,0,0,1,1
